A Computational Approach to Edge Detection,"John Canny, ",1986,10308,Edge-based spatial concealment of digital dropout error in degraded archived media,Edge localisation in MRI for images with signal-dependent noise,Geometric feature extraction by FTAs for finger-based biometrics system,Text detection and recognition in natural scene with edge analysis,Perceptual edge detection via entropy-driven gradient evaluation,Object virtual viewing using adaptive tri-view morphing,Edge detection for illumination varying images using wavelet similarity,Detection of local invariant features using contour,Edge-preserving colour-to-greyscale conversion,Image fusion using multiscale edge-preserving decomposition based on weighted least squares filter,High-payload block-based data hiding scheme using hybrid edge detector with minimal distortion,Human perception-based image segmentation using optimising of colour quantisation,Corner detection using Gabor filters,RANdom sample consensus (RANSAC) algorithm for enhancing overlapped etched track counting,Efficient iris localisation using a guided filter,Context aware image enhancement for online fish behaviour monitoring,Fast three-dimensional video coding encoding algorithms based on edge information of depth map,Estimation of edge displacement against brightness and camera-to-object distance,Low-complexity face recognition using contour-based binary descriptor,Multiscale adaptive regularisation Savitzky–Golay method for speckle noise reduction in ultrasound images,Hybrid model of diffusion based on the Jeffreys-type equation for noise reduction on images,Biometric analysis using fused feature set from side face texture and electrocardiogram,Image gradient histogram's fitting and calculation,Development of a Camber Measurement System in a Hot Rolling Mill,Visualization of multimodality cardiac imagery,A moment-based three-dimensional edge operator,A parametric fitting algorithm for segmentation of cell images,Automatic cardiac LV boundary detection and tracking using hybrid fuzzy temporal and fuzzy multiscale edge detection,Multiscale characterization of chronobiological signals based on the discrete wavelet transform,Detection and measurement of retinal vessels in fundus images using amplitude modified second-order Gaussian filter
Histograms of oriented gradients for human detection,"N. Dalal, B. Triggs, ",2005,7699,3D Challenges and a Non-In-Depth Overview of Recent Progress,Multi-target Tracking and Segmentation via Discriminative Appearance Model,3D City Modeling Using Cognitive Loops,Real-time vanishing point detection using the Local Dominant Orientation Signature,Match Box: Indoor Image Matching via Box-Like Scene Estimation,Learning Similarities for Rigid and Non-rigid Object Detection,Approximate 3D Partial Symmetry Detection Using Co-occurrence Analysis,Deeper Depth Prediction with Fully Convolutional Residual Networks,Automatic 3D Car Model Alignment for Mixed Image-Based Rendering,Robust Tracking in Low Light and Sudden Illumination Changes,Cascade Face Detection Based on Histograms of Oriented Gradients and Support Vector Machine,Real-time combustion state identification via image processing: A dynamic data-driven approach,Clustering Data of Mixed Categorical and Numerical Type With Unsupervised Feature Learning,Coupled Auto-Associative Neural Networks for Heterogeneous Face Recognition,Multiple Projective Dictionary Learning to Detect Plastic Surgery for Face Verification,Kinship Measurement on Face Images by Structured Similarity Fusion,Object Recognition Using Deep Convolutional Features Transformed by a Recursive Network Structure,A Practical Animal Detection and Collision Avoidance System Using Computer Vision Technique,Human Pose Estimation by Exploiting Spatial and Temporal Constraints in Body-Part Configurations,Robust Adaptive Fusion Tracking Based on Complex Cells and Keypoints,Learning Spatio-Temporal Information for Multi-Object Tracking,Photo-to-Sketch Transformation in a Complex Background,Multi-Channel Features Spatio-Temporal Context Learning for Visual Tracking,Aggregating Deep Convolutional Feature Maps for Insulator Detection in Infrared Images,A Novel Visual-Vocabulary-Translator-Based Cross-Domain Image Matching,Retargeted Multi-View Feature Learning With Separate and Shared Subspace Uncovering,Person Re-Identification by Optimally Organizing Multiple Similarity Measures,Robust Object Tracking via Large Margin and Scale-Adaptive Correlation Filter,A Semi-Supervised Image Classification Model Based on Improved Ensemble Projection Algorithm,Vehicle Detection and Counting in High-Resolution Aerial Images Using Convolutional Regression Neural Network
Eigenfaces vs. Fisherfaces: recognition using class specific linear projection,"P. N. Belhumeur, J. P. Hespanha, D. J. Kriegman, ",1997,5790,Sparse exponential discriminant analysis,A generalization of weighted sparse decomposition to negative weights,Hierarchical class-specific kernel discriminant analysis for face verification,Illumination invariant feature based on neighboring radiance ratio,Smile stages classification based on kernel Laplacian-lips using selection of non linear function maximum value,Rapid one-shot acquisition of dynamic VR avatars,Demonstration: Rapid one-shot acquisition of dynamic VR avatars,Multi-image morphing: Summarizing visual information from similar ancient coin image regions,Face recognition through mismatch driven representations of the face,Discriminant Locality Preserving Projections: A New Method to Face Representation and Recognition,On Channel Reliability Measure Training for Multi-Camera Face Recognition,Adaptive Fusion of Gait and Face for Human Identification in Video,Mosaicfaces: a discrete representation for face recognition,An analysis of facial shape and texture for recognition: A large scale evaluation on FRGC ver2.0,A sparse representation approach to face matching across plastic surgery,A novel method for post-surgery face recognition using sum of facial parts recognition,Composite Discriminant Factor analysis,Automatic 4D Facial Expression Recognition Using DCT Features,De-correlating CNN Features for Generative Classification,Unsupervised Feature Extraction Inspired by Latent Low-Rank Representation,A Multi-modal 2D + 3D Face Recognition Method with a Novel Local Feature Descriptor,Discriminative FaceTopics for face recognition via latent Dirichlet allocation,Person re-identification using multiple first-person-views on wearable devices,Describing Unseen Classes by Exemplars: Zero-Shot Learning Using Grouped Simile Ensemble,Robust feature extracted by the generalized optimal discriminant vectors for face recognition,Human facial recognition based on multiple feature domains,Face Recognition Based on Image Enhancement and Gabor Features,Face Recognition using Laplacian+OPRA-faces,Face recognition based on improved PCA reconstruction,Face recognition using improved local texture patterns
Scale-space and edge detection using anisotropic diffusion,"P. Perona, J. Malik, ",1990,5270,Noise reduction in magnetic resonance images using adaptive non-local means filtering,Improved anisotropic diffusion filtering for sar image despeckling,Improvement of nonlinear diffusion equation using relaxed geometric mean filter for low PSNR images,Recursive anisotropic diffusion denoising,Efficient algorithm for piecewise-smooth model with approximately explicit solutions,Value of graph topology in vascular biometrics,Non-subsampled contourlet transform based image Denoising in ultrasound thyroid images using adaptive binary morphological operations,Noise modelling for denoising and three-dimensional face recognition algorithms performance evaluation,Improved anisotropic diffusion equation based on new non-local information scheme for image denoising,Fast smoothing technique with edge preservation for single image dehazing,Direction sensitive wavelet packet for despeckling of ultrasound images,Non-ideal iris segmentation using anisotropic diffusion,Development and evaluation of perceptually adapted colour gradients,Non-linear fourth-order telegraph-diffusion equation for noise removal,Two anisotropic fourth-order partial differential equations for image inpainting,Image fusion using multiscale edge-preserving decomposition based on weighted least squares filter,Removing Gaussian noise for colour images by quaternion representation and optimisation of weights in non-local means filter,Efficient image sharpening and denoising using adaptive guided image filtering,Edge preservation image enlargement and enhancement method based on the adaptive Perona–Malik non-linear diffusion model,Speckle filtering of ultrasound images using a modified non-linear diffusion model in non-subsampled shearlet domain,Active contours for image segmentation using complex domain-based approach,Localised rank-ordered differences vector filter for suppression of high-density impulse noise in colour images,Diffusion-steered super-resolution method based on the Papoulis–Gerchberg algorithm,Semi-guided bilateral filter,Modified ultrasound despeckling assessment index for the Field II simulated cyst image,Sparse PDE for SAR image speckle suppression,Synthetic aperture radar image segmentation using non-linear diffusion-based hierarchical triplet Markov fields model,Dynamic RGB-to-CMYK conversion using visual contrast optimisation,Fractional-order tensor regularisation for image inpainting,Unsupervised cluster-based method for segmenting biological tumour volume of laryngeal tumours in <sup>18</sup>F-FDG-PET images
Mean shift: a robust approach toward feature space analysis,"D. Comaniciu, P. Meer, ",2002,4705
Rapid object detection using a boosted cascade of simple features,"P. Viola, M. Jones, ",2001,4689,Unsupervised 3D object recognition and reconstruction in unordered datasets,Scene Cut: Class-Specific Object Detection and Segmentation in 3D Scenes,Calibrating an Optical See-Through Rig with Two Non-overlapping Cameras: The Virtual Camera Framework,Constraint Integration for Multiview Pose Estimation of Humans with Self-Occlusions,Multi-user glasses free 3D display using an optical array,Free-hand gesture control with touchable virtual interface for human-3DTV interaction,Training-Based Object Recognition in Cluttered 3D Point Clouds,Detecting Objects in Scene Point Cloud: A Combinational Approach,Vision-Based Differential GPS: Improving VSLAM / GPS Fusion in Urban Environment with 3D Building Models,Robust Real-Time 3D Face Tracking from RGBD Videos under Extreme Pose Depth and Expression Variation,Visual tracking of human visitors under variable-lighting conditions for a responsive audio art installation,Cyber-Physical Signage Interacting With Gesture-Based Human–Machine Interfaces Through Mobile Cloud Computing,A Practical Animal Detection and Collision Avoidance System Using Computer Vision Technique,Development of Novel Lip-Reading Recognition Algorithm,Assisting Attraction Classification by Harvesting Web Data,Heart Rate Variability Extraction From Videos Signals: ICA vs. EVM Comparison,Improving the Detection of Noise Artifacts in Gravitational-Wave Data With a Classifier Graph,Learning-Based Saliency Detection of Face Images,Elliptical Higher-Order-Spectra Periocular Code,Feature-Based Resource Allocation for Real-Time Stereo Disparity Estimation,A Novel Technique for Robust and Fast Segmentation of Corneal Layer Interfaces Based on Spectral-Domain Optical Coherence Tomography Imaging,A Review and Analysis of Eye-Gaze Estimation Systems Algorithms and Performance Evaluation Methods in Consumer Platforms,Research on Automatic Parking Systems Based on Parking Scene Recognition,Face Feature Extraction: A Complete Review,Dataset Optimization for Real-Time Pedestrian Detection,A Fast Single-Image Dehazing Method Based on a Physical Model and Gray Projection,Auxiliary Loss Multimodal GRU Model in Audio-Visual Speech Recognition,Corrected Continuous Correlation Filter for Long-Term Tracking,Tailoring Model-Based Techniques to Facial Expression Interpretation,Multiple Parallel Vision-Based Recognition in a Real-Time Framework for Human-Robot-Interaction Scenarios
Space-time block codes from orthogonal designs,"V. Tarokh, H. Jafarkhani, A. R. Calderbank, ",1999,4625,Computationally efficient linear predictor for communication over doubly selective fast-fading channel,On Performance of Space-Time Eigenbeam Coding,A QRD-Based Chase Decoding Algorithm for Quasi-Orthogonal Space-Time Block Code Systems,An Efficient Rate One STBC Scheme with 3 Transmit Antennas,Performance Comparison of Different Space-Time Block Codes Using A Single Receiver,A Novel Transmission Scheme with Relay Selection and HARQ in Decoded-and-Forward Mode of Cooperative Network,Error and Outage Performance of STBC MB-OFDM UWB,Space-Time Block Codes Assisted by Fast Turbo Codes,Special Property of Multiple-Trellis-Coded-Modulation Utilized for its Decoding,A Space Time Block Code from Quaternion Quasi-Orthogonal Design,Different Space-Time Modulation with Adaptive Loaded Eigen-Beamforming for Correlated Fading Channels,An Adaptive Space-Time Receiver for Time-Varying Channel with Imperfect Channel Estimation,Eigen-Beamforming Applied in STBC Multiplexing System,Outage probability of MIMO cognitive cooperative radio networks with multiple AF relays using orthogonal space-time block codes,Distributed Closed-Loop Quasi-Orthogonal Space Time Block Coding with four relay Nodes: overcoming Imperfect Synchronization,Link level performance analysis of adaptive MIMO-OFDM systems,Localization Algorithm Based on RSSI and Distance Geometry Constrain for Wireless Sensor Network,Ant-Colony Based Near-ML Block Decoder in Asynchronous Cooperative MIMO Systems Using a Linear Dispersion Structure,Efficient Iterative Decoding of Serially Concatenated Multiplexed Alamouti Codes,Is Transmit Beamforming Robust?,Linear Dispersion Codes for Asynchronous Cooperative MIMO Systems,Impact of Arbitrary Co-Channel MIMO Modes on Alamouti Coding under Path-Loss and Rayleigh Fading,Cooperative Diversity in Coded CDMA Systems over Frequency-Selective Fading Channels,Downlink Performance of a Multi-Carrier MIMO System in a Bursty Traffic Cellular Network,Eavesdropping-Resistant Space-Time Network Coding for Cooperative Communications,A Cross-Layer Architecture for Motion-Adaptive Video Transmission over MIMO Channels,On the Capacity of Multiple Cognitive Links through Common Relay under Spectrum-Sharing Constraints,OSTBC Transmission in MIMO AF Relay Systems with Keyhole and Spatial Correlation Effects,Space-Time Block Coded Transmission with Phase Feedback for Two-User MIMO-MAC,UKF Based Iterative Joint Channel Estimation for Uplink Two Dimensional Block Spread Wireless Networks
Active contours without edges,"T. F. Chan, L. A. Vese, ",2001,4319,Active contours driven by regularised gradient flux flows for image segmentation,Robust local–global SOM-based ACM,Robust active contours for fast image segmentation,Beta-divergence based two-phase segmentation model for synthetic aperture radar images,Illumination variation interference suppression in remote PPG using PLS and MEMD,Efficient algorithm for piecewise-smooth model with approximately explicit solutions,Active contours driven by novel fitting term for image segmentation,Active contours driven by novel LGIF energies for image segmentation,Identifying radiotherapy target volumes in brain cancer by image analysis,Dental radiographs and photographs in human forensic identification,Elastic strips normalisation model for higher iris recognition performance,Global variational method for fingerprint segmentation by three-part decomposition,Shape and appearance priors for level set-based left ventricle segmentation,Probabilistic shape-based segmentation method using level sets,Local feature fitting active contour for segmenting vessels in angiograms,Gradient descent with adaptive momentum for active contour models,Vertebral body segmentation using a probabilistic and universal shape model,Locally adaptive combining colour and depth for human body contour tracking using level set method,Multiplayer tracking system for short track speed skating,Automatic method for white matter lesion segmentation based on T1-fluid-attenuated inversion recovery images,Computer-aided mammogram diagnosis system using deep learning convolutional fully complex-valued relaxation neural network classifier,Fusion of structural and textural features for melanoma recognition,Neighbourhood weighted fuzzy c-means clustering algorithm for image segmentation,Active contour driven by local divergence energies for ultrasound image segmentation,Saliency-based localising active contour for automatic natural object segmentation,Annularcut: A graph-cut design for left ventricle segmentation from magnetic resonance images,Active contours with a joint and region-scalable distribution metric for interactive natural image segmentation,Active contours for image segmentation using complex domain-based approach,Fast localised active contour for inhomogeneous image segmentation,Minimisation of local within-class variance for image segmentation
