Identifiability of the Simplex Volume Minimization Criterion for Blind Hyperspectral Unmixing: The No-Pure-Pixel Case,"Chia-Hsiang Lin, Wing-Kin Ma, Wei-Chiang Li, Chong-Yung Chi, ArulMurugan Ambikapathi, ",2015,8,Minimum-volume-regularized weighted symmetric nonnegative matrix factorization for clustering,A fast hyperplane-based MVES algorithm for hyperspectral unmixing,Robust volume minimization-based matrix factorization via alternating optimization,A stochastic maximum-likelihood framework for simplex structured matrix factorization,On Identifiability of Nonnegative Matrix Factorization,A Convex Optimization-Based Coupled Nonnegative Matrix Factorization Algorithm for Hyperspectral and Multispectral Data Fusion,Blind Separation of Quasi-Stationary Sources: Exploiting Convex Geometry in Covariance Domain,A Fast Hyperplane-Based Minimum-Volume Enclosing Simplex Algorithm for Blind Hyperspectral Unmixing,Robust Volume Minimization-Based Matrix Factorization for Remote Sensing and Document Clustering,The linear mixed model constrained particle swarm optimization for hyperspectral endmember extraction from highly mixed data
Remote Sensing Scene Classification by Unsupervised Representation Learning,"Xiaoqiang Lu, Xiangtao Zheng, Yuan Yuan, ",2017,6,Robust Quantization for General Similarity Search,Duplex Metric Learning for Image Set Classification,Spatially Adaptive Sparse Representation for Target Detection in Hyperspectral Images,Spatiotemporal Fusion of MODIS and Landsat-7 Reflectance Images via Compressed Sensing,On Combining Social Media and Spatial Technology for POI Cognition and Image Localization,Robust Minimum Volume Simplex Analysis for Hyperspectral Unmixing,GPU Parallel Implementation of Isometric Mapping for Hyperspectral Classification,Auxiliary Loss Multimodal GRU Model in Audio-Visual Speech Recognition,Multiview Intensity-Based Active Learning for Hyperspectral Image Classification,Feature-Driven Active Learning for Hyperspectral Image Classification,Exploring Models and Data for Remote Sensing Image Caption Generation,Joint Reconstruction and Anomaly Detection From Compressive Hyperspectral Images Using Mahalanobis Distance-Regularized Tensor RPCA,When Deep Learning Meets Metric Learning: Remote Sensing Image Scene Classification via Learning Discriminative CNNs,Hyperspectral Image Classification With Deep Feature Fusion Network
Learning Compact Geometric Features,"Marc Khoury, Qian-Yi Zhou, Vladlen Koltun, ",2017,0
Learning Sparse Representation for Objective Image Retargeting Quality Assessment,"Qiuping Jiang, Feng Shao, Weisi Lin, Gangyi Jiang, ",2018,1,Multiple-Level Feature-Based Measure for Retargeted Image Quality,Quality Assessment of Retargeted Images Using Hand-Crafted and Deep-Learned Features
Latent Semantic Minimal Hashing for Image Retrieval,"Xiaoqiang Lu, Xiangtao Zheng, Xuelong Li, ",2017,20,Social Media: New Perspectives to Improve Remote Sensing for Emergency Response,Remote Sensing Scene Classification by Unsupervised Representation Learning,Feature-Driven Active Learning for Hyperspectral Image Classification,Exploring Models and Data for Remote Sensing Image Caption Generation,Learning to Hash With Optimized Anchor Embedding for Scalable Retrieval,Revealing Event Saliency in Unconstrained Video Collection,Learning Multilayer Channel Features for Pedestrian Detection,A General Framework for Edited Video and Raw Video Summarization,Zero-Shot Learning With Transferred Samples,Image Re-Ranking Based on Topic Diversity,Hierarchical Recurrent Neural Hashing for Image Retrieval With Hierarchical Convolutional Features,Tensor Rank Preserving Discriminant Analysis for Facial Recognition,Robust Quantization for General Similarity Search,Unsupervised Deep Hashing With Pseudo Labels for Scalable Image Retrieval,Image Location Inference by Multisaliency Enhancement,Graph PCA Hashing for Similarity Search,Triplet-Based Deep Hashing Network for Cross-Modal Retrieval,Key Frame Extraction in the Summary Space,End-to-End Feature-Aware Label Space Encoding for Multilabel Classification With Many Classes
SceneNN: A Scene Meshes Dataset with aNNotations,"Binh-Son Hua, Quang-Hieu Pham, Duc Thanh Nguyen, Minh-Khoi Tran, Lap-Fai Yu, Sai-Kit Yeung, ",2016,4,A dense semantic mapping system based on CRF-RNN network,ScanNet: Richly-Annotated 3D Reconstructions of Indoor Scenes,SceneNet RGB-D: Can 5M Synthetic Images Beat Generic ImageNet Pre-training on Indoor Segmentation?,Earthquake Safety Training through Virtual Drills,Eyes in the Dark: Distributed Scene Understanding for Disaster Management,Colored Point Cloud Registration Revisited,Learning Compact Geometric Features
Vehicle detection using simplified fast R-CNN,"Shih-Chung Hsu, Chung-Lin Huang, Cheng-Hung Chuang, ",2018,0
Human Object Identification for Human-Robot Interaction by Using Fast R-CNN,"Shih-Chung Hsu, Yu-Wen Wang, Chung-Lin Huang, ",2018,0
Forward Vehicle Detection Based on Incremental Learning and Fast R-CNN,"Kaijing Shi, Hong Bao, Nan Ma, ",2017,0
Scale-Aware Fast R-CNN for Pedestrian Detection,"Jianan Li, Xiaodan Liang, Shengmei Shen, Tingfa Xu, Jiashi Feng, Shuicheng Yan, ",2018,0
MRCNN: A stateful Fast R-CNN,"Philippe Burlina, ",2016,0
Use fast R-CNN and cascade structure for face detection,"Kai Wang, Yuan Dong, Hongliang Bai, Yu Zhao, Kun Hu, ",2016,0
Road surface traffic sign detection with hybrid region proposal and fast R-CNN,"Rongqiang Qian, Qianyu Liu, Yong Yue, Frans Coenen, Bailing Zhang, ",2016,1,Fast and Lightweight Object Detection Network: Detection and Recognition on Resource Constrained Devices,A vision system for traffic sign detection and recognition
Salient object detection via fast R-CNN and low-level cues,"Xiang Wang, Huimin Ma, Xiaozhi Chen, ",2016,1,Multi-scale self-searching saliency detection combined with rectangular diffusion,Salient object detection by combing eye fixation prediction and semantic segmentation,Edge Preserving and Multi-Scale Contextual Neural Network for Salient Object Detection
Coarse-to-fine human parsing with Fast R-CNN and over-segment retrieval,"Feng Wang, Zhi Li, Qingshan Liu, ",2016,0
Fast R-CNN,"Ross Girshick, ",2015,540,SceneNN: A Scene Meshes Dataset with aNNotations,Mobile Augmented Reality Survey: From Where We Are to Where We Go,An Improved Faster R-CNN for Same Object Retrieval,Scene-Adaptive Vehicle Detection Algorithm Based on a Composite Deep Structure,G-CNN: Object Detection via Grid Convolutional Neural Network,Development of Home Intelligent Fall Detection IoT System Based on Feedback Optical Flow Convolutional Neural Network,Vehicle Detection and Counting in High-Resolution Aerial Images Using Convolutional Regression Neural Network,Cascaded Regional Spatio-Temporal Feature-Routing Networks for Video Object Detection,Detection of Human Falls on Furniture Using Scene Analysis Based on Deep Learning and Activity Characteristics,Fast and Lightweight Object Detection Network: Detection and Recognition on Resource Constrained Devices,CNN based 3D facial expression recognition using masking and landmark features,Transfer of multimodal emotion features in deep belief networks,Faster R-CNN based autonomous navigation for vehicles in warehouse,SPARCNN: Spatially related convolutional neural networks,Efficient object detection for high resolution images,Stop line detection and distance measurement for road intersection based on deep learning neural network,Understanding CNN via deep features analysis,A framework based on deep learning and mathematical morphology for cabin door detection in an automated aerobridge docking system,Estimation system of construction equipment from field image by combination learning of its parts,Object-recognition VLSI for pedestrian detection in automotive applications,CNN-based object detection solutions for embedded heterogeneous multicore SoCs,End-to-end object detection and recognition in forward-looking sonar images with convolutional neural networks,Convolutional neural network-based real-time ROV detection using forward-looking sonar image,Fast CNN surveillance pipeline for fine-grained vessel classification and detection in maritime scenarios,Robust license plate detection in the wild,Semantic labeling for improved vehicle detection in aerial imagery,Using deep networks for drone detection,A study on detecting drones using deep convolutional neural networks,A novel method for lung masses detection and location based on deep learning,Ship detection in SAR images based on an improved faster R-CNN
