Hypertext: An Introduction and Survey,"J. Conklin, ",1987,910,Building intelligent tutorial systems for teaching simulation in engineering education,CASPER: a hypermedia departmental information system,Developing hypertext-based learning courseware for computer networks: the macro and micro stages,Assessing the utility of an interactive electronic book for learning the Pascal programming language,Integrating diverse information repositories: a distributed hypertext approach,The usability engineering life cycle,Supporting document development with Concordia,Finding facts vs. browsing knowledge in hypertext systems,Intermedia: the concept and the construction of a seamless information environment,Content-addressable and associative memory: alternatives to the ubiquitous RAM,Knowledge based systems applied to the design of electrical devices,Browsing in hypertext: a cognitive study,A hypertext software package to help document system designs,A system for aiding creative concept formation,The C information abstraction system,Supporting search for reusable software objects,The evolution support environment system,Engineering software design processes to guide process execution,Multi-media information services: a laboratory study,Interacting with databases in the global information infrastructure,A survey and classification of hypertext documentation systems,Collaborative writing with hypertext,Metaphorical perspectives on hypertext,Preparing the technical communicator of the future,Modeling logical and temporal synchronization in hypermedia systems,Synchronization and storage models for multimedia objects,RAVI a proposed standard for the interchange of audio/visual interactive applications,Image understanding environments,Distributed multimedia systems,Hypermedia data modeling coding and semiotics
The eyes have it: a task by data type taxonomy for information visualizations,"B. Shneiderman, ",1996,899,Features of conceptual blending in the context of visualisation,VAST Challenge 2014 — The Kronos incident — Mini-Challenge 3,Supporting visual exploration for multiple users in large display environments,PorosityAnalyzer: Visual analysis and evaluation of segmentation pipelines to determine the porosity in fiber-reinforced polymers,Visualizing causes and effects of California sea lion unusual mortality event (UME),A task oriented view of software visualization,Software Visualization - A Process Perspective,Generating visualization-based analysis scenarios from maintenance task descriptions,Live trace visualization for comprehending large software landscapes: The ExplorViz approach,Lightweight software reverse engineering using augmented matrix visualizations,Polyptychon: A Hierarchically-Constrained Classified Dependencies Visualization,Exploring software cities in virtual reality,MetaVis: Exploring Actionable Visualization,Walls Pillars and Beams: A 3D Decomposition of Quality Anomalies,A Low-Effort Analytics Platform for Visualizing Evolving Flask-Based Python Web Services,A Scalable Visualization for Dynamic Data in Software System Hierarchies,Visual correlation of host processes and network traffic,IDGraphs: intrusion detection and analysis using histographs,PERCIVAL: proactive and reactive attack and response assessment for cyber incidents using visual analytics,Bitconeview: visualization of flows in the bitcoin transaction graph,EulerView: a non-hierarchical visualization component,Does My Model Work? Evaluation Abstractions of Cognitive Modelers,Just model! — Putting automatic synthesis of node-link-diagrams into practice,Visual analysis of compound graphs,Visualization of Memory Access Behavior on Hierarchical NUMA Architectures,TorusVis^ND: Unraveling High-Dimensional Torus Networks for Network Traffic Visualizations,IPSViz: An After-Action Review Tool for Human-Virtual Human Experiences,Visualization of network data for effective semantic analysis,Reverse Engineering Super-Repositories,Analyzing PL/1 legacy ecosystems: An experience report
Ridge-based vessel segmentation in color images of the retina,"J. Staal, M. D. Abramoff, M. Niemeijer, M. A. Viergever, B. van Ginneken, ",2004,894,Vascular Tree Construction with Anatomical Realism for Retinal Images,A Local Adaptive Segmentation of Vascular Network from Abnormal Retinal Images,An automated blood vessel extraction algorithm in fundus images,Robust retinal vessel segmentation via clustering-based patch mapping functions,Feature point validation for improved retina recognition,Automatic optic disc detection using retinal background and retinal blood vessels,Retinal vascular feature analysis using color fundus imaging,A Multi-resolution Entropic-Based Image Processing Technique for Diagnostic Analysis of Microcirculation Videos,Vessel Extraction of Microcirculatory Video Recordings Using Multi-thresholding Based Verification Algorithm,An Improved Retinal Vessel Segmentation Method Based on Supervised Learning,Vessel segmentation and analysis in laboratory skin transplant micro-angiograms,A fully automated system for retinal vessel tortuosity diagnosis using scale dependent vessel tracing and grading,RIM-ONE: An open retinal image database for optic nerve evaluation,Detection of retinal vascular bifurcations by rotation- scale- and reflection-invariant COSFIRE filters,Graph-based minimal path tracking in the skeleton of the retinal vascular network,Mean curvature and texture constrained composite weighted random walk algorithm for optic disc segmentation towards glaucoma screening,Local feature fitting active contour for segmenting vessels in angiograms,Retinal vessel segmentation by improved matched filtering: evaluation on a new high-resolution fundus image database,Automatic and quick blood vessels extraction algorithm in retinal images,Robust retinal blood vessel segmentation using line detectors with multiple masks,Retinal Fundus Image Analysis for Diagnosis of Glaucoma: A Comprehensive Survey,Fast Optic Disc Segmentation in Retina Using Polar Transform,Automated Quality Assessment of Fundus Images via Analysis of Illumination Naturalness and Structure,Line Junction Detection Without Prior-Delineation of Curvilinear Structure in Biomedical Images,Drusen Segmentation From Retinal Images via Supervised Feature Learning,Impact of ICA-Based Image Enhancement Technique on Retinal Blood Vessels Segmentation,Detection and phenotyping of retinal disease using AM-FM processing for feature extraction,Screening fundus images for diabetic retinopathy,Neuron segmentation with level sets,Investigating image enhancement methods for better classification of retinal blood vessels into arteries and veins
Quantitative Investigation of QRS Detection Rules Using the MIT/BIH Arrhythmia Database,"Patrick S. Hamilton, Willis J. Tompkins, ",1986,479,ECG signal analysis using modified S-transform,Multiresolution wavelet-based QRS complex detection algorithm suited to several abnormal morphologies,Remote health monitoring system for detecting cardiac disorders,Neural-network-based adaptive matched filtering for QRS detection,Compression of the ambulatory ECG by average beat subtraction and residual differencing,An approach to QRS complex detection using mathematical morphology,Event-synchronous cancellation of the heart interference in biomedical signals,Nonlinear transforms of ECG signals for digital QRS detection: a quantitative analysis,Detection of ECG characteristic points using wavelet transforms,A comparison of the noise sensitivity of nine QRS detection algorithms,Genetic design of optimum linear and nonlinear QRS detectors,A real-time microprocessor QRS detector system with a 1-ms timing accuracy for the measurement of ambulatory HRV,ECG coding by wavelet-based linear prediction,ECG beat detection using filter banks,Wavelet transform-based QRS complex detector,ECG signal compression using analysis by synthesis coding,Signal processing and pattern recognition with soft computing,Using wavelet transforms for ECG characterization. An on-line digital signal processing system,The principles of software QRS detection,Self-organizing QRS-wave recognition in ECG using neural networks,Design of a Real-Time ECG Filter for Portable Mobile Medical Systems,A Continuous Change Detection Mechanism to Identify Anomalies in ECG Signals for WBAN-Based Healthcare Environments,Adaptive Filters For Digital AGC As Applied To Abnormal Holter ECG,ST-segment analysis for ambulatory ECG using cumulative ST waveform,The dyadic wavelet transform based QRS detector (ECG analysis),ECG Delineation using Stationary Wavelet Transform,A Proposal of Web Based SNMP Management for Embedded System Applying in Pattern Recognition Using Wavelet Transform,Classifying Normal Sinus Rhythm and Cardiac Arrhythmias in ECG Signals Using Statistical Features in Temporal Domain,New method for QRS-wave recognition in ECG using MART neural network,Detection of QRS complex in electrocardiogram signal based on a combination of hilbert transform wavelet transform and adaptive thresholding
Data mining with big data,"Xindong Wu, Xingquan Zhu, Gong-Qing Wu, Wei Ding, ",2014,478,Privacy preserving big data mining: association rule hiding using fuzzy logic approach,Efficient method for finding globally optimal solution of problem with weighted L<sub>p</sub> norm and L<sub>2</sub> norm objective function,A Map Reduce-Based Nearest Neighbor Approach for Big-Data-Driven Traffic Flow Prediction,Temporal Dynamic Matrix Factorization for Missing Data Prediction in Large Scale Coevolving Time Series,Big IoT Data Analytics: Architecture Opportunities and Open Research Challenges,Privacy-Preserving Comparison of Variable-Length Data With Application to Biometric Template Protection,Machine Learning With Big Data: Challenges and Approaches,Knowledge Engineering With Big Data (BigKE): A 54-Month 45-Million RMB 15-Institution National Grand Project,Industrial Big Data Analysis in Smart Factory: Current Status and Research Strategies,Entity Linking: An Issue to Extract Corresponding Entity With Knowledge Base,Clustering Approach Based on Mini Batch Kmeans for Intrusion Detection System Over Big Data,Classification and evaluation of Privacy Preserving Data Mining: A review,Power grid's Intelligent Stability Analysis based on big data technology,Big data integration: A semantic mediation architecture using summary,Increasing the veracity of event detection on social media networks through user trust modeling,A survey on semantic Web and big data technologies for social network analysis,Spatial data dimension reduction using quadtree: A case study on satellite-derived solar radiation,Crack random forest for arbitrary large datasets,Group privacy-aware disclosure of association graph data,Two Steps Genetic Programming for Big Data - Perspective of Distributed and High-Dimensional Data,Optimal and Efficient Distributed Online Learning for Big Data,Meta Data: Big Data Research Evolving across Disciplines Players and Topics,Big Data Open Source Platforms,Big Data Analytics Framework for System Health Monitoring,Privacy-Aware Big Data Warehouse Architecture,Security-Aware Information Classifications Using Supervised Learning for Cloud-Based Cyber Risk Management in Financial Big Data,Enriched Over_Sampling Techniques for Improving Classification of Imbalanced Big Data,Incremental Learning for Compressed Pornographic Image Recognition,Research on Big Data Real-Time Public Opinion Monitoring under the Double Cloud Architecture,Big data platform &amp; typical APP services for urban public transportation
KPCA plus LDA: a complete kernel Fisher discriminant framework for feature extraction and recognition,"Jian Yang, A. F. Frangi, Jing-Yu Yang, David Zhang, Zhong Jin, ",2005,476,Misalignment-robust face recognition,Joint and implicit registration for face recognition,Bayes optimal kernel discriminant analysis,Kernel-PCA Analysis of Surface Normals for Shape-from-Shading,Wavelet Kernel Construction for Kernel Discriminant Analysis on Face Recognition,Session variability modelling for face authentication,Multi-beam pattern synthesis algorithm based on kernel principal component analysis and semi-definite relaxation,Optimisation of automatic face annotation system used within a collaborative framework for online social networks,A Comparative Study of PCA LDA and Kernel LDA for Image Classification,Greedy Approximation of Kernel PCA by Minimizing the Mapping Error,Weighted Complete Linear Discriminant Analysis and Its Application to Face Recognition,Fuzzy maximum scatter discriminant analysis with kernel methods,Online fractal dimensionality reduction in time decaying stream environment,Integrating fractal dimensionality reduction with cluster evolution tracking,A novel fuzzy supervised learning method with dynamical parameter estimation for discriminant analysis,A new approach to dimensionality reduction based on locality preserving LDA,Manifold based fisher method for semi-supervised feature selection,A generalized Kernel Fisher Discriminant framework used for feature extraction and face recognition,Feature extraction using fuzzy complete linear discriminant analysis,A Robust Dimensionality Reduction Method from Laplacian Orientations,Multimodal Biometric Recognition Based on Complex KFDA,Image Recognition Based on Kernel Self-Optimized Learning,Neighborhood Discriminant Nearest Feature Line Analysis for Face Recognition,Investigation of nonlinear orthogonal signal correction algorithm and its effects on multivariate calibration,An experimental framework for evaluation of facial feature extraction methods,A kernelized discriminant analysis algorithm based on modified generalized singular value decomposition,Orthogonalized discriminant analysis based on generalized singular value decomposition,Makeup-robust face verification,The multi-space generalization of total projection to latent structures (MsT-PLS) and its application to online process monitoring,Intermediate layer optimization of HMAX model for face recognition
Information visualization and visual data mining,"D. A. Keim, ",2002,473,Scalable graph exploration and visualization: Sensemaking challenges and opportunities,From Visualization to Visual Mining: Application to Environmental Data,Clustering Based on Data Attribute Partition and Its Visualization,Developing an approach for analyzing and verifying system communication,Enhanced visual evaluation of feature extractors for image mining,Survey of information visualization techniques for exploitation in KDD,New Multi-Agent architecture of visual Intelligent Decision Support Systems application in the medical field,Using Bloom's taxonomy to enhance interactive concentric circles representation,Visualizing the Yield Pattern Outcome for Automatic Data Exploration,Interactive visual analysis of miRNA target prediction results,VisReduce: Fast and responsive incremental information visualization of large datasets,Shaping data: Visualization under construction,Data Abstraction and Visualisation in Next Step: Experiences from a Government Services Delivery Trial,Interactive Visualization of Normal Behavioral Models and Expert Rules for Maritime Anomaly Detection,Evaluating the Usability of Visualizations of Normal Behavioral Models for Analytical Reasoning,Parallel Coordinates Visualization of Large Data Investigation on HDDs,Overview and Investigation of the Visualization Methods in Recommendation Systems,Visualization of network components for attack analysis,Information Visualization: Which Is the Most Appropriate Technique to Represent Data Mining Results?,Implementation of Information Visualization in Reservoir Application,A Pairwise Distances Based Visualization System for Information Retrieval,Realization of visualization software for yak body weight calculation (VBWC) in three-river headwaters region based on body size,Graphical representation and exploratory visualization for Decision Trees in the KDD process,Coordinated views to assist exploration of spatio-temporal data: a case study,Interactive cross-detector analysis of vortical flow data,Survey of Information Visualization Techniques for Enhancing Visual Analysis,Analyzing Networks of Issue Reports,Geometric querying of time-dependent data for data mining in molecular dynamics,Visual Clustering and Boundary Detection of Time-Dependent Datasets,Geometric approach to clustering and querying in databases and warehouses
Learning to Detect a Salient Object,"Tie Liu, Zejian Yuan, Jian Sun, Jingdong Wang, Nanning Zheng, Xiaoou Tang, Heung-Yeung Shum, ",2011,471,Salient object detection based on multi-scale super-pixels and saliency propagation,Object-based attention: saliency detection using contrast via background prototypes,Multi-scale saliency detection via inter-regional shortest colour path,Saliency detection using suitable variant of local and global consistency,Robust saliency detection via corner information and an energy function,Region-based saliency detection,Saliency detection framework via linear neighbourhood propagation,Development of saliency-based seamless image compositing using hybrid blending (SSICHB),Cotemporal Multi-View Video Segmentation,Salient Region Detection Using Self-Guided Statistical Non-Redundancy in Natural Images,Visual Attention-Based Image Watermarking,Improving RGBD Saliency Detection Using Progressive Region Classification and Saliency Fusion,Robust Adaptive Fusion Tracking Based on Complex Cells and Keypoints,Deep Saliency Quality Assessment Network With Joint Metric,Visual Saliency Modeling for River Detection in High-Resolution SAR Imagery,Enhanced Camera Capturing Using Object-Detection-Based Autofocus on Smartphones,Saliency Detection Using Color Spatial Variance Weighted Graph Model,Unsupervised uncertainty analysis for video saliency detection,Building an Image Database for Studying Image Retargeting,Robust PCA with concurrent column and element-wise outliers,Salient object segmentation using a switch scheme,Background priors based saliency object detection,Estimation method of initial labels for propagation-based saliency detection,A novel saliency detection method via manifold ranking and compactness prior,Shape detector for generic ball detection,Remote Sensing Image Compression: A Review,Fast object detection from unmanned surface vehicles via objectness and saliency,Selective features for RGB-D saliency,Over-the-shoulder shot detection in art films,Fusing region contrast and graph regularization for saliency detection
Comparing support vector machines with Gaussian kernels to radial basis function classifiers,"B. Scholkopf, Kah-Kay Sung, C. J. C. Burges, F. Girosi, P. Niyogi, T. Poggio, V. Vapnik, ",1997,470,Adaptive multiuser receiver using a support vector machine technique,Machine Learning-Based Primary Exclusive Region Update for Database-Driven Spectrum Sharing,Automatic Liver Diseases Diagnosis for CT Images Using Kernel-Based Classifiers,Fuzzy Support Vector Learning Algorithm for Mixed Attributes Data,A muti-SVMs design for cancer diagnosis using DNA microarray data,A novel nonlinear combination model based on Support Vector Machine for stock market prediction,Biased confidence classification algorithm for faculty subject allocation in education domain,Data classification with radial basis function networks based on a novel kernel density estimation algorithm,Fusing images with different focuses using support vector machines,Neuron selection for RBF neural network classifier based on data structure preserving criterion,Support Vector Networks in Adaptive Friction Compensation,Local Classifier Weighting by Quadratic Programming,Super-Resolution Method for Face Recognition Using Nonlinear Mappings on Coherent Features,Reduced HyperBF Networks: Regularization by Explicit Complexity Reduction and Scaled Rprop-Based Training,Kernel Map Compression for Speeding the Execution of Kernel-Based Methods,Real AdaBoost With Gate Controlled Fusion,Feature Combiners With Gate-Generated Weights for Classification,Kernel Association for Classification and Prediction: A Survey,Support vector machines for texture classification,Texture-based approach for text detection in images using support vector machines and continuously adaptive mean shift algorithm,Determination of Wireless Networks Parameters through Parallel Hierarchical Support Vector Machines,Robust Relevance Vector Machine With Variational Inference for Improving Virtual Metrology Accuracy,Fuzzy System Learned Through Fuzzy Clustering and Support Vector Machine for Human Skin Color Segmentation,Experiments with repeating weighted boosting search for optimization signal processing applications,Fast Support Vector Machines for Continuous Data,Therapeutic Drug Monitoring of Kidney Transplant Recipients Using Profiled Support Vector Machines,A Machine Learning-Based Framework for Automatic Visual Inspection of Microdrill Bits in PCB Production,Support vector method for robust ARMA system identification,A Parzen-window classifier architecture for massively-integrated nanoscale resonant devices,Robust Pattern Recognition by Interpolating Vectors
Learning a classification model for segmentation,"X. Ren, J. Malik, ",2003,466,Top-down pairwise potentials for piecing together multi-class segmentation puzzles,Consensus-Based Image Segmentation via Topological Persistence,Page Segmentation for Historical Document Images Based on Superpixel Classification with Unsupervised Feature Learning,Efficient Belief Propagation for Image Segmentation Based on an Adaptive MRF Model,Depth Map Compression Using Color-Driven Isotropic Segmentation and Regularised Reconstruction,Evaluating Multi-scale Over-segment and Its Contribution to Real Scene Stereo Matching by High-Order MRFs,Parallel Implementation of Geodesic Distance Transform with Application in Superpixel Segmentation,Hierarchical Mutual Nearest Neighbour Image Segmentation,MuralCut: Automatic character segmentation from mural images,Research on the Text Detection and Extraction from Complex Images,Superpixels using random walker,Interactive 2D 3D image conversion method for mobile devices,Hierarchical Co-Segmentation of Building Facades,Research on Born-Digital Image Text Extraction Based on Conditional Random Field,Automatic Detection of Exudates in Digital Color Fundus Images Using Superpixel Multi-Feature Classification,Consensus Region Merging for Image Segmentation,Using Co-Occurrence and Segmentation to Learn Feature-Based Object Models from Video,Markov random field models for hair and face segmentation,A combinatorial method for tracing objects using semantics of their shape,Online secondary-path-modeling ANC system with simultaneous perturbation method,Light field depth from multi-scale particle filtering,A model-based discriminative framework for sets of positive vectors classification: Application to object categorization,Road Boundary Detection in Challenging Scenarios,Superpixel-based segmentation of moving objects for low bitrate ROI coding systems,Segmentation and Tracking of Coronary Artery Using Graph-Cut in CT Angiographic,Enhancing region-based object tracking with the SP-SIFT feature,Vertebral Body Segmentation of Spine MR Images Using Superpixels,Noise-Robust SLIC Superpixel for Natural Images,Image-based exploration obstacle avoidance for mobile robot,A novel approach for red lesions detection using superpixel multi-feature classification in color fundus images
SUN database: Large-scale scene recognition from abbey to zoo,"Jianxiong Xiao, James Hays, Krista A. Ehinger, Aude Oliva, Antonio Torralba, ",2010,459,Robust Tracking in Low Light and Sudden Illumination Changes,Saliency based natural image understanding,Contextual video clip classification,Efficient object detection for high resolution images,Image classification using pairwise local observations based Naive Bayes classifier,An efficient sky detection algorithm based on hybrid probability model,Scene description for visually impaired in outdoor environment,Label tree based image classification using sum match kernel,Multi-scale sample entropy as a feature for working memory study,Image2Weather: A Large-Scale Image Dataset for Weather Property Estimation,Fusion of transfer learning features and its application in image classification,Metadata-Weighted Score Fusion for Multimedia Event Detection,Metric Feature Indexing for Interactive Multimedia Search,Automatic Photo Orientation Detection with Convolutional Neural Networks,Unbiased look at dataset bias,Learning to share visual appearance for multiclass object detection,What makes an image memorable?,Describing the scene as a whole: Joint object detection scene classification and semantic segmentation,Dynamic scene understanding: The role of orientation features in space and time in scene classification,Power SVM: Generalization with exemplar classification uncertainty,Recognizing scene viewpoint using panoramic place representation,Small sample scene categorization from perceptual relations,SUN attribute database: Discovering annotating and recognizing scene attributes,Learning sparse covariance patterns for natural scenes,Large-scale knowledge transfer for object localization in ImageNet,Hedging your bets: Optimizing accuracy-specificity trade-offs in large scale visual recognition,Discriminative spatial saliency for image classification,Understanding and predicting importance in images,Learning Class-to-Image Distance with Object Matchings,Subcategory-Aware Object Classification
VisualSEEk: a fully automated content-based image query system,"John R. Smith, Shih-Fu Chang, ",1996,457
