Query by image and video content: the QBIC system,"M. Flickner, H. Sawhney, W. Niblack, J. Ashley, Qian Huang, B. Dom, M. Gorkani, J. Hafner, D. Lee, D. Petkovic, D. Steele, P. Yanker, ",1995,1535,A unified framework for semantic shot classification in sports video,Nonparametric motion characterization for robust classification of camera motion patterns,A Learned Lexicon-Driven Paradigm for Interactive Video Retrieval,Major Cast Detection in Video Using Both Speaker and Face Information,Shape Indexing and Recognition Based on Regional Analysis,Motion Flow-Based Video Retrieval,Integrated Mining of Visual Features Speech Features and Frequent Patterns for Semantic Video Annotation,Robust Spatial Matching for Object Retrieval and Its Parallel Implementation on GPU,Extracting semantics from audio-visual content: the final frontier in multimedia retrieval,Blobworld: image segmentation using expectation-maximization and its application to image querying,Matching and retrieval of distorted and occluded shapes using dynamic programming,Unsupervised feature selection applied to content-based retrieval of lung images,Integrating relevance feedback techniques for image retrieval using reinforcement learning,Segmenting Modeling and Matching Video Clips Containing Multiple Moving Objects,Distance Learning for Similarity Estimation,80 Million Tiny Images: A Large Data Set for Nonparametric Object and Scene Recognition,A Statistical Framework for Image Category Search from a Mental Picture,Geometry-Based Image Retrieval in Binary Image Databases,The 3D Wunderkammer: an indexing by placing approach to the image storage and retrieval,Complex Zernike Moments Features for Shape-Based Image Retrieval,A Novel Evolutionary Approach for Optimizing Content-Based Image Indexing Algorithms,A Dynamic User Concept Pattern Learning Framework for Content-Based Image Retrieval,Three-dimensional interfaces for querying by example in content-based image retrieval,Feature Analysis Based on Edge Extraction and Median Filtering for CBIR,A personalized multimedia retrieval frame based on user interest,The semantics of sketch: Flexibility in visual query systems for time series data,A fuzzy feature clustering with relevance feedback approach to content-based image retrieval,An interface for semantic browsing of an images database,Edge detection techniques in image retrieval: the semantic meaning of edge,Virtual image: keyframe or visual icon?
Stability properties of constrained queueing systems and scheduling policies for maximum throughput in multihop radio networks,"L. Tassiulas, A. Ephremides, ",1992,1468,Distributed stochastic buffering for enterprise WLAN architectures,Scheduling and performance limits of networks with constantly changing topology,Achieving 100% throughput in an input-queued switch,An implementable parallel scheduler for input-queued switches,Toward best-effort services over WDM networks with fair access and minimum bandwidth guarantee,Linear-complexity algorithms for QoS support in input-queued switches with no speedup,Supporting bursty traffic with bandwidth guarantee in WDM distribution networks,Supporting rate guarantee and fair access for bursty data traffic in W-CDMA,A cell switching WDM broadcast LAN with bandwidth guarantee and fair access,Adaptive back-pressure congestion control based on local information,Routing and scheduling in heterogeneous systems: a sample path approach,On the stability of input-queued switches with speed-up,Distributed resource management using iterative gradient update synthesis,Minimum delay in class of throughput-optimal control policies on wireless networks,Stability of modified max pressure controller with application to signalized traffic networks,Interference constrained network control based on curvature,Generalized Queue-Aware Resource Management and Scheduling for Wireless Communications,Modeling Dynamic Adaptive Streaming Over Information-Centric Networking,Optimal Design and Energy Efficient Binary Resource Allocation of Interference-Limited Cellular Relay-Aided Systems With Consideration of Queue Stability,A Novel Flow-Aware Fair Scheduler for Multi Transmit/Receive Wireless Networks,Adaptive Resource Balancing for Serviceability Maximization in Fog Radio Access Networks,Optimal Dynamic Reserved Bandwidth Allocation for Cloud-Integrated Cyber-Physical Systems,Switching under energy constraints,Understanding cellular ad hoc networks: how much an accurate physical layer model matters,Dirty Paper Coding vs. Linear Precoding for MIMO Broadcast Channels,Towards Throughput and Delay Optimal Routing for Wireless Ad-Hoc Networks,Spectrum Allocation Power Control Routing and Congestion Control for Wireless Networks with Duplexing Constraints,Opportunism backpressure and stochastic optimization with the wireless broadcast advantage,Cross-layer utility maximization subject to stability constraints for multi-channel wireless networks,A greedy link scheduler for wireless networks with fading channels
Face recognition by elastic bunch graph matching,"L. Wiskott, Norbert Kr&uuml;ger, N. Kuiger, C. von der Malsburg, ",1997,1465,Face recognition using average example image,Improved average of synthetic exact filters for precise eye localisation under realistic conditions,Periocular biometrics: constraining the elastic graph matching algorithm to biologically plausible distortions,Score calibration in face recognition,Face recognition based on the fusion of global and local HOG features of face images,A robust two-stage face recognition system with localisation error compensation,Genetic algorithm-optimised structure of convolutional neural network for face recognition applications,A comparison of deep multilayer networks and Markov random field matching models for face recognition in the wild,Patterns of approximated localised moments for visual loop closure detection,Sparse representation-based face recognition against expression and illumination,Face recognition for smart environments,Line-based face recognition under varying pose,Looking at people: sensing for ubiquitous and wearable computing,The FERET evaluation methodology for face-recognition algorithms,From few to many: illumination cone models for face recognition under variable lighting and pose,Using support vector machines to enhance the performance of elastic graph matching for frontal face authentication,A system for person-independent hand posture recognition against complex backgrounds,Recognition of head-and-shoulder face image using virtual frontal-view image,Human face recognition system using modified PCA algorithm and ARM platform,3D Face Recognition with Region Committee Voting,Robust 2D/3D Face Landmarking,Face detection using quantized skin color regions merging and wavelet packet analysis,Frontal face authentication using discriminating grids with morphological feature vectors,Frontal face authentication using morphological elastic graph matching,Single-Sample Face Recognition Based on LPP Feature Transfer,Face Feature Extraction: A Complete Review,How Do Facial Expressions Contribute to Age Prediction?,Face Recognition Using Gabor Wavelets,An experimental evaluation of linear and kernel-based methods for face recognition,Multi-view face detection with FloatBoost
Neural network ensembles,"L. K. Hansen, P. Salamon, ",1990,1437,Robust classification model for PMU-based on-line power system DSA with missing data,Ensembles of radial basis function networks for spectroscopic detection of cervical precancer,Combining multiple neural networks by fuzzy integral for robust classification,On combining classifiers,Optimal linear combination of neural networks for improving classification performance,A handwritten numeral character classification using tolerant rough set,Olfactory classification via interpoint distance analysis,Use of fuzzy-logic-inspired features to improve bacterial recognition through classifier fusion,A visual neural classifier,Robust classification of multispectral data using multiple neural networks and fuzzy integral,From conventional control to autonomous intelligent methods,Speciation as automatic categorical modularization,Evolutionary ensembles with negative correlation learning,A neural network approach to classification of sidescan sonar imagery from a midocean ridge area,Neural networks for classification: a survey,Effectiveness of artificial neural networks for first swing stability determination of practical systems,Sensor registration using neural networks,Multiple network fusion using fuzzy logic,Improving model accuracy using optimal linear combinations of trained neural networks,A review of Bayesian neural networks with an application to near infrared spectroscopy,The pandemonium system of reflective agents,Recognition and pose estimation of unoccluded three-dimensional objects from a two-dimensional perspective view by banks of neural networks,Combinations of weak classifiers,Neural-network classifiers for recognizing totally unconstrained handwritten numerals,Parallel consensual neural networks,Multiobjective genetic algorithm partitioning for hierarchical learning of high-dimensional pattern spaces: a learning-follows-decomposition strategy,Classification of seismic signals by integrating ensembles of neural networks,Critic-driven ensemble classification,Forecasting time series with genetic fuzzy predictor ensemble,An Augmented Reality Question Answering System Based on Ensemble Neural Networks
An introduction to biometric recognition,"A. K. Jain, A. Ross, S. Prabhakar, ",2004,1422,Ear recognition in a light field imaging framework: a new perspective,Employing fusion of learned and handcrafted features for unconstrained ear recognition,3D ear recognition using global and local features,Multilinear Laplacian discriminant analysis for gait recognition,Efficient fingerprint matching using GPU,Biometric analysis using fused feature set from side face texture and electrocardiogram,A Novel Preprocessing Algorithm of Knuckleprint,Lux - An interactive receptionist robot for university open days,ECG-based personal identification using empirical mode decomposition and Hilbert transform,Online Signature Verification with Neural Networks Classifier and Fuzzy Inference,Fusion methods for boosting performance of speaker identification systems,A Novel Approach of Personal Identification Based on Single Knuckleprint Image,Multi-Factor Authentication Using Fingerprints and User-Specific Random Projection,Fuzzy logic method for partial fingerprint recognition,A Multimodal Biometric Recognition System Based on Fusion of Palmprint Fingerprint and Face,Statistical on-line signature verification using rotation-invariant dynamic descriptors,FingerCode for identity verification using fingerprint and smart card,A robust method for the recognition of palmprints,Robust Fake Iris Detection Based on Variation of the Reflectance Ratio Between the IRIS and the Sclera,Face Based Biometric Authentication with Changeable and Privacy Preservable Templates,Impact of Signature Legibility and Signature Type in Off-Line Signature Verification,Fuzzy Vault for Face Based Cryptographic Key Generation,Biometric User Identification with Dynamic Footprint,Multiple Fingers Synchronization used for device mutual authentication,An improved biometric identification system based on heart sounds and Gaussian Mixture Models,ECG biometric authentication using Pulse Active Width (PAW),Babies: Biometric authentication of newborn identities by means of ear signatures,Online signature verification approach using Mellin transform and empirical mode decomposition,Verifying a personas identity using brain responses to visual stimuli,Fusing multi-biometrics authorization with PCA
A database of human segmented natural images and its application to evaluating segmentation algorithms and measuring ecological statistics,"D. Martin, C. Fowlkes, D. Tal, J. Malik, ",2001,1371,Single image super resolution based on content-aware constraint and intensity-order constraint,Can fully convolutional networks perform well for general image restoration problems?,Scalable Effort Hardware Design,Robust template based corner detection algorithms for robotic vision,How interaction methods affect image segmentation: User experience in the task,BoundarySeer: Visual analysis of 2D boundary changes,Regularized fully convolutional networks for RGB-D semantic segmentation,Parameter-free hierarchical image segmentation,Real-time deep image super-resolution via global context aggregation and local queue jumping,A Modified Hill Climbing Based Watershed Algorithm and Its Real Time FPGA Implementation,A general framework for reconciling multiple weak segmentations of an image,A parallel region based object recognition system,Nonuniform image patch exemplars for low level vision,Multiscale Superpixels and Supervoxels Based on Hierarchical Edge-Weighted Centroidal Voronoi Tessellation,Tree-Based Locally Linear Regression for Image Denoising,Learning to Select and Order Vacation Photographs,Direct face detection and video reconstruction from event cameras,Is image super-resolution helpful for other vision tasks?,Crack Segmentation by Leveraging Multiple Frames of Varying Illumination,PASCAL Boundaries: A Semantic Boundary Dataset with a Deep Semantic Boundary Detector,Hardware-Centric Vision Processing for Mobile IoT Environment Exploiting Approximate Graph Cut in Resistor Grid,Efficient object annotation for surveillance and automotive applications,The data parallelism under java paralleltask: A simple and efficient approach,Keep the geometries: Image segmentation by K-MSVC with random region grouping and propagation,Unequal error protection for OFDM systems in time-varying channels,Interactive object segmentation using kernel density estimation based graph cuts,Robust satellite image analysis using probabilistic learning based graph optimization,Generic colour image segmentation via multi-stage region merging,Fast superpixels for video analysis,Efficient Implementation of Canny Edge Detection Filter for ITK Using CUDA
PCA versus LDA,"A. M. Martinez, A. C. Kak, ",2001,1370,Face recognition using average example image,Fault detection classification and location for transmission lines and distribution systems: a review on the methods,Age-invariant face recognition system using combined shape and texture features,Impact of eye detection error on face recognition performance,Study on using individual differences in facial expressions for a face recognition system immune to spoofing attacks,Low-resolution face recognition in uses of multiple-size discrete cosine transforms and selective Gaussian mixture models,Colour-feature dual discriminating correlation analysis for face recognition,Personalised-face neutralisation using best-matched face shape with a neutral-face database,Neighbourhood sensitive preserving embedding for pattern classification,Detecting faces in images: a survey,Clustering in image space for place recognition and visual annotations for human-robot interaction,Human face recognition system using modified PCA algorithm and ARM platform,3D vision technology for occupant detection and classification,Faulty variable selection based fault reconstruction for industrial processes,Robust Locality Preserving Projections With Cosine-Based Dissimilarity for Linear Dimensionality Reduction,A Rule Based Model for Efficient Representation and Accurate Recognition of Human Faces,A comparison of PCA KPCA and LDA for feature extraction to recognize affect in gait kinematics,Fourier Transform of Untransformable Signals Using Pattern Recognition Technique,Integrating Range and Texture Information for 3D Face Recognition,Face recognition using Kernel-based Fisher Discriminant Analysis,Kernel Eigenfaces vs. Kernel Fisherfaces: Face recognition using kernel methods,Authenticating corrupted face image based on noise model,Modeling face appearance with nonlinear independent component analysis,The POSTECH face database (PF07) and performance evaluation,2DPCA vs. 2DLDA: Face Recognition Using Two-Dimensional Method,Graph-based matching of occluded hand gestures,Gabor Wavelet Based Modular PCA Approach for Expression and Illumination Invariant Face Recognition,Face Recognition Using Both Geometric Features and PCA/LDA,Discriminant analysis of stochastic models and its application to face recognition,Component-based LDA method for face recognition with one training sample
Scalable Recognition with a Vocabulary Tree,"D. Nister, H. Stewenius, ",2006,1364,Visual Words for 3D Reconstruction and Pose Computation,Visual Landmark-Based Localization for MAVs Using Incremental Feature Updates,Toward Compressed 3D Descriptors,Automatic Registration of Smooth Object Image to 3D CAD Model for Industrial Inspection Applications,Towards Linear-Time Incremental Structure from Motion,Matching Features Correctly through Semantic Understanding,Placeless Place-Recognition,Learning to Navigate the Energy Landscape,Confidentiality-Preserving Image Search: A Comparative Study Between Homomorphic Encryption and Distance-Preserving Randomization,Robust Topological Navigation via Convolutional Neural Network Feature and Sharpness Measure,A Novel Visual-Vocabulary-Translator-Based Cross-Domain Image Matching,Effective image representation based on bi-layer visual codebook,An Efficient Approach to Web Near-Duplicate Image Detection,Region-Based Near-Duplicate Image Retrieval with Geometric Consistency,Common Landmark Discovery for Object-Level View Image Retrieval: Modeling and Matching of Scenes via Bag-of-Bounding-Boxes,Analysis of Verification Methods for Indoor Image Matching,Efficient and Rich Annotations for Large Photo Collections,Bag-of-Words Against Nearest-Neighbor Search for Visual Object Retrieval,Image Retrieval with Fisher Vectors of Binary Features,Random Decomposition Forests,Residual Enhanced Visual Vectors for on-device image matching,Efficient re-ranking in vocabulary tree based image retrieval,Spatiotemporal pyramid representation for recognition of facial expressions and hand gestures,Probabilistic object and viewpoint models for active object recognition,A new approach of action recognition based on Motion Stable Shape (MSS) features,A Novel Method to Construct Visual Vocabulary Based on Maximization of Mutual Information,Mobile robot localization using place recognition in outdoor environments with similar scenes,Selective aggregated descriptors for robust mobile image retrieval,Secure Index Construction for Privacy-Preserving Large-Scale Image Retrieval,DietCam: Regular Shape Food Recognition with a Camera Phone
Location systems for ubiquitous computing,"J. Hightower, G. Borriello, ",2001,1289,Zadoff-Chu coded ultrasonic signal for accurate range estimation,Fast Distributed Algorithm for Convergecast in Ad Hoc Geometric Radio Networks,Event-driven support of real-time sentient objects,On-demand fingerprint selection for 802.11-based positioning systems,Geographical location based RFID tracking system,Location estimation system using wireless ad-hoc network,WLAN-Based Pedestrian Tracking Using Particle Filters and Low-Cost MEMS Sensors,Influence of Predicted and Measured Fingerprint on the Accuracy of RSSI-based Indoor Location Systems,Distributed selection of references for localization in wireless sensor networks,RSSI-based indoor localization using antenna diversity and plausibility filter,A comparative survey of WLAN location fingerprinting methods,Passive infrared localization with a Probability Hypothesis Density filter,A quantitative comparison of Multihop Localization Algorithms,Multi-modal sensor data and information fusion for localization in indoor environments,Dynamic searching particle filtering scheme for indoor localization in wireless sensor network,The FU Berlin parallel lateration-algorithm simulation and visualization engine,Localization using discrete event simulation,Structure of an Extensible Augmented Reality Framework for Visualization of Simulated Construction Processes,Real-time scene simulator for Thermal Infrared Localization,On the reliability-aware geographic routing,Improving Accuracy of WiFi Positioning System by Using Geographical Information System (GIS),A Study on Wireless Sensor Networks Location,Dynamic Alliance Based on Genetic Algorithms in Wireless Sensor Networks,GRID Based Broadcast Algorithm in Mobile Wireless Ad-Hoc Networks an Analytical Study,Research and Simulation on Genetic Ant Colony Routing in Wireless Sensor Network,Localization Algorithm for Wireless Sensor Network Based on Genetic Simulated Annealing Algorithm,Efficient Sink Location Acquirement Scheme for Geographic Routing,Exploiting social information for dynamic tuning in cluster based WiFi localization,Calibrating RSS-Based Indoor Positioning Systems,Adaptive Location Tracking by Kalman Filter in Wireless Sensor Networks
Human and machine recognition of faces: a survey,"R. Chellappa, C. L. Wilson, S. Sirohey, ",1995,1251,Recognizing partially occluded expression variant faces from single training image per person with SOM and soft k-NN ensemble,Ensemble-based discriminant learning with boosting for face recognition,Exploiting discriminant information in nonnegative matrix factorization with application to frontal face verification,A Weighted Voting Model of Associative Memory,Recognition of Partially Occluded and Rotated Images With a Network of Spiking Neurons,Face recognition using line edge map,Visual identification by signature tracking,A Bayesian discriminating features method for face detection,Gabor-based kernel PCA with fractional power polynomial models for face recognition,Glasses removal from facial image using recursive error compensation,A probabilistic model of face mapping with local transformations and its application to person recognition,Open set face recognition using transduction,Discriminative common vectors for face recognition,Face recognition from a single training image under arbitrary unknown lighting using spherical harmonics,Biometrics from Brain Electrical Activity: A Machine Learning Approach,On the Dimensionality of Face Space,Homotopic Image Pseudo-Invariants for Openset Object Recognition and Image Retrieval,Face Relighting from a Single Image under Arbitrary Unknown Lighting Conditions,Toward Development of a Face Recognition System for Watchlist Surveillance,A novel face recognition system using hybrid neural and dual eigenspaces methods,Dynamic context capture and distributed video arrays for intelligent spaces,The CAS-PEAL Large-Scale Chinese Face Database and Baseline Evaluations,Multiresolution feature detection using a family of isotropic bandpass filters,Comparing different classifiers for automatic age estimation,A face and palmprint recognition approach based on discriminant DCT feature extraction,Kernel machine-based one-parameter regularized Fisher discriminant method for face recognition,Illumination compensation and normalization for robust face recognition using discrete cosine transform in logarithm domain,BDPCA plus LDA: a novel fast feature extraction technique for face recognition,A novel incremental principal component analysis and its application for face recognition,Choosing Parameters of Kernel Subspace LDA for Recognition of Face Images Under Pose and Illumination Variations
