Robust text-independent speaker identification using Gaussian mixture speaker models,"D. A. Reynolds, R. C. Rose, ",1995,1232,Application of time-frequency principal component analysis to text-independent speaker identification,The integral decode: a smoothing technique for robust HMM-based speaker recognition,Speech enhancement using a mixture-maximum model,Bounded support Gaussian mixture modeling of speech spectra,Multigrained modeling with pattern specific maximum likelihood transformations for text-independent speaker recognition,Efficient text-independent speaker verification with structural Gaussian mixture models and neural network,A study on model-based error rate estimation for automatic speech recognition,Maximum a-posteriori probability pitch tracking in noisy environments using harmonic model,Singing voice identification using spectral envelope estimation,Speaker classification using composite hypothesis testing and list decoding,Multichannel audio synthesis by subband-based spectral conversion and parameter adaptation,Speaker model selection based on the Bayesian information criterion applied to unsupervised speaker indexing,Real-time speaker identification and verification,Automatic singer recognition of popular music recordings via estimation and modeling of solo vocal signals,Nonparallel training for voice conversion based on a parameter adaptation approach,Text-independent speaker recognition based on the Hurst parameter and the multidimensional fractional Brownian motion model,Spectrum restoration from multiscale auditory phase singularities by generalized projections,Musical instrument recognition by pairwise classification strategies,A Randomized Response Model for Privacy Preserving Smart Metering,Notions of intuition and attention modeled by a hierarchically arranged generalized regression neural network,Robust speaker's location detection in a vehicle environment using GMM models,On Using the Viterbi Path Along With HMM Likelihood Information for Online Signature Verification,GFM-Based Methods for Speaker Identification,On the use of different speech representations for speaker modeling,Gaussian Mixture Modeling of Keystroke Patterns for Biometric Applications,Marginal Likelihood for Estimation and Detection Theory,Jump Function Kolmogorov for Audio Classification in Noise-Mismatch Conditions,Formant features statistical analysis of male and female emotional speech in Czech and Slovak,Energy Detection Based Spectrum Sensing for Cognitive Radios Over Time-Frequency Doubly Selective Fading Channels,Comparison of one and two-level architecture of the GMM-based speaker age classifier
Mining sequential patterns,"R. Agrawal, R. Srikant, ",1995,1210,A review on sequential pattern mining using pattern growth approach,Mining Several Kinds of Temporal Association Rules Enhanced by Tree Structures,Mining high fuzzy utility sequential patterns,Discovery of fuzzy temporal association rules,Discovering fuzzy time-interval sequential patterns in sequence databases,Activity Discovery and Activity Recognition: A New Partnership,Mining Mobile Sequential Patterns in a Mobile Commerce Environment,Multiresolution Abnormal Trace Detection Using Varied-Length $n$-Grams and Automata,Sequential Data Mining: A Comparative Case Study in Development of Atherosclerosis Risk Factors,ActiviTree: Interactive Visual Exploration of Sequences in Event-Based Data Using Graph Similarity,A Visual Analytics Approach to Multiscale Exploration of Environmental Time Series,Patterns and Sequences: Interactive Exploration of Clickstreams to Understand Common Visitor Paths,A Predictive Energy-Efficient Technique to Support Object-Tracking Sensor Networks,Protocol Formats Reverse Engineering Based on Association Rules in Wireless Environment,Mining temporal moving patterns in object tracking sensor networks,Finding periodic outliers over a monogenetic event stream,User Travelling Pattern Prediction via Indistinct Cellular Data Mining,Partition-Based Approach for Fast Mining of Transitional Patterns,Discovery of associated topics for the intelligent browsing,Visual mining of multimedia data for social and behavioral studies,Using visualizations to monitor changes and harvest insights from a global-scale logging infrastructure at Twitter,HydroQual: Visual analysis of river water quality,Gender Differences in End-User Debugging Revisited: What the Miners Found,Discovering action idioms bridging the gap between system-level events and human-level actions,A improved sequential pattern mining algorithm based on PrefixSpan,Mining Frequent Induced Subtrees by Prefix-Tree-Projected Pattern Growth,Prediction of System Critical Event in Virtualized Medical Applications,Application of data mining in supply chain management,A high efficient algorithm of mining sequential patterns,Mining frequent sub-trends in time-series databases
Face recognition: features versus templates,"R. Brunelli, T. Poggio, ",1993,1203,Genetic algorithm-optimised structure of convolutional neural network for face recognition applications,A multiscale assembly inspection algorithm,Face detection in color images,Person identification using multiple cues,Extending the feature vector for automatic face recognition,Recognizing human facial expressions from long image sequences using optical flow,Face recognition system using local autocorrelations and multiscale integration,Probabilistic visual learning for object representation,Eigenfaces vs. Fisherfaces: recognition using class specific linear projection,Automatic interpretation and coding of face images using flexible models,Example-based learning for view-based human face detection,A volumetric/iconic frequency domain representation for objects with application for pose invariant face recognition,Support vector machines for 3D object recognition,An analytic-to-holistic approach for face recognition based on a single frontal view,Integrating faces and fingerprints for personal identification,How should we represent faces for automatic recognition?,Classifying facial actions,Line-based face recognition under varying pose,Evolutionary pursuit and its application to face recognition,A fast and accurate face detector based on neural networks,Recognizing action units for facial expression analysis,From few to many: illumination cone models for face recognition under variable lighting and pose,Recognition of head-and-shoulder face image using virtual frontal-view image,Human and machine recognition of faces: a survey,Face recognition: eigenface elastic matching and neural nets,Neural networks for intelligent multimedia processing,Synergistic modeling and applications of hierarchical fuzzy neural networks,Face detection using quantized skin color regions merging and wavelet packet analysis,Robust watermarking of facial images based on salient geometric pattern matching,A review of speech-based bimodal recognition
How iris recognition works,"J. Daugman, ",2004,1178,Improvement of Iris Recognition Based on Iris-Code Bit-Error Pattern Analysis,Improving Very Low-Resolution Iris Identification via Super-Resolution Reconstruction of Local Patches,Sic-Gen: A Synthetic Iris-Code Generator,Biometrie symmetry: Implications on template protection,Exploring deep learning image super-resolution for iris recognition,Raspberry Pi based complete embedded system for iris recognition,A Bayesian Approach to Deformed Pattern Matching of Iris Images,Toward Accurate and Fast Iris Segmentation for Iris Biometrics,The Best Bits in an Iris Code,The UBIRIS.v2: A Database of Visible Wavelength Iris Images Captured On-the-Move and At-a-Distance,The Multiscenario Multienvironment BioSecure Multimodal Database (BMDB),Iris Matching Based on Personalized Weight Map,IrisCode Decompression Based on the Dependence between Its Bit Pairs,Improved Iris Recognition through Fusion of Hamming Distance and Fragile Bit Distance,A Novel Encoding Scheme for Effective Biometric Discretization: Linearly Separable Subcode,An Automatic Iris Occlusion Estimation Method Based on High-Dimensional Density Estimation,Joint Sparse Representation for Robust Multimodal Biometrics Recognition,Iris Image Classification Based on Hierarchical Visual Codebook,A Statistical Analysis of IrisCode and Its Security Implications,Static Signature Synthesis: A Neuromotor Inspired Approach for Biometrics,All-Pairs: An Abstraction for Data-Intensive Computing on Campus Grids,Security Management of Authentication System Based on Dynamic Biometric Features,Biometric Inspired Multimedia Encryption Based on Dual Parameter Fractional Fourier Transform,KinectFaceDB: A Kinect Database for Face Recognition,Robust Sclera Recognition System With Novel Sclera Segmentation and Validation Techniques,Estimating and Fusing Quality Factors for Iris Biometric Images,A New Human Identification Method: Sclera Recognition,Handheld System Design for Dual-Eye Multispectral Iris Capture With One Camera,A Real-Time Gaze Position Estimation Method Based on a 3-D Eye Model,New Methods in Iris Recognition
The Hadoop Distributed File System,"Konstantin Shvachko, Hairong Kuang, Sanjay Radia, Robert Chansler, ",2010,1106,CDM Server: A Data Management Framework for Data Intensive Application in Internal Private Cloud Infrastructure,Implementing Hadoop Platform on Eucalyptus Cloud Infrastructure,Secure Access to Cloud Resources,Scalable and Efficient Diagnosis for 5G Data Center Network Traffic,A Map Reduce-Based Nearest Neighbor Approach for Big-Data-Driven Traffic Flow Prediction,Compact Popularity-Aware and Adaptive Hybrid Data Placement Schemes for Heterogeneous Cloud Storage,Machine Learning With Big Data: Challenges and Approaches,NPi-Cluster: A Low Power Energy-Proportional Computing Cluster Architecture,Bipartite Matching Based Speculative Execution to Improve Cloud MapReduce Performance,Highly Available Hadoop NameNode Architecture,Exploring utility-based optimization and management for Wireless Sensor Networks and Machine-to-Machine communications,Efficient information retrieval using Lucene LIndex and HIndex in Hadoop,CedCom: A high-performance architecture for Big Data applications,An ontology based digital preservation system for enterprise collaboration,Using SLA to guide database transition to NoSQL on the cloud: A systematic mapping study,MapReduce based scalable range query architecture for big spatial data,Accelerating data queries on Hadoop framework by using compact data formats,Spatial query handling in semantic web application: an experience report,EDWiN: Leveraging Device-to-Device Communications for Efficient Data Dissemination over Wi-Fi Networks,Data locality in MapReduce: A network perspective,Decentralized scheduling with data locality for data-parallel computation on peer-to-peer networks,On the worst-case communication overhead for distributed data shuffling,Replicated convolutional codes: A design framework for repair-efficient distributed storage codes,Delay comparison of delivery and coding policies in data clusters,Matrix sparsification for coded matrix multiplication,Using Indirect Routing to Recover from Network Traffic Scheduling Estimation Error,Data location aware scheduling for virtual Hadoop cluster deployment on private cloud computing environment,Live demonstration: An FPGA based hardware compression accelerator for Hadoop system,Application traffic classification in Hadoop distributed computing environment,A performance comparison of in-memory Virtual Desktop Environment
Recognizing human actions: a local SVM approach,"C. Schuldt, I. Laptev, B. Caputo, ",2004,1067,Enhancing discriminability of randomized time warping for motion recognition,Animated Pose Templates for Modeling and Detecting Human Actions,A Hierarchical Word-Merging Algorithm with Class Separability Measure,Temporal Localization of Actions with Actoms,Learning Human Actions by Combining Global Dynamics and Local Appearance,Discriminative Non-Linear Stationary Subspace Analysis for Video Classification,Context-Aware Activity Modeling Using Hierarchical Conditional Random Fields,Sum Product Networks for Activity Recognition,Reconstruction-Free Action Inference from Compressive Imagers,Max-Margin Action Prediction Machine,Efficient Activity Detection in Untrimmed Video with Max-Subgraph Search,Group Sparse-Based Mid-Level Representation for Action Recognition,Realistic Human Action Recognition With Multimodal Feature Selection and Fusion,Cross-Domain Human Action Recognition,Learning Discriminative Key Poses for Action Recognition,Understanding Video Events: A Survey of Methods for Automatic Interpretation of Semantic Occurrences in Video,Hierarchical Filtered Motion for Action Recognition in Crowded Videos,Improving spatio-temporal feature extraction techniques and their applications in action classification,Recognizing human actions based on Sparse Coding with Non-negative and Locality constraints,Rapid human action recognition in H.264/AVC compressed domain for video surveillance,Learning non-negative locality-constrained Linear Coding for human action recognition,Learning human actions with an adaptive codebook,Incremental learning of novel activity categories from videos,Behavior recognition via sparse spatio-temporal features,Action recognition via multi-feature fusion and Gaussian process classification,Human action recognition using Recursive Self Organizing map and longest common subsequence matching,Action recognition: A region based approach,An evaluation of bags-of-words and spatio-temporal shapes for action recognition,Personal driving diary: Constructing a video archive of everyday driving events,One video is sufficient? Human activity recognition using active video composition
Fuzzy ARTMAP: A neural network architecture for incremental supervised learning of analog multidimensional maps,"G. A. Carpenter, S. Grossberg, N. Markuzon, J. H. Reynolds, D. B. Rosen, ",1992,1066,Application of intelligent tools to detect and classify broken rotor bars in three-phase induction motors fed by an inverter,Fuzzy based methodologies comparison for high-impedance fault diagnosis in radial distribution feeders,PV-Microgrid Operational Cost Minimization by Neural Forecasting and Heuristic Optimization,Classification of cardiac arrhythmias using fuzzy ARTMAP,A computational neural approach to support the discovery of gene function and classes of cancer,Incremental knowledge acquisition in supervised learning networks,Fuzzy inference neural network for fuzzy model tuning,An adaptive neural fuzzy filter and its applications,Neural network models for a resource allocation problem,Fuzzy classifications using fuzzy inference networks,Pattern fusion in feature recognition neural networks for handwritten character recognition,Learning sensor-based navigation of a real mobile robot in unknown worlds,A reinforcement neuro-fuzzy combiner for multiobjective control,A survey of fuzzy clustering algorithms for pattern recognition. I,A survey of fuzzy clustering algorithms for pattern recognition. II,An effective neuro-fuzzy paradigm for machinery condition health monitoring,NeuroFAST: on-line neuro-fuzzy ART-based structure and parameter learning TSK model,Evolving fuzzy neural networks for supervised/unsupervised online knowledge-based learning,A self-organizing neural network for supervised learning recognition and prediction,ART neural networks for remote sensing: vegetation classification from Landsat TM and terrain data,A neural network algorithm for sea ice edge classification,A Gaussian adaptive resonance theory neural network classification algorithm applied to supervised land cover mapping using multitemporal vegetation index data,Classifying multichannel ECG patterns with an adaptive neural network,Learn++: an incremental learning algorithm for supervised neural networks,Hopfield/ART-1 neural network-based fault detection and isolation,ART-EMAP: A neural network architecture for object recognition by evidence accumulation,X-tron: an incremental connectionist model for category perception,A fuzzy ARTMAP nonparametric probability estimator for nonstationary pattern recognition problems,Reinforcement learning for an ART-based fuzzy adaptive learning control network,Incremental backpropagation learning networks
Methods of combining multiple classifiers and their applications to handwriting recognition,"L. Xu, A. Krzyzak, C. Y. Suen, ",1992,1049,Cascaded multimodal biometric recognition framework,Real-time optical character recognition on field programmable gate array for automatic number plate recognition system,Combining multiple neural networks by fuzzy integral for robust classification,Decision combination in multiple classifier systems,A method of combining multiple experts for the recognition of unconstrained handwritten numerals,Person identification using multiple cues,Combination of multiple classifiers using local accuracy estimates,Off-line signature verification by local granulometric size distributions,On combining classifiers,Statistical pattern recognition: a review,Precise candidate selection for large character set recognition by confidence evaluation,Application of majority voting to pattern recognition: an analysis of its behavior and performance,A neural network classifier based on Dempster-Shafer theory,Adaptive classifier integration for robust pattern recognition,Switching between selection and fusion in combining classifiers: an experiment,Robust classification of multispectral data using multiple neural networks and fuzzy integral,An information fusion method for multispectral image classification postprocessing,Improving the performance of fuzzy classifier systems for pattern classification problems with continuous attributes,Designing classifier fusion systems by genetic algorithms,Neural networks for classification: a survey,An overview of character recognition focused on off-line handwriting,Recognition and pose estimation of unoccluded three-dimensional objects from a two-dimensional perspective view by banks of neural networks,Combinations of weak classifiers,A multiexpert framework for character recognition: a novel application of Clifford networks,Critic-driven ensemble classification,Multiple classifiers for color flag and trademark image retrieval,Comparing models for audiovisual fusion in a noisy-vowel recognition task,Decision combination in speech metadata extraction,A decision fusion approach for clustering of hyperspectral data using spectral unmixing methods,Optimized diagnostic model combination for improving diagnostic accuracy
R-trees: a dynamic index structure for spatial searching,"Antonin Guttman, ",1984,1014
SIMPLIcity: semantics-sensitive integrated matching for picture libraries,"J. Z. Wang, Jia Li, G. Wiederhold, ",2001,961,Image Annotation Within the Context of Personal Photo Collections Using Hierarchical Event and Scene Models,Feature-Based Sparse Representation for Image Similarity Assessment,RETRIEVAL—An Online Performance Evaluation Tool for Information Retrieval Methods,Fast-Learning Adaptive-Subspace Self-Organizing Map: An Application to Saliency-Based Invariant Image Feature Construction,Scalable Linear Visual Feature Learning via Online Parallel Nonnegative Matrix Factorization,A region-based fuzzy feature matching approach to content-based image retrieval,Automatic Linguistic Indexing of Pictures by a statistical modeling approach,Asymmetric bagging and random subspace for support vector machines-based relevance feedback in image retrieval,MILES: Multiple-Instance Learning via Embedded Instance Selection,Context-Based Object-Class Recognition and Retrieval by Generalized Correlograms,Kernels for Generalized Multiple-Instance Learning,Real-Time Computerized Annotation of Pictures,Localized Content-Based Image Retrieval,Homotopic Image Pseudo-Invariants for Openset Object Recognition and Image Retrieval,Two-Dimensional Polar Harmonic Transforms for Invariant Image Representation,Rigid Shape Matching by Segmentation Averaging,A Novel Evolutionary Approach for Optimizing Content-Based Image Indexing Algorithms,Generalized Biased Discriminant Analysis for Content-Based Image Retrieval,Automated localization of Temporomandibular Joint Disc in MRI images,Feature Vector Extraction System Based on Adaptive Segmentation of HSV Information Space,Feature Analysis Based on Edge Extraction and Median Filtering for CBIR,CBIR Based on Adaptive Segmentation of HSV Color Space,Similarity Measures for Satellite Images with Heterogeneous Contents,A fuzzy feature clustering with relevance feedback approach to content-based image retrieval,An Oblivious Image Retrieval Protocol,Color Salient Points Detection Using Wavelet,A tentative study of visual attention-based salient features for image retrieval,Smart robot perception through Internet data mining,An effective method to detect seal images from traditional Chinese paintings,A unified fuzzy feature indexing scheme for region based online image querying
The Case for Energy-Proportional Computing,"Luiz Andr&eacute; Barroso, Urs H&ouml;lzle, ",2007,939,Hierarchical resource allocation and consolidation framework in a multi-core server cluster using a Markov decision process model,Brief Paper - Distributed thermal aware load balancing for cooling of modular data centres,Energy-Efficient Virtual Resource Dynamic Integration Method in Cloud Computing,NPi-Cluster: A Low Power Energy-Proportional Computing Cluster Architecture,Multi-Population Ant Colony Algorithm for Virtual Machine Deployment,Communication-aware VM consolidation based on formal concept analysis,Dynamic Voltage and Frequency Scaling in Multimedia Servers,Load balancing and speed scaling interaction in processor-sharing systems with exponential power functions,Dynamic optical switching for latency sensitive applications,Energy in ICT - Trends and research directions,Digital multiphase Constant on-time regulator supporting energy proportional computing,Isolated resonant full-bridge converter with magnetic integration,Energy efficient virtual network embedding for path splitting,On Accuracy-Performance Tradeoff Frameworks for Energy Saving: Models and Review,Model-based electrical energy analysis of industrial automation systems,Cross-layer virtual/physical sensing and actuation for resilient heterogeneous many-core SoCs,Low power optical transceivers for switched interconnect networks,Staged request routing for reduced carbon footprints of large scale server systems,How data center size impacts the effectiveness of dynamic power management,Security threat identification using energy points,Defining Energy Consumption Plans for Data Querying Processes,A User Profile-Aware Policy-Based Management Framework for Greening the Cloud,"Towards Generalizing ""Big Little"" for Energy Proportional HPC and Cloud Infrastructures",Evaluating Network-Based DoS Attacks under the Energy Consumption Perspective: New Security Issues in the Coming Green ICT Area,Efficient gear-shifting for a power-proportional distributed data-placement method,Data center power reduction by heuristic variation-aware server placement and chassis consolidation,SLDP: A Novel Data Placement Strategy for Large-Scale Heterogeneous Hadoop Cluster,An Energy-Aware Workload Balancing Method for Cloud Video Data Storage Management,Introducing Greenhouse Emissions in Cost Optimization of Fault-Tolerant Data Center Design,Network energy consumption analysis and dormancy mechanism based on ant colony algorithm in cloud computing environment for IOT service and real-time embedded industrial control system
Face recognition by independent component analysis,"M. S. Bartlett, J. R. Movellan, T. J. Sejnowski, ",2002,924,Blind face indexing in video,A comparison of classification approaches for deep face recognition,A Novel Sparse Representation Classification Face Recognition Based on Deep Learning,Reliable multi-person identification using DCNN-based face recognition algorithm and scale-ratio method,Discriminative FaceTopics for face recognition via latent Dirichlet allocation,Application of Bionic Neural Network on Face Recognition Based on SVD and DCT,Face Recognition Based on Independent Component Analysis and Fuzzy Support Vector Machine,Gabor wavelets and General Discriminant analysis for ear recognition,Face recognition based on improved PCA reconstruction,Face recognition by Zero-Ratio based LGBP features,Robust Facial Attribute-Specific Subspace-Based Principal Component Analysis for Face Recognition,Facial expression invariant person recognition using feature level fusion of visual and thermal images,Face recognition using cloud Hopfield neural network,A human-robot communication system using face images,Face Recognition across Poses Using Transformed Features,Radar Target Recognition Using A Modified FastICA Algorithm plus GAs,Direct kernel PCA with RBF neural networks for face recognition,2D+3D face recognition using Dual-tree Wavelet Transform,TotalPLS: Local Dimension Reduction for Multicategory Microarray Data,Class-Specific Reference Discriminant Analysis With Application in Human Behavior Analysis,Class-Specific Kernel-Discriminant Analysis for Face Verification,Learning the Uncorrelated Independent and Discriminating Color Spaces for Face Recognition,Face Recognition Under Occlusions and Variant Expressions With Partial Similarity,A Doubly Weighted Approach for Appearance-Based Subspace Learning Methods,Depth Estimation of Face Images Based on the Constrained ICA Model,Dictionary-Based Face Recognition Under Variable Lighting and Pose,Face Recognition and Verification Using Photometric Stereo: The Photoface Database and a Comprehensive Evaluation,A Novel Serial Multimodal Biometrics Framework Based on Semisupervised Learning Techniques,Joint Feature Learning for Face Recognition,Cross-Speed Gait Recognition Using Speed-Invariant Gait Templates and Globality–Locality Preserving Projections
