Image quality assessment: from error visibility to structural similarity,"Zhou Wang, A. C. Bovik, H. R. Sheikh, E. P. Simoncelli, ",2004,8442
Histograms of oriented gradients for human detection,"N. Dalal, B. Triggs, ",2005,7699,3D Challenges and a Non-In-Depth Overview of Recent Progress,Multi-target Tracking and Segmentation via Discriminative Appearance Model,3D City Modeling Using Cognitive Loops,Real-time vanishing point detection using the Local Dominant Orientation Signature,Match Box: Indoor Image Matching via Box-Like Scene Estimation,Learning Similarities for Rigid and Non-rigid Object Detection,Approximate 3D Partial Symmetry Detection Using Co-occurrence Analysis,Deeper Depth Prediction with Fully Convolutional Residual Networks,Automatic 3D Car Model Alignment for Mixed Image-Based Rendering,Robust Tracking in Low Light and Sudden Illumination Changes,Cascade Face Detection Based on Histograms of Oriented Gradients and Support Vector Machine,Real-time combustion state identification via image processing: A dynamic data-driven approach,Clustering Data of Mixed Categorical and Numerical Type With Unsupervised Feature Learning,Coupled Auto-Associative Neural Networks for Heterogeneous Face Recognition,Multiple Projective Dictionary Learning to Detect Plastic Surgery for Face Verification,Kinship Measurement on Face Images by Structured Similarity Fusion,Object Recognition Using Deep Convolutional Features Transformed by a Recursive Network Structure,A Practical Animal Detection and Collision Avoidance System Using Computer Vision Technique,Human Pose Estimation by Exploiting Spatial and Temporal Constraints in Body-Part Configurations,Robust Adaptive Fusion Tracking Based on Complex Cells and Keypoints,Learning Spatio-Temporal Information for Multi-Object Tracking,Photo-to-Sketch Transformation in a Complex Background,Multi-Channel Features Spatio-Temporal Context Learning for Visual Tracking,Aggregating Deep Convolutional Feature Maps for Insulator Detection in Infrared Images,A Novel Visual-Vocabulary-Translator-Based Cross-Domain Image Matching,Retargeted Multi-View Feature Learning With Separate and Shared Subspace Uncovering,Person Re-Identification by Optimally Organizing Multiple Similarity Measures,Robust Object Tracking via Large Margin and Scale-Adaptive Correlation Filter,A Semi-Supervised Image Classification Model Based on Improved Ensemble Projection Algorithm,Vehicle Detection and Counting in High-Resolution Aerial Images Using Convolutional Regression Neural Network
Eigenfaces vs. Fisherfaces: recognition using class specific linear projection,"P. N. Belhumeur, J. P. Hespanha, D. J. Kriegman, ",1997,5790,Sparse exponential discriminant analysis,A generalization of weighted sparse decomposition to negative weights,Hierarchical class-specific kernel discriminant analysis for face verification,Illumination invariant feature based on neighboring radiance ratio,Smile stages classification based on kernel Laplacian-lips using selection of non linear function maximum value,Rapid one-shot acquisition of dynamic VR avatars,Demonstration: Rapid one-shot acquisition of dynamic VR avatars,Multi-image morphing: Summarizing visual information from similar ancient coin image regions,Face recognition through mismatch driven representations of the face,Discriminant Locality Preserving Projections: A New Method to Face Representation and Recognition,On Channel Reliability Measure Training for Multi-Camera Face Recognition,Adaptive Fusion of Gait and Face for Human Identification in Video,Mosaicfaces: a discrete representation for face recognition,An analysis of facial shape and texture for recognition: A large scale evaluation on FRGC ver2.0,A sparse representation approach to face matching across plastic surgery,A novel method for post-surgery face recognition using sum of facial parts recognition,Composite Discriminant Factor analysis,Automatic 4D Facial Expression Recognition Using DCT Features,De-correlating CNN Features for Generative Classification,Unsupervised Feature Extraction Inspired by Latent Low-Rank Representation,A Multi-modal 2D + 3D Face Recognition Method with a Novel Local Feature Descriptor,Discriminative FaceTopics for face recognition via latent Dirichlet allocation,Person re-identification using multiple first-person-views on wearable devices,Describing Unseen Classes by Exemplars: Zero-Shot Learning Using Grouped Simile Ensemble,Robust feature extracted by the generalized optimal discriminant vectors for face recognition,Human facial recognition based on multiple feature domains,Face Recognition Based on Image Enhancement and Gabor Features,Face Recognition using Laplacian+OPRA-faces,Face recognition based on improved PCA reconstruction,Face recognition using improved local texture patterns
Robust Face Recognition via Sparse Representation,"John Wright, Allen Y. Yang, Arvind Ganesh, S. Shankar Sastry, Yi Ma, ",2009,4025
Fuzzy logic in control systems: fuzzy logic controller. I,"C. C. Lee, ",1990,3277,Fuzzy PI controlled inverter for grid interactive renewable energy systems,Automatic Generation of Fuzzy Inference Systems Using Unsupervised Learning,Robust Adaptive Control of Uncertain Nonlinear Systems Using Fuzzy Logic Systems,Multiple drug hemodynamic control by means of a supervisory-fuzzy rule-based adaptive control system: validation on a model,Effects of mechanical stress/strain and estrogen on cancellous bone structure predicted by fuzzy decision,A subject-indexed bibliography of discrete event dynamic systems,Outdoor mobile robot learning and adaptation,A fuzzy search algorithm for the estimation of motion vectors,Neural-network-based fuzzy logic control and decision system,An educational tool for fuzzy logic-controlled BDCM,An active vertical-direction gravity compensation system,Optimization of fuzzy logic inference architecture,Fuzzy logic for scaling finite element solutions of electromagnetic fields,An artificial intelligence system for a complex electromagnetic field problem. I. Finite element calculations and fuzzy logic development,Design and implementation of a fuzzy controller for a high performance induction motor drive,A model for a rider-motorcycle system using fuzzy control,Two-layer multiple-variable fuzzy logic controller,On a hierarchical structure for fuzzy modeling and control,Fuzzy gain scheduling of PID controllers,Interpolation completion and learning fuzzy rules,A methodology using fuzzy logic to optimize feedforward artificial neural network configurations,A systematic approach to obtaining fuzzy sets for control systems,A new methodology for designing a fuzzy logic controller,Fuzzy logic controllers are universal approximators,Analysis and synthesis of fuzzy closed-loop control systems,A fuzzy logic based extension to Payton and Rosenblatt's command fusion method for mobile robot navigation,A fuzzy approach to elevator group control system,Including probabilistic uncertainty in fuzzy logic controller modeling using Dempster-Shafer theory,Direct adaptive regulation of unknown nonlinear dynamical systems via dynamic neural networks,Fuzzy logic in control systems: fuzzy logic controller. I
A performance evaluation of local descriptors,"K. Mikolajczyk, C. Schmid, ",2005,2988
Beyond Bags of Features: Spatial Pyramid Matching for Recognizing Natural Scene Categories,"S. Lazebnik, C. Schmid, J. Ponce, ",2006,2646,Depth Estimation Via Stage Classification,Convolutional Fisher Kernels for RGB-D Object Recognition,Visual feature selection for GP-based localization using an omnidirectional camera,A Survey of Sparse Representation: Algorithms and Applications,Revisiting HEp-2 Cell Image Classification,Illumination-Invariant Background Subtraction: Comparative Review Models and Prospects,Multicriteria-Based Active Discriminative Dictionary Learning for Scene Recognition,Framework for combination aware AU intensity recognition,Effective image representation based on bi-layer visual codebook,What is happening in a still picture?,Online codebook reweighting using pairwise constraints for image classification,Global and local training for moving object classification in surveillance-oriented scene,Drug-taking instruments recognition,A local learning based Image-To-Class distance for image classification,Saliency based natural image understanding,Space-time neighborhood based hierarchical descriptor for action recognition,Learning from error: A two-level combined model for image classification,Scene classification using adaptive integration of reconstruction errors,An Efficient Approach to Web Near-Duplicate Image Detection,A Compact Spatial Feature Representation for Image Classification,Object Recognition by Integrated Information Using Web Images,Bag-of-Visual-Phrases via Local Contexts,Improvements to the Descriptor of SIFT by BOF Approaches,Image Retrieval with Fisher Vectors of Binary Features,Random Decomposition Forests,High order graphlets for pattern classification,A bottom-up dictionary learning based classification for face recognition,Sparse autoencoder based spatial pyramid facial feature learning,Efficient objectness via saliency seeds and contour segments,Co-occurrence context of the data-driven quantized local ternary patterns for visual recognition
Content-based image retrieval at the end of the early years,"A. W. M. Smeulders, M. Worring, S. Santini, A. Gupta, R. Jain, ",2000,2535,Multi-scale orderless cross-regions-pooling of deep attributes for image retrieval,Multi-scale saliency detection via inter-regional shortest colour path,Unsupervised discovery of human activities from long-time videos,Automatic image annotation by a loosely joint non-negative matrix factorisation,Local directional mask maximum edge patterns for image retrieval and face recognition,Performance improvement of fuzzy-based algorithms for medical image retrieval,Weighting scheme for image retrieval based on bag-of-visual-words,Accurate system for automatic pill recognition using imprint information,New non-negative sparse feature learning approach for content-based image retrieval,Face detection in color images,Wavelet-based texture retrieval using generalized Gaussian density and Kullback-Leibler distance,Computational media aesthetics: finding meaning beautiful,Understanding Heterogeneous EO Datasets: A Framework for Semantic Representations,Combining feature selectors in a product advertisement classification system,Very Fast Image Retrieval Based on JPEG Huffman Tables,Towards a segmentation and recognition-free approach for content-based document image retrieval of handwritten queries,Modulation domain texture retrieval for CBIR in digital libraries,Efficient speaker identification using distributional speaker model clustering,Efficient speaker identification using distributional speaker model clustering,Compact storage of correlated data for content based retrieval,A Model-Based Interactive Object Segmentation Procedure,Basic Concepts and Distinctions for an Aerospace Ontology of Functions Entities and Problems,Enhanced visual evaluation of feature extractors for image mining,WAY-LOOK4: A CBIR system based on class signature of the images' color and texture features,Content-based image retrieval system using neural network,CBIR using the 2-D ESPRIT method: Application to Coil_100 database,Texture Image Retrieval System Based on Non-Subsampled Contourlet and Generalized Gaussian Density Model,Automatic Identification of Shot Body Region from Clinical Photographies,Combining regional and global features for automatic image annotation based on VQ,Image Retrieval Using Maximum Frequency of Local Histogram Based Color Correlogram
The FERET evaluation methodology for face-recognition algorithms,"P. J. Phillips, Hyeonjoon Moon, S. A. Rizvi, P. J. Rauss, ",2000,2339,ASePPI an adaptive scrambling enabling privacy protection and intelligibility in H.264/AVC,Multi-layer age regression for face age estimation,Sketch-Based Image Retrieval: Benchmark and Bag-of-Features Descriptors,Biometric Evaluation on the Cloud: A Case Study with HumanID Gait Challenge,Employing vector quantization in a transform domain for face recognition,Comparative Study on Hidden Markov Model Versus Support Vector Machine: A Component-Based Method for Better Face Recognition,Performance enhancement of local vector pattern with generalized distance local binary pattern for face recognition,Color difference between real faces and facial images from a sRGB monitor,Human age estimation using multi-class SVM,Variable length dominant Gabor local binary pattern (VLD-GLBP) for face recognition,Using mobile GPU for general-purpose computing – a case study of face recognition on smartphones,Baselining illumination variables for improved facial recognition system performance,Gallery image effects on facial recognition systems,Performance evaluation of a real time video surveillance system,The Terrascope Dataset: Scripted Multi-Camera Indoor Video Surveillance with Ground-truth,For your eyes only,Secure remote matching with privacy: Scrambled support vector vaulted verification (S<sup>2</sup>V<sup>3</sup>),Relational divergence based classification on Riemannian manifolds,Relative ranking of facial attractiveness,Exploring the geo-dependence of human face appearance,Improving multiview face detection with multi-task deep convolutional neural networks,Random projections on manifolds of Symmetric Positive Definite matrices for image classification,Ensembles of Correlation Filters for Object Detection,Frontal to profile face verification in the wild,Face Recognition Based on Image Enhancement and Gabor Features,How to Recognize Facial Images with Spectacles,A novel eye localization method based on spectral residual model,A novel approach for multi-pose face detection by using skin color and FloatBoost,Local linear regression classifier for image recognition,Car recognition based on back lights and rear view features
Video Google: a text retrieval approach to object matching in videos,"J. Sivic, A. Zisserman, ",2003,2185
A Real-Time QRS Detection Algorithm,"Jiapu Pan, Willis J. Tompkins, ",1985,2098,Curvelets-based ECG steganography for data security,Preliminary study on activity monitoring using an android smart-watch,Exploiting multi-lead electrocardiogram correlations using robust third-order tensor decomposition,An Energy efficient application specific integrated circuit for electrocardiogram feature detection and its potential for ambulatory cardiovascular disease detection,ECG signal analysis using modified S-transform,Adaptive compressive engine for real-time electrocardiogram monitoring under unreliable wireless channels,Electrocardiogram signal compression using singular coefficient truncation and wavelet coefficient coding,Technique for QRS complex detection using particle swarm optimisation,Multiresolution wavelet-based QRS complex detection algorithm suited to several abnormal morphologies,Neural-network-based adaptive matched filtering for QRS detection,Data compression of ECG's by high-degree polynomial approximation,Analysis of ECG from pole-zero models,ECG data compression with time-warped polynomials,Multiway sequential hypothesis testing for tachyarrhythmia discrimination,Detection of ECG characteristic points using wavelet transforms,A comparison of the noise sensitivity of nine QRS detection algorithms,Genetic design of optimum linear and nonlinear QRS detectors,A new method for approximation of physiological signals,Classification of cardiac arrhythmias using fuzzy ARTMAP,Adaptive noise removal from biomedical signals using warped polynomials,Low-pass differentiators for biological signals with known spectra: application to ECG signal processing,A real-time microprocessor QRS detector system with a 1-ms timing accuracy for the measurement of ambulatory HRV,A patient-adaptable ECG beat classifier using a mixture of experts approach,Discrimination of atrial fibrillation from regular atrial rhythms by spatial precision of local activation direction,A new interpretation of nonlinear energy operator and its efficacy in spike detection,Detection of atrial activity from high-voltage leads of implantable ventricular defibrillators using a cancellation technique,Analysis of beat-to-beat variability of frequency contents in the electrocardiogram using two-dimensional Fourier transforms,An adaptive backpropagation neural network for real-time ischemia episodes detection: development and performance analysis using the European ST-T database,ECG beat detection using filter banks,SVD-based on-line exercise ECG signal orthogonalization
Pfinder: real-time tracking of the human body,"C. R. Wren, A. Azarbayejani, T. Darrell, A. P. Pentland, ",1997,2033,Video object segmentation using background model based on pixel time series clustering,Requirements for stereovision-based access control for physical spaces,Training for physical tasks in virtual environments: Tai Chi,The analysis of human motion and its application for visual surveillance,Multi-camera colour tracking,Robust person tracking in real scenarios with non-stationary background using a statistical computer vision approach,Frame-rate omnidirectional surveillance and tracking of camouflaged and occluded targets,A real-time system for monitoring of cyclists and pedestrians,Video surveillance of interactions,POSTRACK: a low cost real-time motion tracking system for VR application,Efficient occlusion handling for multiple agent tracking by reasoning with surveillance event primitives,Comparison of target detection algorithms using adaptive background models,Performance evaluation of a real time video surveillance system,Evaluation of object tracking for aircraft activity surveillance,Background initialization with a new robust statistical approach,Modeling background from compressed video,Evaluation of Motion Segmentation Quality for Aircraft Activity Surveillance,PETS Metrics: On-Line Performance Evaluation Service,Tracking Multiple Video Objects in Complex Scenes,3D Target Tracking Using Multiple Calibrated Cameras,Real-time visually guided human figure control using IK-based motion synthesis,A Novel Thresholding Approach to Background Subtraction,AirTouch: Interacting with computer systems at a distance,A nonintrusive system for behavioral analysis of children using multiple RGB+depth sensors,Generalized Sum of Gaussians for Real-Time Human Pose Tracking from a Single Depth Sensor,Scene-independent feature- and classifier-based vehicle headlight and shadow removal in video sequences,Research on Dynamic Vehicle Detection and Image Capture Based on Adaptive Background,Real Time People Tracking and Counting in Visual Surveillance,Moving Target Detection in Video Monitoring System,Moving Target Detection Based on Background Modeling by Multi-level Median Filter
Image Denoising Via Sparse and Redundant Representations Over Learned Dictionaries,"Michael Elad, Michal Aharon, ",2006,1893,Combining Gabor filtering and classification dictionaries learning for fingerprint enhancement,Critical parameters of the sparse representation-based classifier,Loose L<sub>1/2</sub> regularised sparse representation for face recognition,Improved hybrid method for image super-resolution,Guided image filtering using signal subspace projection,Effective two-step method for face hallucination based on sparse compensation on over-complete patches,Multiple-constraint variational framework and image restoration problems,Single-frame image super-resolution inspired by perceptual criteria,Simultaneous image fusion and denoising with adaptive sparse representation,Supervised locally linear embedding algorithm based on orthogonal matching pursuit,Image denoising using common vector approach,Sparse representation based on vector extension of reduced quaternion matrix for multiscale image denoising,Simultaneous enhancement and noise reduction of a single low-light image,Image denoising based on sparse representation and gradient histogram,Image denoising via bidirectional low rank representation with cluster adaptive dictionary,Pruned non-local means,Image fusion based on multi-scale transform and sparse representation: an image energy approach,Image noise types recognition using convolutional neural network with principal components analysis,Iterative weighted sparse representation for X-ray cardiovascular angiogram image denoising over learned dictionary,CT image denoising using NLM and correlation-based wavelet packet thresholding,Radar high-resolution range profiles target recognition based on stable dictionary learning,Super-resolution Doppler beam sharpening imaging via sparse representation,Union of low-rank subspaces detector,Improving GRN re-construction by mining hidden regulatory signals,Sparse Modeling of Shape from Structured Light,A Patch Prior for Dense 3D Reconstruction in Man-Made Environments,Medical Image Feature Extraction and Fusion Algorithm Based on K-SVD,A fast image reconstruction algorithm for compressed sensing-based atomic force microscopy,A Survey of Sparse Representation: Algorithms and Applications,Deep Dictionary Learning
Texture features for browsing and retrieval of image data,"B. S. Manjunath, W. Y. Ma, ",1996,1812,Rotation and scale invariant texture classification by compensating for distribution changes using covariate shift in uniform local binary patterns,Local directional mask maximum edge patterns for image retrieval and face recognition,Image segmentation framework based on multiple feature spaces,Content-based image retrieval using fuzzy class membership and rules based on classifier confidence,Efficient image classification via sparse coding spatial pyramid matching representation of SIFT-WCS-LTP feature,Complete three-phase detection framework for identifying abnormal cervical cells,A digital library for geographically referenced materials,Defect detection in textured materials using Gabor filters,Periodicity directionality and randomness: Wold features for image modeling and retrieval,Texture features for browsing and retrieval of image data,Unsupervised texture segmentation in a deterministic annealing framework,Similarity measures,Performance evaluation of the nearest feature line method in image classification and retrieval,Content-based image retrieval at the end of the early years,Toward specification-driven change detection,Extension of Tamura Texture Features for 3D Fluorescence Microscopy,Analysis of asymmetry in mammograms via directional filtering with Gabor wavelets,Supporting ranked Boolean similarity queries in MARS,Emergent semantics through interaction in image databases,NeTra-V: toward an object-based video representation,A new approach to image retrieval with hierarchical color clustering,Relevance feedback: a power tool for interactive content-based image retrieval,A semantic event-detection approach and its application to detecting hunts in wildlife video,A fast multiresolution feature matching algorithm for exhaustive search in large image databases,Color and texture descriptors,The past present and future of image and multidimensional signal processing,A multiscale representation including opponent color features for texture recognition,Statistical texture characterization from discrete wavelet representations,Extended fractal analysis for texture classification and segmentation,WaveGuide: a joint wavelet-based image representation and description system
Two-dimensional PCA: a new approach to appearance-based face representation and recognition,"Jian Yang, D. Zhang, A. F. Frangi, Jing-yu Yang, ",2004,1561,Face recognition based on convolution neural network,Feature extraction based on 2D compressive sensing for SAR automatic target recognition,Studies on Hyperspectral Face Recognition in Visible Spectrum With Feature Band Selection,On image matrix based feature extraction algorithms,BDPCA plus LDA: a novel fast feature extraction technique for face recognition,Bidirectional PCA with assembled matrix distance metric for image recognition,Constructing PCA Baseline Algorithms to Reevaluate ICA-Based Face-Recognition Performance,Comments on On Image Matrix Based Feature Extraction Algorithms,Discriminant Locally Linear Embedding With High-Order Tensor Data,Two-Dimensional Maximum Margin Feature Extraction for Face Recognition,Binary Two-Dimensional PCA,L1-Norm-Based 2DPCA,Multiview Face Recognition: From TensorFace to V-TensorFace and K-TensorFace,Multivariate Multilinear Regression,Multidimensional Latent Semantic Analysis Using Term Spatial Information,Throughput-Distortion Computation of Generic Matrix Multiplication: Toward a Computation Channel for Digital Signal Processing Systems,Reliable Linear Sesquilinear and Bijective Operations on Integer Data Streams Via Numerical Entanglement,Improved 2DLDA Algorithm and Its Application in Face Recognition,A comparison of classification approaches for deep face recognition,Learning for two-dimensional principal component analysis,An Investigation on Recent Advances in Feature Partitioning Based Principal Component Analysis Methods,2DCCA: A Novel Method for Small Sample Size Face Recognition,Multi-view human action recognition system employing 2DPCA,Fully automatic 3D facial expression recognition using local depth features,Low-Dimensional Embedding of Functional Connectivity Graphs for Brain State Decoding,2D face analysis: A comparative study,Face recognition by fuzzy generalized 2DFLD method and RBF neural network classifier,Human expression recognition based on feature block 2DPCA and Manhattan distance classifier,Real-time facial expressions recognition system for service robot based-on ASM and SVMs,Face recognition based on improved PCA reconstruction
