The continuation power flow: a tool for steady state voltage stability analysis,"V. Ajjarapu, C. Christy, ",1992,741,A novel index for identification of weak nodes for reactive compensation to improve voltage stability,Special protection scheme against voltage collapse,Initialised load-flow analysis based on Lagrange polynomial approximation for efficient quasi-static time-series simulation,Numerical polynomial homotopy continuation method to locate all the power flow solutions,Measurement-based voltage stability assessment for load areas addressing n−1 contingencies,Voltage stability assessment based on improved coupled single-port method,Voltage instability: mechanisms and control strategies [power systems],Local bifurcation in power systems: theory computation and application,Analysis tools for power systems-contending with nonlinearities,Voltage instability: phenomena countermeasures and analysis methods,A general parametric optimal power flow,An optimal reactive power planning strategy against voltage collapse,A power flow measure for unsolvable cases,CPFLOW: a practical tool for tracing power system steady-state stationary behavior due to load and generation variations,Estimating the loading limit margin taking into account voltage collapse areas,A piecewise global small-disturbance voltage-stability analysis of structure-preserving power system models,Methods for contingency screening and ranking for voltage stability analysis of power systems,Invariant subspace parametric sensitivity (ISPS) of structure-preserving power system models,On-line detection of power system small disturbance voltage instability,Sensitivity of the loading margin to voltage collapse with respect to arbitrary parameters,On dynamic load models for voltage stability studies,Assessment of transmission system loadability,A method to approximate a closest loadability limit using multiple load flow solutions,The role of automatic differentiation in power system analysis,Methods for calculating oscillations in large power systems,New techniques to speed up voltage collapse computations using tangent vectors,Neuro-fuzzy networks for voltage security monitoring based on synchronized phasor measurements,A practical minimum load shedding strategy to mitigate voltage collapse,Available transfer capability calculations,Contingency ranking for voltage collapse via sensitivities from a single nose curve
"Demand Side Management: Demand Response, Intelligent Energy Systems, and Smart Loads","Peter Palensky, Dietmar Dietrich, ",2011,733,Demand side management with consumer clusters in cyber-physical smart distribution system considering price-based and reward-based scheduling programs,Operation of battery energy storage system using extensional information model based on IEC 61850 for micro-grids,Investigation and mathematical modelling of the impact of incentive signals to consumers on their consumption load forecast and network operation,Cost effective utility-solar photovoltaic based hybrid scheme for institutional buildings: a case study,Appliances considered demand response optimisation for smart grid,Demand response aggregator coordinated two-stage responsive load scheduling in distribution system considering customer behaviour,Bidding strategy analysis of virtual power plant considering demand response and uncertainty of renewable energy,Dynamic demand response in smart buildings using an intelligent residential load management system,Coordinated residential energy resource scheduling with vehicle-to-home and high photovoltaic penetrations,Distributed game-based pricing strategy for energy sharing in microgrid with PV prosumers,Assessment of the impact of demand-side management on distribution network voltage stability,Testing and validation of the ACCESS system,Demand-Side Energy Management: FTTH-based mode for Smart homes,A hybrid dynamic system model for the assessment of transportation electrification,Real-Time Control Based on Multi-Agent Systems for the Operation of Large Ports as Prosumer Microgrids,Trusted Interconnections Between a Centralized Controller and Commercial Building HVAC Systems for Reliable Demand Response,Security-Based Active Demand Response Strategy Considering Uncertainties in Power Systems,Cognitive Radio Based Sensor Network in Smart Grid: Architectures Applications and Communication Technologies,A Learning Automaton-Based Scheme for Scheduling Domestic Shiftable Loads in Smart Grids,Elastic Energy Distribution of Local Area Packetized Power Networks to Mitigate Distribution Level Load Fluctuation,Impact of Data Quality in Home Energy Management System on Distribution System State Estimation,An optimal treatment assignment strategy to evaluate demand response effect,Electric spring for power quality improvement,Simultaneous voltage and current compensation of the 3-phase electric spring with decomposed voltage control,Voltage and frequency control of electric spring based smart loads,Enhanced digital PI control with state-variable feedback loop for DC electric springs,Generalized demand side resources for microgrid energy management,Power management strategy combining energy storage and demand response for microgrid emergency autonomous operation,Threshold based scheduling of residential distributed energy resources for demand response,Enhanced distributed MPC design for efficiency utility of autonomous multi-microgrids
Modeling and Analysis of K-Tier Downlink Heterogeneous Cellular Networks,"Harpreet S. Dhillon, Radha Krishna Ganti, Francois Baccelli, Jeffrey G. Andrews, ",2012,719,Qualitative analysis for coverage probability and energy efficiency in cognitive-femtocell networks under macrocell infrastructure,User association with jointly maximising downlink sum rate and minimising uplink sum power for heterogeneous cellular networks,Load-aware user association with quality of service support in heterogeneous cellular networks,Resource management for interference mitigation in device-to-device communication,On the performance of the Poisson-point-process-based networks with no channel state information feedback,Edge aware cross-tier base station cooperation in heterogeneous wireless networks with non-uniformly-distributed nodes,Generalised benders decomposition-based load optimisation in cellular and public WLAN interworking network,Analysis of dedicated and shared device-to-device communication in cellular networks over Nakagami-m fading channels,Pushing the Limits of LTE: A Survey on Research Enhancing the Standard,A Tele-Traffic-Aware Optimal Base-Station Deployment Strategy for Energy-Efficient Large-Scale Cellular Networks,What is the Best Spatial Distribution to Model Base Station Density? A Deep Dive into Two European Mobile Networks,Public Safety Priority-Based User Association for Load Balancing and Interference Reduction in PS-LTE Systems,Optimum Biasing for Cell Load Balancing Under QoS and Interference Management in HetNets,Adaptive Resource Management Strategy in Practical Multi-Radio Heterogeneous Networks,Stochastic Geometric Analysis of Energy-Efficient Dense Cellular Networks,Full-Duplex Small Cells for Next Generation Heterogeneous Cellular Networks: A Case Study of Outage and Rate Coverage Analysis,Energy-Efficient User Association and Power Control in the Heterogeneous Network,Stochastic Geometry-Based Modeling and Analysis of Citizens Broadband Radio Service System,Analysis of Load Balancing and Interference Management in Heterogeneous Cellular Networks,Base Station Ordering for Emergency Call Localization in Ultra-Dense Cellular Networks,Performance Analysis of Dense Small Cell Networks With Practical Antenna Heights Under Rician Fading,Quality of Service Provisions for Maritime Communications Based on Cellular Networks,3-D Spatial Modeling of Network Interference in Two-Tier Heterogeneous Networks,Effects of range expansion and interference coordination on capacity and fairness in heterogeneous networks,Downlink coverage probability in MIMO HetNets,On decoding the kth strongest user in poisson networks with arbitrary fading distribution,A general approach to SINR-based performance metrics with application to D2D and carrier aggregation,Coverage by pairwise base station cooperation under adaptive geometric policies,Downlink coverage analysis of n-tier heterogeneous cellular networks based on clustered stochastic geometry,Optimal resource allocation in ultra-dense networks with many carriers
Robust adaptive beamforming using worst-case performance optimization: a solution to the signal mismatch problem,"S. A. Vorobyov, A. B. Gershman, Zhi-Quan Luo, ",2003,716,A sequential constraint relaxation algorithm for rank-one constrained problems,A novel adaptive wideband frequency invariant beamforming algorithm for conformal arrays,Opportunistic Spectrum Sharing in Relay-Assisted Cognitive Systems With Imperfect CSI,Secrecy Rate Optimizations for a MIMO Secrecy Channel With a Cooperative Jammer,Robust Stochastic Optimization for MISO Broadcast Channel With Delayed CSIT and Limited Transmitting Antennas,Distributed CSI Acquisition and Coordinated Precoding for TDD Multicell MIMO Systems,Robust MMSE Beamforming for Multiantenna Relay Networks,A Robust and Efficient Algorithm for Coprime Array Adaptive Beamforming,Robust Adaptive Beamforming Against Mutual Coupling Based on Mutual Coupling Coefficients Estimation,Optimal Multicell Coordinated Beamforming for Downlink High-Speed Railway Communications,Robust blind multiuser detection for synchronous CDMA systems using worst-case performance optimization,Robust Downlink Beamforming Based on Outage Probability Specifications,A State-Space Approach to Robust Multiuser Detection,Maximum-Likelihood Array Signal Decoding in the Presence of Block-Wise Stationary Cochannel Interference,Robust cognitive beamforming with partial channel state information,On multicast beamforming for minimum outage,Robust beamforming in cognitive radio,A Probabilistic Approach for Robust Leakage-Based MU-MIMO Downlink Beamforming with Imperfect Channel State Information,Precoding in Multigateway Multibeam Satellite Systems,Transmit Precoding in Underlay MIMO Cognitive Radio With Unavailable or Imperfect Knowledge of Primary Interference Channel,Robust minimum variance beamforming,Robust downlink beamforming based upon outage probability criterion [cellular radio],Robust transmit beamforming based on imperfect channel feedback,A Minimax Regret Approach to Robust Beamforming,Uplink to downlink spatial covariance matrix transformation methods for downlink beamforming of a UMTS-FDD system,A computationally efficient method for robust minimum variance beamforming,Robust Linear Transceiver Design in MIMO Ad Hoc Cognitive Radio Networks,A Suboptimal User Maximization Algorithm for an OFDMA Based Cognitive Radio Network,Cooperative Cognitive Radio Beamforming in the Presence of Location Errors,MMSE V-BLAST for Imperfect MIMO Channels
Efficient fair queuing using deficit round-robin,"M. Shreedhar, G. Varghese, ",1996,712,Fundamental trade-offs between resource separation and resource share for quality of service guarantees,Hardware implementation of fair queuing algorithms for asynchronous transfer mode networks,QoS support for integrated services over CATV,A terabit multiservice switch,TCP switching: exposing circuits to IP,On the relationship between absolute and relative fairness bounds,Toward best-effort services over WDM networks with fair access and minimum bandwidth guarantee,Linear-complexity algorithms for QoS support in input-queued switches with no speedup,Priority queue schedulers with approximate sorting in output-buffered switches,Implementing scheduling algorithms in high-speed networks,Scheduling algorithms in broadband wireless networks,Scheduling multimedia services in a low-power MAC for wireless and mobile ATM networks,Scalable services via egress admission control,Fair and efficient packet scheduling using Elastic Round Robin,Efficient fair queuing using deficit round-robin,Generalized guaranteed rate scheduling algorithms: a framework,Hierarchical packet fair queueing algorithms,Start-time fair queueing: a scheduling algorithm for integrated services packet switching networks,Real-time block transfer under a link-sharing hierarchy,Rate-proportional servers: a design methodology for fair queueing algorithms,Efficient fair queueing algorithms for packet-switched networks,Latency-rate servers: a general model for analysis of traffic scheduling algorithms,Carry-over round robin: a simple cell scheduling mechanism for ATM networks,Understanding and improving TCP performance over networks with minimum rate guarantees,Router plugins: a software architecture for next-generation routers,Credit-based fair queueing (CBFQ): a simple service-scheduling algorithm for packet-switched networks,Proportional Nested Deficit Round Robin: Improving the Latency of Packet Scheduler with an O(1) Complexity,Design and Evaluation of Diffserv Functionalities in the MPLS Edge Router Architecture,Extending WF^2 Q+ to Support a Dynamic Traffic Mix,Delay Analysis of Scheduling Algorithms for Real-Time Traffic in Packet Switched Networks
Contiki - a lightweight and flexible operating system for tiny networked sensors,"A. Dunkels, B. Gronvall, T. Voigt, ",2004,712,Survey on security in Internet of Things: State of the art and challenges,Securing networked embedded systems code through distributed systems analysis,Securing RPL-based Internet of Things applied for water pipeline monitoring,MoX-MAC: A low power and efficient access delay for mobile wireless sensor networks,A multi-layer architecture for wireless sensor network virtualization,Improving the network lifetime with energy-balancing routing: Application to RPL,Fast Information Exchange in Proximity-Based Multichannel Wireless Networks,SNOMC: An overlay multicast protocol for Wireless Sensor Networks,A test environment for phase-based ranging and localization,Congestion-aware RPL for 6L0WPAN networks,Congestion analysis for low power and lossy networks,Cross-Component Power Management in Wireless Sensor Network,DT-WBAN: Disruption tolerant wireless body area networks in healthcare applications,Adding value to WSN simulation using the IoT-LAB experimental platform,A framework for cooperative intranet of Things wireless sensor network applications,Bluetooth smart: An enabling technology for the Internet of Things,Low overhead loop-free routing in wireless sensor networks,Enabling composite metrics in collection protocols for WSNs,Cloud assisted performance enhancement of smart applications in Wireless Sensor Networks,Energy aware software evolution for Wireless Sensor Networks,Design and analysis of virtualization framework for Wireless Sensor Networks,Proxy support for service discovery using mDNS/DNS-SD in low power networks,Trickle-L<sup>2</sup>: Lightweight link quality estimation through Trickle in RPL networks,Adaptive broadcast suppression for Trickle-based protocols,An integrated simulation environment for Wireless Sensor Networks,Energy efficiency impact of transient node failures when using RPL,Implementing dynamic address changes in ContikiOS,Modeling of Starter/Generator Based on Three-stage Brushless Synchronous Machines,Fault Diagnosis of the Blast Furnace Based on the Bayesian Network Model,An OPC UA Sleepy Proxy Mechanism for Wireless Field Devices
Static-noise margin analysis of MOS SRAM cells,"E. Seevinck, F. J. List, J. Lohstroh, ",1987,706,SRAM cell with asymmetric pass-gate nMOSFETs for embedded memory applications,Design and analysis of 6T SRAM cell with NBL write assist technique using FinFET,A Low Power Area Efficient Full Custom 3-Read 3-Write General Purpose Register in 65nm Technology,Power Energy and SNM Optimization of 6TSRAM Cell Using Power Gating Technique,A sub-10nm U-shape FinFET design with suppressed leakage current and DIBL effect,A family of cells to reduce the soft-error-rate in ternary-CAM,Value-conscious cache: simple technique for reducing cache access power,Static and dynamic stability improvement strategies for 6T CMOS low-power SRAMs,Robustness analysis of 6T SRAMs in memory retention mode under PVT variations,Stability optimization of embedded 8T SRAMs using Word-Line Voltage modulation,Analytical model for SRAM dynamic write-ability degradation due to gate oxide breakdown,Stability and yield-oriented ultra-low-power embedded 6T SRAM cell design optimization,Statistical analysis of 6T SRAM data retention voltage under process variation,Impact of Resistive-Bridging Defects in SRAM Core-Cell,Modeling SRAM start-up behavior for Physical Unclonable Functions,On the correlation between Static Noise Margin and Soft Error Rate evaluated for a 40nm SRAM cell,High-yield design of high-density SRAM for low-voltage and low-leakage operations,Analyzing ECL's noise margin,Low-power and high-stability SRAM technology using a laser-recrystallized p-channel SOI MOSFET,A stacked-CMOS cell technology for high-density SRAM's,A new analytical model of SRAM cell stability in low-voltage operation,An asymmetric memory cell using a C-TFT for single-bit-line SRAM's,Theoretical considerations for SRAM total-dose hardening,A 1-V operating 256-kb full-CMOS SRAM,A 14 ns 256 K*1 CMOS SRAM with multiple test modes,A source sensing technique applied to SRAM cells,An experimental 220-MHz 1-Gb DRAM with a distributed-column-control architecture,A current direction sense technique for multiport SRAM's,Soft-defect detection (SDD) technique for a high-reliability CMOS SRAM,Design of 4-kbit*4-layer optically coupled three-dimensional common memory for parallel processor system
Power Management Strategies for a Microgrid With Multiple Distributed Generation Units,"F. Katiraei, M. R. Iravani, ",2006,693,Operation of battery energy storage system using extensional information model based on IEC 61850 for micro-grids,Decentralised coordinated control of microgrid based on multi-agent system,Self-consumption and storage as a way to facilitate the integration of renewable energy in low voltage distribution networks,Dynamic equivalencing of an active distribution network for large-scale power system frequency stability studies,Simple and efficient method for steady-state voltage stability analysis of islanded microgrids with considering wind turbine generation and frequency deviation,Hierarchical hybrid control strategy for micro-grid switching stabilisation during operating mode conversion,Seamless control scheme for distributed energy resources in microgrids,Real-time verification of new controller to improve small/large-signal stability and fault ride-through capability of multi-DER microgrids,Power sharing in parallel inverters with different types of loads,Decentralised control for reactive power sharing using adaptive virtual impedance,Fundamental impedance identification method for grid-connected voltage source inverters,Voltage droop control at point of common coupling with arm current and capacitor voltage analysis for distribution static synchronous compensator based on modular multilevel converter,Adaptive decoupled power control method for inverter connected DG,Power sharing control strategies for a three-phase microgrid in different operating condition with droop control and damping factor investigation,Modelling analysis and control design of a two-stage photovoltaic generation system,Distributed finite-time cooperative control of droop-controlled microgrids under switching topology,Assessment of overvoltage mitigation techniques in low-voltage distribution networks with high penetration of photovoltaic microgeneration,A distributed control for multiple photovoltaic generators in distribution networks,Efficiency-driven control of dispatchable sources and storage units in hybrid energy systems,State of the Art in Research on Microgrids: A Review,Unit commitment by dynamic programming for microgrid operational planning optimization and emission reduction,Effect of disconnection of generation units on the rate of change of frequency in distributed power systems,A new islanding method for distributed generation and its application in power system restoration,Development of Communicationless Hot-Swap Paralleling for Single-Phase UPS Inverters based on Adaptive Droop Method,State-space modeling analysis and implementation of paralleled inverters for microgrid applications,Droop controller design methods for isolated DC-DC converter in DC grid battery energy storage applications,A fully autonomous power management strategy for DC microgrid bus voltages,Two-layer distributed cooperative control of multi-inverter microgrids,Real-time integrated model of a micro-grid with distributed clean energy generators and their power electronics,Research of Multi-Level Inverter in PVMS of Micro-Grid
"Analysis, Experimental Results, and Range Adaptation of Magnetically Coupled Resonators for Wireless Power Transfer","Alanson P. Sample, David T. Meyer, Joshua R. Smith, ",2011,684,Theoretical evaluation of bifurcation in dependence on resonance frequency in two-coil inductive power transfer,Wireless power transfer: Are children more exposed than adults?,A novel coupling factor independent highly efficient resonant based wireless power transfer,Multiple-folded antenna design for maximizing power transfer efficiency at 6.78 MHz,Asymmetric strongly coupled printed resonators for wireless charging applications,Analysis and modeling of Conformal Strongly Coupled Magnetic Resonant devices,Study on frequency control technology of resonant wireless power transmission system,Analysis of coils' transmission effect for magnetic resonance wireless power transmission system,Long-term throughput optimization in WPCN with battery-powered devices,Long-term throughput optimization in WPCN with battery-powered devices,Evaluation of inductive coupling and RF-DC for Wireless Power Transmission,Experimental analysis of double spiral resonator for wireless power transmission,To improve wireless power transmission efficiency by using coil arrays,3-Coil resonance-based wireless power transfer system for implantable electronic,A new design of wireless power transfer system using hellical resonators applicapable to multi-channel power transmission,Optimization of geometric parameters for circular loop antenna in magnetic coupled wireless power transfer,Multi-band design of matched wireless power transfer links,System level power control algorithm in wireless power transmission for reducing EMF,Wireless power transfer techniques for cell balancing of battery management systems,Optimal load analysis for a two-receiver wireless power transfer system,Development of the optimization framework for wireless power transfer systems,Experimental investigation of 3D metamaterial for mid-range wireless power transfer,The feasibility of using resonant inductive power transfer to recharge wireless sensor network nodes,Behavior of resonant electrical coupling in terms of range and relative orientation,Misalignment-compensated resonant power transfer system,A particle swarm optimizer for tuning a software-defined highly configurable wireless power transfer platform,Underwater wireless power transfer,Wireless power transfer for mobile devices with consideration of ground effect,Optimization of a magnetically coupled resonators system for Power Line Communication integration,Wireless power transfer in human tissue via Conformal Strongly Coupled Magnetic Resonance
