New trends in active filters for power conditioning,"H. Akagi, ",1996,982,A high-power active filtering system with fundamental magnetic flux compensation,Power Quality Problems Compensation With Universal Power Quality Conditioning System,Enhancement of Voltage Quality in Isolated Power Systems,A Novel Active Power Filter for High-Voltage Power Distribution Systems Application,Development of a Network-Wide Harmonic Control Scheme Using an Active Filter,Study on the Influence of Supply-Voltage Fluctuation on Shunt Active Power Filter,Optimal Harmonic Estimation Using A Particle Swarm Optimizer,A New Control Philosophy for a Unified Power Quality Conditioner (UPQC) to Coordinate Load-Reactive Power Demand Between Shunt and Series Inverters,Output Feedback Control of Single-Phase UPQC Based on a Novel Model,Multiconverter Unified Power-Quality Conditioning System: MC-UPQC,New Control Scheme for a Unified Power-Quality Compensator-Q With Minimum Active Power Injection,A Selective Harmonic Amplification Method for Reduction of kVA Rating of Current Source Converters in Shunt Active Power Filters,Analysis Design and Control of a Unified Power-Quality Conditioner Based on a Current-Source Topology,A Distributed Filtering Scheme to Mitigate Harmonics in Residential Distribution Systems,Adaptive Power System for Managing Large Dynamic Loads,Operation of static series compensator under distorted utility conditions,A novel time-domain current-detection algorithm for shunt active power filters,A Controlled Filtering Method for Estimating Harmonics of Off-Nominal Frequencies,Power Quality Conditioning in LV Distribution Networks: Results by Field Demonstration,Profits of power-quality improvement by residential distributed generation,A new control scheme for shunt hybrid power filter,The structural stability analysis of active power filter and its capability of suppressing EMI,Self-tuning output passive-filter for low power DC/AC inverters,Neural network and fuzzy logic controllers for three-phase three-level shunt active power filter,The design of a hybrid power filter based on variable structure control,A Novel Harmonics Detection Method Based on Wavelet Algorithm for Active Power Filter,A Power Line Conditioner Using Improved Adaptive Predictive Filter in Electric Power Distribution Systems,Fuzzy logic based auto-modulation of parameters PI control for active power filter,Selective compensation of power quality problems with a three-phase four-leg shunt active filter,Study on Repetitive Control of Current Loop in Active Power Filter
Planar negative refractive index media using periodically L-C loaded transmission lines,"G. V. Eleftheriades, A. K. Iyer, P. C. Kremer, ",2002,965,Wave propagation in two-dimensional left-handed non-linear transmission line metamaterials,Constitutive parameter analysis of left-handed dual-star split-ring resonator metamaterial for homogeneous infinite slab,Design of leaky-wave antenna with wide beam-scanning angle and low cross-polarisation using novel miniaturised composite right/left-handed transmission line,Compact metamaterial coplanar waveguide ferrite tunable resonator,A miniaturized ring resonator using a left-handed transmission line section,EBG and metamaterial devices and phenomena in planar and volumetric configurations,A compact and broadband NRI-TL metamaterial monopole antenna,Negative optical phenomena,Surrogate modeling techniques for frequency-selective surfaces and metamaterials design,Compact ultra-wideband metamaterial antenna,Development of LTCC-based super-compact multi-layered CRLH transmission lines and broadband applications,Electromagnetic coupling mechanism in vertical and horizontal SRR-loaded coplanar waveguide,Realization of arbitrary dual-band components using an improved CRLH transmission-line model,Free-space sub-diffraction imaging using a transmission-line superlens,Capacitively loaded loop antenna fed by wideband metamaterial balun,A tri-band compact metamaterial-loaded monopole antenna for WiFi and WiMAX applications,Investigation of 1-D meta-structured leaky wave antennas using transmission line theory considering radiation effects,Experimental study of a modified silicon-based CRLH cell for enhanced reconfigurability,Analysis of bandwidth for metamaterial-based zeroth-order resonant antennas,A metamaterial-based passive MMIC tunable phase shifter,Metamaterial-inspired loop antennas for wireless power transmission,Comapct and tunable metamaterial antenna for multi-band wireless communication applications,Subwavelength focusing using a negative-refractive-index transmission line lens,Recent results verifying free-space focusing using a fully printed metamaterial lens,Compression of biomédical signals on FPGA by DWT and run-length,Enabling electromagnetic applications of negative-refractive-index transmission-line metamaterials part I,Enabling electromagnetic applications of negative-refractive-index transmission-line metamaterials part II,Modeling of materials with negative refractive index using TLM 3D SCN node and inter-cell networks,A novel broadband antenna with Right/Left-Handed transmission line,Non-reciprocal CRLH transmission line on substrate YIG
IEEE Reliability Test System,"Probability Methods Subcommittee, ",1979,964,Comparative study between two market clearing schemes in wind dominant electricity markets,Coordinating generation and load pickup during load restoration with discrete load increments and reserve constraints,Assessing the effect of wind power peaking characteristics on the maximum penetration level of wind power,Flexible transmission expansion planning associated with large-scale wind farms integration considering demand response,Power system reliability evaluation using a state space classification technique and particle swarm optimisation search method,Value-based reserve market settlement,Identification of critical generating units for maintenance: a game theory approach,Optimal design of secondary distribution system considering electric vehicles high-power residential fast chargers,Impact-increment based decoupled reliability assessment approach for composite generation and transmission systems,Power flow modelling to UHVDC line and its hierarchical connection mode,Rigorous model for evaluating wind power capacity credit,Optimal sizing approach for islanded microgrids,Optimal control method for wind farm to support temporary primary frequency control with minimised wind energy cost,Robust generation maintenance scheduling considering wind power and forced outages,Two-stage algorithm for efficient transmission expansion planning with renewable energy resources,Cost–benefit analysis of pumped hydro storage using improved probabilistic production simulation method,A method for evaluating the frequency of deficiency-states of electric-power systems,Loadability in composite generation/transmission power-system reliability evaluation,Reliability evaluation in power-system transmission planning: practical considerations,The limit of sum of Markov Bernoulli variables in system reliability evaluation,A fast Monte Carlo method for evaluating reliability indexes,Generating peaking unit operating characteristics,A concise method for calculating expected unserved energy in generating system reliability analysis,Utilization of interrupted energy assessment rates in generation and transmission system planning,A generalized continuous distribution approach for generating capacity reliability evaluation and its applications,Power arrival evaluation of bulk system including network constraints based on linear programming approach,Export/import of spinning reserve in interconnected generation systems,Transmission loss evaluation based on probabilistic power flow,A security based approach to composite power system reliability evaluation,A hybrid model for quantifying different operating states of composite power systems
Defining control strategies for MicroGrids islanded operation,"J. A. P. Lopes, C. L. Moreira, A. G. Madureira, ",2006,960,Operation of battery energy storage system using extensional information model based on IEC 61850 for micro-grids,Seamless control scheme for distributed energy resources in microgrids,Real-time verification of new controller to improve small/large-signal stability and fault ride-through capability of multi-DER microgrids,General distributed secondary control for multi-microgrids with both PQ-controlled and droop-controlled distributed generators,Voltage and frequency control during microgrid islanding in a multi-area multi-microgrid system,Game-theoretic dispatch control in microgrids considering network losses and renewable distributed energy resources integration,Decentralised secondary voltage and frequency control scheme for islanded microgrid based on adaptive state estimator,Cost-based droop scheme with lower generation costs for microgrids,Load margin assessment of systems with distributed generation with the help of a neuro-fuzzy method,Voltage security in AC microgrids: a power flow-based approach considering droop-controlled inverters,Coordination of energy storage systems and DR resources for optimal scheduling of microgrids under uncertainties,Combining droop and direct current vector control for control of parallel inverters in microgrid,Design guidelines for MPC-based frequency regulation for islanded microgrids with storage voltage and ramping constraints,Distributed finite-time cooperative control of droop-controlled microgrids under switching topology,Microgrid multi-source coordination optimal control based on multi-scenarios analysis,Optimal configuration of energy storage system based on frequency hierarchical control in ship power system with solar photovoltaic plant,Data-driven approach for monitoring protection and control of distribution system assets using micro-PMU technology,An Adaptive Control System for a Dc Microgrid for Data Centers,Control of inverter-connected sources in autonomous microgrids,On the effect of DC source voltage on inverter-based frequency and voltage regulation in a military microgrid,Robust μ-synthesis control of a four-wire autonomous electronically-interfaced distributed generation unit for mitigation of harmonic voltage disturbance,On reactive power flow and voltage stability in microgrids,Droop-controlled inverter-based microgrids are robust to clock drifts,ISS of multistable systems with delays: Application to droop-controlled inverter-based microgrids,Improving performance of droop-controlled microgrids through distributed PI-control,State of the Art in Research on Microgrids: A Review,Distributed Coordination Load Shedding of Islanded Microgrids Based on Sub-Gradient Algorithm,Dynamic Modeling of Networks Microgrids and Renewable Sources in the dq0 Reference Frame: A Survey,Estimating the dynamic power requirements for controllable energy storage on PV microgrid,An intelligent battery management system based on fuzzy controller for home microgrid working in grid-connected and island mode
Efficient power control via pricing in wireless data networks,"C. U. Saraydar, N. B. Mandayam, D. J. Goodman, ",2002,894,Efficient swarm intelligent algorithm for power control game in cognitive radio networks,Spectrum sharing and power allocation in multi-input-multi-output multi-band underlay cognitive radio networks,Optimal pre-equalisation for wireless multi-carrier code division multiple access systems under quality of service requirements,Non-cooperative uplink interference protection framework for fair and energy efficient orthogonal frequency division multiple access networks,Efficient pre-equalisation strategies for the downlink of a multi-carrier code division multiple-access wireless network,Cooperation in wireless networks: a game-theoretic framework with reinforcement learning,Subcarrier and power allocation for multi-user OFDMA wireless networks under imperfect channel state information,Distributed power control with soft removal for uplink energy harvesting wireless network,Event-triggered feedback for power allocation in wireless networks,Game-theoretic beamforming techniques for multiuser multi-cell networks under mixed quality of service constraints,Hierarchical SIR and rate control on the forward link for CDMA data users under delay and error constraints,Pricing and power control in a multicell wireless data network,Optimal SIR-based power control in 3G wireless CDMA networks,New economic perspectives for resource allocation in wireless networks,A cross-layer power allocation scheme for CDMA wireless networks,Analysis of distributed power allocation in wireless networks under multiplicative noise and interference uncertainty,Energy Efficiency Optimization for Mobile Ad Hoc Networks,Discrete Transmit Power Devices in Dense Wireless Networks: Methodology and Case Study,Green Communication in Next Generation Cellular Networks: A Survey,Game-Theory-Based Distributed Power Splitting for Future Wireless Powered MTC Networks,Space division competitive access for infrastructured wireless mesh networks,Distributed transmit-power control in cognitive radio networks using a hybrid-adaptive game-theoretic technique,Impact of fading wireless channel on the performance of game theoretic power control algorithms for CDMA wireless data,Competition of wireless providers for atomic users: Equilibrium and social optimality,A power control game with smooth reduction of SINR objectives,A game theory-based distributed power control algorithm for femtocells,Revenue management for cognitive spectrum underlay networks: An interference elasticity perspective,Game-theoretic pricing and selection with fading channels,Automatic Modulation Classification for adaptive Power Control in cognitive satellite communications,An energy-efficient solution for packet-based transmissions with QoS constraints in the multibeam satellite downlink
A survey on 3GPP heterogeneous networks,"Aleksandar Damnjanovic, Juan Montojo, Yongbin Wei, Tingfang Ji, Tao Luo, Madhavan Vajapeyam, Taesang Yoo, Osok Song, Durga Malladi, ",2011,889,Dynamic frequency reuse based on guard regions in two-layer heterogeneous networks,Win–win relationship between macrocell and femtocells for spectrum sharing in LTE-A,CB-REFIM: a practical coordinated beamforming in multicell networks,User association with jointly maximising downlink sum rate and minimising uplink sum power for heterogeneous cellular networks,Load-aware user association with quality of service support in heterogeneous cellular networks,Improvements of femto-base station resource utilisation and ABS assignment convergence for dynamic ABS assignment,Joint energy-efficient resource allocation and interference alignment for HetNets,Adaptive transmission in heterogeneous networks,Pushing the Limits of LTE: A Survey on Research Enhancing the Standard,A Commercial Video-Caching System for Small-Cell Cellular Networks Using Game Theory,Energy Efficient Resource Allocation in D2D-Assisted Heterogeneous Networks with Relays,Optimum Biasing for Cell Load Balancing Under QoS and Interference Management in HetNets,Decoupled Downlink-Uplink Coverage Analysis with Interference Management for Enriched Heterogeneous Cellular Networks,Adaptive Resource Management Strategy in Practical Multi-Radio Heterogeneous Networks,Energy-Efficient Transceiver Design for Hybrid Sub-Array Architecture MIMO Systems,Secure Wireless Information and Power Transfer in Heterogeneous Networks,Energy Management in LTE Networks,Semi-Clustering of Victim-Cells Approach for Interference Management in Ultra-Dense Femtocell Networks,Resource Optimization in Multi-Tier HetNets Exploiting Multi-Slope Path Loss Model,Energy Efficiency Analysis of Heterogeneous Cellular Networks With Extra Cell Range Expansion,Analysis of Load Balancing and Interference Management in Heterogeneous Cellular Networks,Softwarization and Optimization for Sustainable Future Mobile Networks: A Survey,Joint Cell Activation and Selection for Green Communications in Ultra-Dense Heterogeneous Networks,Energy-Efficient Resource Allocation for mmWave Massive MIMO HetNets With Wireless Backhaul,Joint transceiver design and base station clustering for heterogeneous networks,Coverage and capacity in mmWave cellular systems,Simulated annealing user scheduling for coordinated heterogeneous MIMO networks,A unified analysis of CDF-based distributed scheduling in a heterogeneous multicell,Joint interference and user association optimization in cellular wireless networks,Leveraging interference for increasing throughput and reliability of commercial wireless femtocells
MicroGrids,"R. H. Lasseter, ",2002,868,Optimal scheduling of distributed energy storage systems by means of ACO algorithm,State space modeling of three-phase transformers for small-signal analysis of a microgrid,Cost analysis of renewable energy-based microgrids,A linear damping scheme for higher order dc-dc converters supplying constant-power loads in a dc microgrid,Modelling and control of interlinking converters between AC and DC buses in grid-connected microgrids,Sensorless unbalance correction as an ancillary service for LV 4-wire/3-phase power converters,Improved model predictive control for high voltage quality in microgrid applications,Model-predictive-control-based distributed control scheme for bus voltage unbalance and harmonics compensation in microgrids,A modified Q — V droop control for accurate reactive power sharing in distributed generation microgrid,Using consensus control for reactive power sharing of distributed electric springs,Voltage control by using capacitor banks and tap changing transformers in a renewable microgrid,Autonomous control of smart inverters in grid connected and islanded mode,Integration of hybrid renewable energy and its control in grid connected and islanded mode,A decentralized control method for series connected PV battery hybrid microgrid,A review on coordination and control of hybrid AC-DC micorgrid system,Metaheuristic approach to intelligent soultion of microgrid with storage element,Smart micro grid test system for agent based energy management system,A state of art review of microgrid control and integration aspects,Behavior of fault current in microgrid systems,Availability based distributed resource management of microgrid,A non-linear adaptive control strategy for grid connected DC microgrid,Impact of STATCOM on voltage profile in a DG penetrated grid connected system,Power sharing analysis of power-based droop control for DC microgrids considering cable impedances,Methodology for islanding operation of distributed synchronous generators,Mathematical morphology-based islanding detection for distributed generation,Optimal relay coordination and communication based protection for microgrid,Hybrid dual phase shift control of DC micro-grid coupled DAB DC-DC converter for storage application,A Matlab Simulink model for the study of smart grid — Grid-integrated vehicles interactions,A new control strategy of power sharing in islanded microgrids,PV-Battery-Diesel microgrid layout design based on stochastic optimization
On-chip high-voltage generation in MNOS integrated circuits using an improved voltage multiplier technique,"J. F. Dickson, ",1976,860,A CMOS Low Voltage Charge Pump,Design and analysis of on-chip charge pumps for micro-power energy harvesting applications,An efficient clock scheme for low-voltage four-phase charge pumps,An integrated RF energy harvester for UHF wireless powering applications,Single-wing ladder resonant multilevel converter,A low voltage pre start up circuit for thermal energy harvesting applications,Improved charge pump circuits for standard CMOS technologies,Comparison of positive and negative Dickson charge pump and Fibonacci charge pump,Practical aspects of realisation of negative charge pumps,Fitting simulated and measured parameters of Dickson charge pump,Fibonacci charge pump design test and measurement,An embedded charge pump for a Zener-based voltage reference compensated using a ΔVBE stack,Rectenna design for RF energy harvesting using CMOS 350nm and FDSOI 28nm,Self-Biased Differential Rectifier With Enhanced Dynamic Range for Wireless Powering,A Fully Integrated Multistage Cross-Coupled Voltage Multiplier With No Reversion Power Loss in a Standard CMOS Process,A 0.032-mm<sup>2</sup> 0.15-V Three-Stage Charge-Pump Scheme Using a Differential Bootstrapped Ring-VCO for Energy-Harvesting Applications,Low power constant output voltage RF-DC converter,A Low-EMI Fully Integrated Switched-Capacitor DC/DC Converter,An IC chip of a Dickson-type DC-DC converter with bootstrapped fate transfer switches,A highly efficient CMOS charge pump for 1.2 V supply voltage,Switched-capacitor power converter and its applications to future power net,Zero-Current-Switching Multilevel Modular Switched-Capacitor DC–DC Converter,Multiphase Multilevel Modular DC–DC Converter for High-Current High-Gain TEG Application,A Switched-Capacitor DC–DC Converter With High Voltage Gain and Reduced Component Rating and Count,A Long-Range UHF-Band Passive RFID Tag IC Based on High- $Q$ Design Approach,All-pMOS 50-V Charge Pumps Using Low-Voltage Capacitors,Modular Realization of Capacitive Converters Based on General Transposed Series–Parallel and Derived Topologies,Regulating the Output Voltage of the Resonant Switched-Capacitor Converters Below Their Resonant Frequencies,Analysis and Design of the Ladder Resonant Switched-Capacitor Converters for Regulated Output Voltage Applications,RFID Test Platform: Nonlinear Characterization
OpenSim: Open-Source Software to Create and Analyze Dynamic Simulations of Movement,"Scott L. Delp, Frank C. Anderson, Allison S. Arnold, Peter Loan, Ayman Habib, Chand T. John, Eran Guendelman, Darryl G. Thelen, ",2007,859,Musculoskeletal human-spacesuit interaction model,Demographic specific musculoskeletal models of factory worker performance fatigue and injury,Biomechanics of human locomotion with constraints to design flexible-wheeled biped robots,Socio-economic impact of medical lower-limb Exoskeletons,Influence of origins and insertions of muscles on artificial hip joint dislocation,Ergonomic Designs Based on Musculoskeletal Models,Using high-throughput computing for dynamic simulation of bipedal walking,Position and velocity cursor mappings contribute to distinct muscle forces in simulated isometric and movement reaching,Bio-inspired balance controller for a humanoid robot,The characterization of the kinematic and dynamic properties of the ankle joint for an artificial ankle joint design,A constrained Extended Kalman Filter for dynamically consistent inverse kinematics and inertial parameters identification,Isokinematic leg extension training with an industrial robot,Development and validation of a computational musculoskeletal model of the cat hind limb,Estimation of lower limbs angular positions using Kalman filter and genetic algorithm,Estimating the instantaneous wrist flexion angle from multi-channel surface EMG of forearm muscles,Developing an ankle-foot muscular model using Bayesian estimation for the influence of an ankle foot orthosis on muscles,Exploring possibilities for real-time muscle dynamics state estimation from EMG signals,Proprioceptivity and upper-extremity dynamics in robot-assisted reaching movement,Sit-to-Stand movement assistance using an actuated knee joint orthosis,Modeling and simulation of hand based on opensim and leap motion,EMG-driven model-based knee torque estimation on a variable impedance actuator orthosis,Integrating HLA and Service-Oriented Architecture in a Simulation Framework,Dynamics filter for walking trajectories from human motion capture,Muscle control of fore-aft and vertical body center of mass accelerations of human slip recovery gait: A simulation study using wearable sensor shoes,Cognitive cyber situational awareness using virtual worlds,Toward a Unified Framework for EMG Signals Processing and Controlling an Exoskeleton,A concept for Sensor Web Enablement employment in a high-volume layered sensing simulation environment,A Comprehensive Methodology to Visualize Articulations for the Physiological Human,Virtual Human Behavioural Profile Extraction Using Kinect Based Motion Tracking,A 6-DOF exoskeleton for head and neck motion assist with parallel manipulator and sEMG based control
