Multiplication noise in uniform avalanche diodes,"R. J. McIntyre, ",1966,859,Noise effects in avalanche photodiodes,Hg/sub 0.56/ Cd/sub 0.44/ Te 1.6- to 2.5- mu m avalanche photodiode and noise study far from resonant impact ionization,Effect of dead space on gain and noise of double-carrier-multiplication avalanche photodiodes,Time and frequency response of avalanche photodiodes with arbitrary structure,Lucky drift estimation of excess noise factor for conventional avalanche photodiodes including the dead space effect,IEEE 51st Annual Device Research Conference,Monte Carlo simulation of the effect of multiplication layer thickness in wide-bandwidth avalanche photodiodes,Hg/sub 0.4/Cd/sub 0.6/Te 1.55- mu m avalanche photodiode noise analysis in the vicinity of resonant impact ionization connected with the spin-orbit split-off band,1/f noise in short n-p/sup +/ diffusion-current-dominated (HgCd)Te avalanche photodiodes,Field and spatial geometry dependencies of the electron and hole ionization rates in GaAs/AlGaAs multiquantum well APD's,Amorphous silicon/silicon carbide superlattice avalanche photodiodes,Effect on the performance of staircase APDs of electron impact ionization within the graded-gap region,Theory of the temporal response of a simple multiquantum-well avalanche photodiode,Design considerations for high performance avalanche photodiode multiplication layers,Analysis of the noise factor of an avalanche photodiode operated in charge-storage mode,Correlation measurement of carrier multiplication noise sources in MOS transistors at low frequencies,Approaching fundamental limits on signal detection,Charge transport and device parameters from noise measurements,Double-drift avalanche photodetectors,Theory of the GaAs-doped p-i-n quantum well APD,Noise suppression effect in an avalanche multiplication photodiode operating in a charge accumulation mode,Mean gain of avalanche photodiodes in a dead space model,Generalized excess noise factor for avalanche photodiodes of arbitrary structure,A theory of multiplication noise,Responsivity and impact ionization coefficients of Si/sub 1-x/Ge/sub x/ photodiodes,Optical and noise characteristics of amorphous Si/SiC superlattice reach-through avalanche photodiodes,Effect of dead space on the excess noise factor and time response of avalanche photodiodes,An extremely low noise heterojunction IMPATT,Impact of local-negative-feedback on the MRS avalanche photodetector operation,Noise characteristics of avalanche photodiode arrays of the bevel-edge type
Neural networks for short-term load forecasting: a review and evaluation,"H. S. Hippert, C. E. Pedreira, R. C. Souza, ",2001,826,Attack-resilient estimation of switched nonlinear cyber-physical systems,Load forecasting as a computational tool to support smart grids,Short-Term Bus Load Forecasting of Power Systems by a New Hybrid Method,A Novel Approach to Forecast Electricity Price for PJM Using Neural Network and Similar Days Method,Short-Term Load Forecasting Methods: An Evaluation Based on European Data,Toward Estimating Autonomous Neural Network-Based Electric Load Forecasters,RBF Neural Network and ANFIS-Based Short-Term Load Forecasting Approach in Real-Time Price Environment,Short-Term and Midterm Load Forecasting Using a Bilevel Optimization Model,Analysis of Animal-Related Outages in Overhead Distribution Systems With Wavelet Decomposition and Immune Systems-Based Neural Networks,Density Forecasting for Long-Term Peak Electricity Demand,Notice of Violation of IEEE Publication Principles<br/>A Hybrid ARIMA and Neural Network Model for Short-Term Price Forecasting in Deregulated Market,Short-Term Load Forecasting Using Fuzzy Inductive Reasoning and Evolutionary Algorithms,On the Influence of Weather Forecast Errors in Short-Term Load Forecasting Models,Construction of Optimal Prediction Intervals for Load Forecasting Problems,Load Forecasting Using Hybrid Models,Secondary Forecasting Based on Deviation Analysis for Short-Term Load Forecasting,Electric Load Forecasting Based on Statistical Robust Methods,Short-Term Load Forecasting With a New Nonsymmetric Penalty Function,Short-Term Load Forecasting Based on a Semi-Parametric Additive Model,Interval Type-2 Fuzzy Logic Systems for Load Forecasting: A Comparative Study,Distribution System State Estimation Using an Artificial Neural Network Approach for Pseudo Measurement Modeling,Short-Term Predictability of Load Series: Characterization of Load Data Bases,Review on Implementation and Assessment of Conservation Voltage Reduction,Modeling and Validation of Electrical Load Profiling in Residential Buildings in Singapore,A Multi-Objective Method for Short-Term Load Forecasting in European Countries,A Bayesian-Based Approach for a Short-Term Steady-State Forecast of a Smart Grid,Two-Stage Charging Strategy for Plug-In Electric Vehicles at the Residential Transformer Level,A Robust Solution to the Load Curtailment Problem,Clustering-Based Improvement of Nonparametric Functional Time Series Forecasting: Application to Intra-Day Household-Level Load Curves,Analysis of Conservation Voltage Reduction Effects Based on Multistage SVR and Stochastic Process
Digital Computer Solution of Electromagnetic Transients in Single-and Multiphase Networks,"Hermann W. Dommel, ",1969,821,Compacting and partitioning-based simulation solution for frequency-dependent network equivalents in real-time digital simulator,Interfacing an EMT-type modular multilevel converter HVDC model in transient stability simulation,Efficient and accurate hybrid model of modular multilevel converters for large MTDC systems,Fundamental current phasor tracking using discrete Fourier transform extraction of Rogowski coil signal,Real-time simulation of large distribution networks with distributed energy resources,Computing transients on transmission lines in teaching electromagnetics,Prediction of transient electromagnetic environment in power networks,A new technique for simulating nonlinear loaded lossy lines,Coupling electric circuit and 2D-FEM model with Dommel's approach for transient analysis [of EM devices],Proximity losses computation with a 2D complex permeability modelling,A virtual lab for electric motors and drives,SPICE implementation of lossy transmission line and Schottky diode models,Rail transit chopper traction interference modeling using the SPICE circuit simulation package,Grounding techniques and induced surge voltage on the control signal cables,Grounding medium-voltage mobile or portable equipment,Modeling and simulation of interconnection delays and crosstalks in high-speed integrated circuits,Waveform relaxation analysis of RLCG transmission lines,Contents,Modeling of loaded uniform RC lines for computer-aided analysis,Algorithms for the transient simulation of lossy interconnect,A gradient-based algorithm for the state initialization of control systems,Application independent interactive environment for power systems education,A synchronous machine model for three-phase harmonic analysis and EMTP initialization,Closed loop testing of a joint VAr controller using a digital real-time simulator,Variable order and variable step-size integration method for transient analysis programs,Reader's guide to subsynchronous resonance,General purpose symbolic simulation tools for electric networks,Modelling of circuit breakers in the Electromagnetic Transients Program,Suppression of numerical oscillations in the EMTP power systems,An extensible real-time digital transient network analyzer
Fast Decoupled Load Flow,"B. Stott, O. Alsac, ",1974,810,Estimation of the largest eigenvalue in Chebyshev preconditioner for parallel conjugate gradient method-based power flow computation,Application of high-order Newton-like methods to solve power flow equations,Developed generalised unified power flow controller model in the Newton–Raphson power-flow analysis using combined mismatches method,Improved power flow robustness for personal computers,Tellegen's theorem and power systems-new load flow equations new solution methods,On-line power system security analysis,Analysis tools for power systems-contending with nonlinearities,Pre-screening of single contingencies causing network topology changes,Security-constrained reactive power dispatch,A method to compute reactive power margins with respect to voltage collapse,A power system CAD package for the workstation and personal computer environment,Approximate sparse vector techniques for power network solutions,Distribution factors of reactive power flow in transmission line and transformer outage studies,Critically coupled algorithms for solving the power flow equation,Fast linear programming state estimation using the dual formulation,An adaptive localization method for real-time security analysis,Vector computer implementation of power flow outage studies,Control variable adjustment in load flows,Implementation of the hypothesis testing identification in power system state estimation,Evaluation of a local DC load flow screening method for branch contingency selection of overloads,Adequacy equivalents in composite power system evaluation,MW/voltage control in a linear programming based optimal power flow,Expert systems for on line security assessment-A preliminary design,Adjusted solutions in fast decoupled load flow,Fast decoupled load flow: the hybrid model,A modification to the fast decoupled power flow for networks with high R/X ratios,Fast contingency screening and evaluation for voltage security analysis,Standardized sensitivity coefficients for power system networks,Improved simulation techniques for power system dynamics,Complete bounding method for AC contingency screening
Modern Wiener-Hopf design of optimal controllers--Part II: The multivariable case,"D. Youla, H. Jabr, J. Bongiorno, ",1976,809
PRIMA: passive reduced-order interconnect macromodeling algorithm,"A. Odabasioglu, M. Celik, L. T. Pileggi, ",1998,803,Krylov subspace method for passive reduced-order modelling of electrical networks,Gasping the impact of on-chip inductance,Rapid calculation of electrostatic Green's functions in layered dielectrics,Electromagnetic model order reduction for system-level modeling,Enhanced skin effect for partial-element equivalent-circuit (PEEC) models,Improved global rational approximation macromodeling algorithm for networks characterized by frequency-sampled data,Laguerre-SVD reduced-order modeling,Novel closed-form Green's function in shielded planar layered media,Macro-elements for efficient FEM simulation of small geometric features in waveguide components,Passive model reduction of multiport distributed interconnects,Efficient sensitivity analysis of transmission-line networks using model-reduction techniques,A general class of passive macromodels for lossy multiconductor transmission lines,A synthesis technique of time-domain interconnect models by MIMO type of selective orthogonal least-square method,Characterization and modeling of multiple coupled on-chip interconnects on silicon substrate,Efficient sensitivity analysis of lossy multiconductor transmission lines with nonlinear terminations,Equivalent Elmore delay for RLC trees,Clock skew verification in the presence of IR-drop in the power distribution network,Simulation of high-speed distributed interconnects using Krylov-space techniques,Equipotential shells for efficient inductance extraction,Exact and efficient crosstalk estimation,DTT: direct truncation of the transfer function - an alternative to moment matching for tree structured interconnect,A design system for RFIC: challenges and solutions,Simulation of high-speed interconnects,Progress in the methodologies for the electrical modeling of interconnects and electronic packages,Efficient passive circuit models for distributed networks with frequency-dependent parameters,Rules for robust generation of accurate reduced-order models for high-speed coupled interconnections,An all-purpose dispersive multiconductor interconnect model compatible with PRIMA,Nonlinear circuit-reduction of high-speed interconnect networks using congruent transformation techniques,A new finite element model for reduced order electromagnetic modeling,A method for reduced-order modeling and simulation of large interconnect circuits and its application to PEEC models with retardation
Promoting the use of end-to-end congestion control in the Internet,"S. Floyd, K. Fall, ",1999,782,An effective approach to alleviating the challenges of transmission control protocol,IQCM: a robust and efficient multimedia data recovery mechanism,Evaluating the impact of emerging streaming media applications on TCP/IP performance,Approximate fair dropping for variable length packets,Is max-min fairness achievable in the presence of insubordinate users?,Building trustworthy systems: lessons from the PTN and Internet,Layered quality adaptation for Internet video streaming,Transporting real-time video over the Internet: challenges and approaches,Internet multicast routing and transport control protocols,Video multicast over the Internet,Scalable fair reliable multicast using active services,Congestion control mechanisms and the best effort service model,A survey on TCP-friendly congestion control,TCP/IP modeling and validation,ABE: providing a low-delay service within best effort,TCP-friendly Internet video streaming employing variable frame-rate encoding and interpolation,Streaming video over the Internet: approaches and directions,Real-time streaming video with adaptive bandwidth control and DCT-based error concealment,Promoting the use of end-to-end congestion control in the Internet,Maintaining end-to-end throughput in a differentiated-services Internet,TCP-Peach: a new congestion control scheme for satellite IP networks,Modeling the effect of short-term rate variations on TCP-friendly congestion control behavior,Global Stability Analysis about a Congestion Control Scheme for Networks with Time Delay,Scalable proportional allocation of bandwidth in ip satellite networks,A New Schema Congestion Control to Promote Fairness in the Internet Traffic,A proposal of a streaming video system in best-effort networks using adaptive QoS control rules,Active congestion control mechanism for non-cumulative layered multicasting,Run-time adjusted congestion control for multimedia: experimental results,Zone-based routing algorithm for congestion control over the Internet,BPB: A method for transparently obtaining network path characteristics close to the sender
Optimal Residential Load Control With Price Prediction in Real-Time Electricity Pricing Environments,"Amir-Hamed Mohsenian-Rad, Alberto Leon-Garcia, ",2010,781,Model predictive control-based operation management for a residential microgrid with considering forecast uncertainties and demand response strategies,Dynamic demand response in smart buildings using an intelligent residential load management system,Fair and efficient energy consumption scheduling algorithm using tabu search for future smart grids,Dynamic incentive framework for demand response in distribution system using moving time horizon control,Methodology for ESS-type selection and optimal energy management in distribution system with DG considering reverse flow limitations and cost penalties,Accommodating renewable generation through an aggregator-focused method for inducing demand side response from electricity consumers,Global energy management system for cooperative networked residential green buildings,Coordinated residential energy resource scheduling with vehicle-to-home and high photovoltaic penetrations,Optimal single phase smart meter design,Demand side management controlling with personalised pricing method,Decentralized control of aggregated loads for demand response,A new pricing scheme for controlling energy storage devices in smart grid,Incentive-Driven Energy Trading in the Smart Grid,Energy Management Based on Demand-Side Pricing: A Supermodular Game Approach,A Learning Automaton-Based Scheme for Scheduling Domestic Shiftable Loads in Smart Grids,Maximizing photovoltaic array energy usage within a house using model predictive controla,Demand response program implementation in an energy district of domestic prosumers,PLEMS: Plug Load Energy Management Solution for Enterprises,Peak Load Scheduling in Smart Grid Communication Environment,Randomized pricing for the optimal coordination of opportunistic agents,Intelligent home management in the smart grids,Modeling and optimal scheduling of residential controllable load with TOU price,Modeling charging demands of various types of electric vehicles in an actual distribution system,Identification of realistic scheduling opportunities and base loads in smart homes using dynamic pricing and standard deviation of load profiles,A two-stage residential demand response framework for smart community with transformer aging,Optimal residential load scheduling in smart grid: A comprehensive approach,Maximizing return on investment of a grid-connected hybrid electrical energy storage system,DRL-cloud: Deep reinforcement learning-based resource provisioning and task scheduling for cloud service providers,Autonomous appliance scheduling based on time of use probabilities and load clustering,Optimal scheduling of conveyor belt systems under Critical Peak Pricing
Equivalent capacity and its application to bandwidth allocation in high-speed networks,"R. Guerin, H. Ahmadi, M. Naghshineh, ",1991,780,Performance analysis of flexible reuse in cellular networks,Routing virtual circuits with temporal QoS requirements in virtual path-based ATM networks,Analysis of a correlated queue in a communication system,Bandwidth allocation for multiple qualities of service using generalized processor sharing,On the estimation of buffer overflow probabilities from measurements,Effective bandwidth-based admission control for multiservice CDMA cellular networks,Statistical multiplexing with loss priorities in rate-based congestion control of high-speed networks,Long-range dependence in variable-bit-rate video traffic,A novel approach to estimating the cell loss probability in an ATM multiplexer loaded with homogeneous on-off sources,Squeezing the most out of ATM,A CAC scheme based on real-time cell loss estimation for ATM multiplexers,Multihop packet scheduling in WDM/TDM networks with nonnegligible transceiver tuning times,ATM technology for corporate networks,ATM local area networks,Traffic management for ATM local area networks,Neural networks in B-ISDN flow control: ATM traffic prediction or network modeling?,Call admission control schemes: a review,Bandwidth allocation and admission control in ATM networks with service separation,Design and analysis of a bandwidth management framework for ATM-based broadband ISDN,QUARTS-II: a routing simulator for ATM networks,TELPACK: an advanced teletraffic analysis package,Bandwidth management and congestion control in plaNET,Design of a power-spectrum-based ATM connection admission controller for multimedia communications,Performance analysis of single-link system with nonlinear equivalent capacity,Comparison of a genetic algorithm with a simulated annealing algorithm for the design of an ATM network,An analysis of the congestion effects of link failures in wide area networks,An architecture and methodology for mobile-executed handoff in cellular ATM networks,Predictive dynamic bandwidth allocation for efficient transport of real-time VBR video over ATM,An introduction to large deviations for communication networks,Large deviations approximation for fluid queues fed by a large number of on/off sources
Grid of the future,"Ali Ipakchi, Farrokh Albuyeh, ",2009,769,Active distribution network expansion planning integrating dispersed energy storage systems,Dynamic demand response in smart buildings using an intelligent residential load management system,Low-voltage ride-through concept in flyback inverterbased alternating current-photovoltaic modules,Scheduling algorithms for PHEV charging in shared parking lots,A distributed scheme for fair EV charging under transmission constraints,Convex optimal uncertainty quantification: Algorithms and a case study in energy storage placement for power grids,Demand response for chemical manufacturing using Economic MPC,Security of smart distribution grids: Data integrity attacks on integrated volt/VAR control and countermeasures,Privacy-optimal strategies for smart metering systems with a rechargeable battery,A tutorial on secure outsourcing of large-scale computations for big data,Distributed Generation Locating and Sizing in Active Distribution Network Considering Network Reconfiguration,Event-Driven Energy Trading System in Microgrids: Aperiodic Market Model Analysis With a Game Theoretic Approach,The solid-state transformer concept: A new era in power distribution,The gamified grid: Possibilities for utilising game-based motivational psychology to empower the Smart Social Grid,Mitigation of real power loss THD &amp; enhancement of voltage profile with optimal DG allocation using PSO &amp; sensitivity analysis,On the impact of SmartGrid metering infrastructure on load forecasting,Differentially private distributed protocol for electric vehicle charging,Simulation of a power line communication system in medium and low voltage distribution networks,Effect of transient conditions on DFT-based synchrophasor estimator performance,Secondary substation power line communications for medium voltage smart grids,A DFT-based synchrophasor frequency and ROCOF estimation algorithm,Measurement and communication interfaces for distributed generation in smart grids,An interface protection system with power line communication for distributed generators remote control,Functional requirements of next generation control center applications,Weather-based and conductor state measurement methods applied for dynamic line rating forecasting,Research and engineering practice of intelligent substation system,The typical construction mode research of intelligent distribution network,Grid interactions and stability analysis of distribution power network with high penetration of plug-in hybrid electric vehicles,Droop-free distributed control with event-triggered communication in DC micro-grid,An Electric Energy Balancing Model in a Medium Enterprise Grid
Optimal Power Flow Solutions,"Hermann W. Dommel, William F. Tinney, ",1968,747,Hybrid multi-swarm particle swarm optimisation based multi-objective reactive power dispatch,Solution of optimal reactive power dispatch by chaotic krill herd algorithm,Estimation of the largest eigenvalue in Chebyshev preconditioner for parallel conjugate gradient method-based power flow computation,Investigation and mathematical modelling of the impact of incentive signals to consumers on their consumption load forecast and network operation,Solution of reactive power optimisation including interval uncertainty using genetic algorithm,Effects of correlated photovoltaic power and load uncertainties on grid-connected microgrid day-ahead scheduling,Maximising wind generation through optimised operation of on-load tap changing transformers in active distribution networks,Distribution voltage control utilising the reactive power capabilities of wind generators,Coupling between knowledge-based and algorithmic methods,A comparison of probabilistic perturbation and deterministic based optimal power flow solutions,Combining loss and cost objectives in daily hydro-thermal economic scheduling,Optimization of fixed tap transformer setting in bulk electric systems,Security-constrained reactive power dispatch,Optimal power flow emulation of interchange brokerage systems using linear programming,A dual augmented Lagrangian approach for optimal power flow,Optimal operation of large-scale power systems,Power system remedial action methodology,Practical reactive power allocation/operation planning using successive linear programming,Adjusted solutions in fast decoupled load flow,Hydrothermal optimal power flow based on a combined linear and nonlinear programming methodology,Considerations in applying optimal power flow to power system operation,Daily generation scheduling optimization with transmission constraints: a new class of algorithms,Hydro-thermal power flow scheduling accounting for head variations,A least squares solution for optimal power flow sensitivity calculation,Discrete shunt controls in a Newton optimal power flow,A tutorial description of an interior point method and its applications to security-constrained economic dispatch,Correctability in online contingency analysis,An approach to standing phase angle reduction,A direct nonlinear predictor-corrector primal-dual interior point algorithm for optimal power flows,Active-reactive coupling in optimal reactive dispatch: a solution via Karush-Kuhn-Tucker optimality conditions
