"Fuzzy basis functions, universal approximation, and orthogonal least-squares learning","L. -X. Wang, J. M. Mendel, ",1992,1384,Adaptive fuzzy sliding mode control for large erection mechanism,Performance comparison of fused soft control/hard observer type controller with hard control/hard observer type controller for switched reluctance motors,Knowledge bounded least squares method for the identification of fuzzy systems,Channel estimation for OFDM systems using adaptive radial basis function networks,Assessment of cloud service provider quality metrics,An adaptive fuzzy logic enhancer for rejection of narrowband interference in DS-spread spectrum,Independent joint adaptive fuzzy control of robot manipulator,Constructive sufficient conditions for fuzzy logic controllers to approximate C/sup 1/ functions,Indirect adaptive fuzzy control of discrete-time nonlinear systems,Comparison and analysis of sufficient conditions for fuzzy systems as universal approximators,Approximation of C/sup 1/ functions and their derivative functions by SISO linear T-S fuzzy systems,Induction motor drives with direct torque control based on adaptive fuzzy control,A model reference adaptive control algorithm for fuzzy dynamic systems,T-S fuzzy system based on multi-resolution analysis and its function approximation,Adaptive Fuzzy Output Tracking Control of Nonlinear Systems via Backstepping,Controller Design for a Class of Nonlinear Systems Based on Fuzzy Hyperbolic Model,Kernel Method for Building Fuzzy Classifiers,Detection Algorithm and Application Based on Work Status Evaluator,Nonlinear system modeling and fault detection method using set membership estimation and T-S fuzzy model,Adaptive Fault-Tolerant Control of Rigid Body Using RBF Neural Networks,Granular Web Shopping Experts,Adaptive least trimmed squares fuzzy neural network,Fuzzy modeling method based on Rectangular Pyramid Fuzzy System,Learning Error Feedback Design of Direct Adaptive Fuzzy Control Systems,Decentralized Fault-Tolerant Control for Satellite Attitude Synchronization,Adaptive Fuzzy Control of a Class of Nonlinear Systems by Fuzzy Approximation Approach,Improved Structure Optimization for Fuzzy-Neural Networks,Fuzzy Logic System-Based Adaptive Fault-Tolerant Control for Near-Space Vehicle Attitude Dynamics With Actuator Faults,Distributive Equations of Fuzzy Implications Based on Continuous Triangular Conorms Given as Ordinal Sums,An Improved Estimation Method for Unmodeled Dynamics Based on ANFIS and Its Application to Controller Design
Cellular neural networks: applications,"L. O. Chua, L. Yang, ",1988,1364,A CNN-based passive optical range finder for real-time robotic applications,On edge and line linking with connectionist models,A cellular neural network for packet selection in a fast packet switching fabric with input buffers,Stability of a class of nonreciprocal cellular neural networks,A chaotic attractor with cellular neural networks,A CNN chip for connected component detection,On a class of nonsymmetrical neural networks with application to ADC,Cellular neural networks: theory,Stability of cellular neural networks with opposite-sign templates,Comments with reply on Chaos from third-order phase-locked loops with a slowly varying parameter by Y.-H. Chu et al,An analytic method for designing simple cellular neural networks,On the analysis of neural networks with asymmetric connection weights or noninvertible transfer functions,Cellular neural network for automated detection of geological lineaments on Radarsat images,Smart-pixel cellular neural networks in analog current-mode CMOS technology,Aspects of systems and circuits for nanoelectronics,Brain-implantable biomimetic electronics as the next era in neural prosthetics,An 0.5-/spl mu/m CMOS analog random access memory chip for TeraOPS speed multimedia video processing,Optimal solutions for cellular neural networks by paralleled hardware annealing,Color image processing in a cellular neural-network environment,A neural-network method for the nonlinear servomechanism problem,Global stability for cellular neural networks with time delay,Basic dynamics from a pulse-coupled network of autonomous integrate-and-fire chaotic circuits,A cellular neural network for clustering-based adaptive quantization in subband video compression,A CDMA communication detector with robust near-far resistance using paralleled array processors,Stability and dynamics of delay-type general and cellular neural networks,The CNN paradigm,On stability of cellular neural networks with delay,Bifurcation and chaos in cellular neural networks,Autowaves for image processing on a two-dimensional CNN array of excitable nonlinear circuits: flat and wrinkled labyrinths,The use of CNN models in the subcortical visual pathway
The Contract Net Protocol: High-Level Communication and Control in a Distributed Problem Solver,"R. G. Smith, ",1980,1357,Causal maps: theory implementation and practical applications in multiagent environments,Formalizing an engineering approach to cooperating knowledge-based systems,On agent-mediated electronic commerce,Distributed and reactive query planning in R-MAGIC: an agent-based multimedia retrieval system,DESP: a distributed economics-based subcontracting protocol for computation distribution in power-aware mobile ad hoc networks,Multiple Traveling Robot Problem: A Solution Based on Dynamic Task Selection and Robust Execution,Cloning Resource Exchange and RelationAdaptation: An Integrative Self-Organisation Mechanism in a Distributed Agent Network,An agent-based approach to reconfiguration of real-time distributed control systems,An architecture for scheduling and control in flexible manufacturing systems using distributed objects,Price-based approach for activity coordination in a supply network,Multi-robot coalition formation,IQ-ASyMTRe: Forming Executable Coalitions for Tightly Coupled Multirobot Tasks,Robust Execution of Service Workflows Using Redundancy and Advance Reservations,Agent-Based Cloud Computing,Automating Cloud Services Life Cycle through Semantic Technologies,Engineering mobile agent applications via context-dependent coordination,Frameworks for Cooperation in Distributed Problem Solving,An Optimization-Based Distributed Planning Algorithm: A Blackboard-Based Collaborative Framework,Holonic Ontology and Interaction Protocol for Manufacturing Network Organization,A Survey of Self-Organization Mechanisms in Multiagent Systems,Intelligent agent based framework for manufacturing systems control,A genetic approach for adaptive multiagent control in heterarchical manufacturing systems,Network-based distributed planning using coevolutionary agents: architecture and evaluation,What planner for ambient intelligence applications?,Agent-based modeling of supply chains for distributed scheduling,Dynamically Integrated Manufacturing Systems (DIMS)—A Multiagent Approach,Due-Date Management Through Iterative Bidding,The Rich Get Richer: Preferential Attachment in the Task Allocation of Cooperative Networked Multiagent Systems With Resource Caching,Agent-Based Interaction Protocols and Topologies for Manufacturing Task Allocation,A New Approach for the Validation of Conceptual Holonic Constructions
Deep Neural Networks for Acoustic Modeling in Speech Recognition: The Shared Views of Four Research Groups,"Geoffrey Hinton, Li Deng, Dong Yu, George E. Dahl, Abdel-rahman Mohamed, Navdeep Jaitly, Andrew Senior, Vincent Vanhoucke, Patrick Nguyen, Tara N. Sainath, Brian Kingsbury, ",2012,1334,Radar HRRP recognition based on discriminant deep autoencoders with small training data size,Speech reconstruction using a deep partially supervised neural network,Speaker verification with short utterances: a review of challenges trends and opportunities,Two-layer discriminative model for human activity recognition,Assessment of PD severity in gas-insulated switchgear with an SSAE,Artificial bandwidth extension using deep neural network-based spectral envelope estimation and enhanced excitation estimation,FPGA-based Acceleration of Deep Neural Networks Using High Level Method,Large-Scale Deep Belief Nets With MapReduce,Big Data Deep Learning: Challenges and Perspectives,Learning Deep Features for DNA Methylation Data Analysis,Hand Gesture Recognition Using Micro-Doppler Signatures With Convolutional Neural Network,Smartphone-Assisted Pronunciation Learning Technique for Ambient Intelligence,Phoneme Classification Using the Auditory Neurogram,Recognizing Emotions From Whispered Speech Based on Acoustic Feature Transfer Learning,DNN Filter Bank Cepstral Coefficients for Spoofing Detection,Enhanced Efficiency 3D Convolution Based on Optimal FPGA Accelerator,Input Layer Regularization of Multilayer Feedforward Neural Networks,Bearing Fault Diagnosis Using Fully-Connected Winner-Take-All Autoencoder,3-D BLE Indoor Localization Based on Denoising Autoencoder,3D Convolutional Neural Networks for Cross Audio-Visual Matching Recognition,Who Used My Smart Object? A Flexible Approach for the Recognition of Users,Hybrid Deep Neural Network--Hidden Markov Model (DNN-HMM) Based Speech Emotion Recognition,Sparse Autoencoder-Based Feature Transfer Learning for Speech Emotion Recognition,Recognition of emotional speech with convolutional neural networks by means of spectral estimates,Deep neural networks for anger detection from real life speech data,Evaluating Multi-Modal Speech Visualization Application for Deaf and Hard of Hearing People,On the interplay of network structure and gradient convergence in deep learning,A case study of speech recognition in Spanish: From conventional to deep approach,Deep neural networks for syllable based acoustic modeling in Chinese speech recognition,Context-dependent deep neural networks for commercial Mandarin speech recognition applications
Extreme Learning Machine for Regression and Multiclass Classification,"Guang-Bin Huang, Hongming Zhou, Xiaojian Ding, Rui Zhang, ",2012,1333,Fuzzy extreme learning machine for classification,Facial age estimation based on advanced ordinal ranking,SAR image segmentation based on analysing similarity with clutter spatial patterns,Automated detection of heart ailments from 12-lead ECG using complex wavelet sub-band bi-spectrum features,Neural class-specific regression for face verification,Indirect measurement and extreme learning machine based modelling for flux linkage of doubly salient electromagnetic machine,Wavelet-based extreme learning machine for distribution grid fault location,Chinese vehicle license plate recognition using kernel-based extreme learning machine with deep convolutional features,Selective harmonic eliminated V/f speed control of single-phase induction motor,Multiclass power quality events classification using variational mode decomposition with fast reduced kernel extreme learning machine-based feature selection,Efficient human motion capture data annotation via multi-view spatiotemporal feature fusion,High-Performance Extreme Learning Machines: A Complete Toolbox for Big Data Applications,Regularized Weighted Circular Complex-Valued Extreme Learning Machine for Imbalanced Learning,An Efficient and Effective Automatic Recognition System for Online Recognition of Foreign Fibers in Cotton,Healthcare Big Data Voice Pathology Assessment Framework,Recognizing Emotions From Whispered Speech Based on Acoustic Feature Transfer Learning,A Jacobian Matrix-Based Learning Machine and Its Applications in Medical Diagnosis,Predicting of Job Failure in Compute Cloud Based on Online Extreme Learning Machine: A Comparative Study,A New Hybrid Intelligent Framework for Predicting Parkinson’s Disease,Incremental and Decremental Extreme Learning Machine Based on Generalized Inverse,Data-Driven Inter-Turn Short Circuit Fault Detection in Induction Machines,Experimental Study on Extreme Learning Machine Applications for Speech Enhancement,Multi-Traffic Scene Perception Based on Supervised Learning,Pedestrian Dead-Reckoning Indoor Localization Based on OS-ELM,Representative Skyline Queries With Total and Partial Order Domains Using US-ELM,Action recognition using completed local binary patterns and multiple-class boosting classifier,Hyperspectral image classification using Gradient Local Auto-Correlations,Power system transient stability assessment based on online sequential extreme learning machine,Relative entropy normalized Gaussian supervector for speech emotion recognition using kernel extreme learning machine,Online sequential-extreme learning machine based detector on training-learning-detection framework
A direct adaptive method for faster backpropagation learning: the RPROP algorithm,"M. Riedmiller, H. Braun, ",1993,1179,Artificial Neural Network Based Adaptive Load Shedding for an Industrial Cogeneration Facility,The forward EEG solutions can be computed using artificial neural networks,Crack detection and recognition using an eddy current differential probe,Automatic analysis of facial expressions: the state of the art,Computer-aided diagnosis: a neural-network-based approach to lung nodule detection,A comparison of linear genetic programming and neural networks in medical data mining,Effects of phenotypic redundancy in structure optimization,Tracing patterns and attention: humanoid robot cognition,Advances in feedforward neural networks: demystifying knowledge acquiring black boxes,Exploiting domain-specific properties: compiling parallel dynamic neural network algorithms into efficient code,Performance evaluation of a sequential minimal radial basis function (RBF) neural network learning algorithm,Learning in the combinatorial neural model,Fast initialization for cascade-correlation learning,Bidirectional recurrent neural networks,Multiple reflection attenuation in seismic data using backpropagation,Optimization of HV electrode systems by neural networks using a new learning method,Neural networks for control,An adaptive critic global controller,An Augmented Reality Question Answering System Based on Ensemble Neural Networks,Audiovisual Detection of Laughter in Human-Machine Interaction,Novel Approaches for Minutiae Verification in Fingerprint Images,On a Successful Application of Multi-Agent Reinforcement Learning to Operations Research Benchmarks,Improved neural fitted Q iteration applied to a novel computer gaming and learning benchmark,A diagnostic approach for electro-mechanical actuators in aerospace systems,Comparison between geometry-based and Gabor-wavelets-based facial expression recognition using multi-layer perceptron,Application of Improved BP Network in the Flaws Evaluation of Conductive Materials,Quantification of Intermarket Influence Based on the Global Optimization and Its Application for Stock Market Prediction,Spiking neural networks for identification and control of dynamic plants,Neural Network Trainer through Computer Networks,Anomaly prediction in seismic signals using neural networks
Simple model of spiking neurons,"E. M. Izhikevich, ",2003,1174,An Extreme Learning Machine-Based Neuromorphic Tactile Sensing System for Texture Recognition,Nonlinear Dynamic Modeling of Synaptically Driven Single Hippocampal Neuron Intracellular Activity,Modeling of Multisensory Convergence with a Network of Spiking Neurons: A Reverse Engineering Approach,Nonlinear Dynamic Modeling of Neuron Action Potential Threshold During Synaptically Driven Broadband Intracellular Activity,Investigating the Neural Correlates of Pathological Cortical Networks in Alzheimer's Disease Using Heterogeneous Neuronal Models,Reduced Computational Models of Serotonin Synthesis Release and Reuptake,Biophysically Accurate Foating Point Neuroprocessors for Reconfigurable Logic,Model Order and Identifiability of Non-Linear Biological Systems in Stable Oscillation,A Neurally Controlled Computer Game Avatar With Humanlike Behavior,Peer-to-Peer Communication in Neuronal Nano-Network,A Novel Hybrid Spiking Neuron: Bifurcations Responses and On-Chip Learning,A Novel PWC Spiking Neuron Model: Neuron-Like Bifurcation Scenarios and Responses,Biologically Inspired Spiking Neurons: Piecewise Linear Models and Digital Implementation,Digital Multiplierless Implementation of Biological Adaptive-Exponential Neuron Model,Digital Multiplierless Realization of Two Coupled Biological Morris-Lecar Neuron Model,A CORDIC Based Digital Hardware For Adaptive Exponential Integrate and Fire Neuron,Scalable Networks-on-Chip Interconnected Architecture for Astrocyte-Neuron Networks,Homeostatic Fault Tolerance in Spiking Neural Networks: A Dynamic Hardware Perspective,Spiking and Bursting in Josephson Junction,Digital Multiplierless Realization of Two-Coupled Biological Hindmarsh–Rose Neuron Model,The neural communication network: A brief review on neuromodeling and neuroengineering,Effect of Transcranial Ultrasonic–Magnetic Stimulation on Two Types of Neural Firing Behaviors in Modified Izhikevich Model,A Structural Variation Classification Model for Image Quality Assessment,Which model to use for cortical spiking neurons?,The role of temporal parameters in a thalamocortical model of analogy,A MOSFET-based model of a class 2 nerve membrane,Learning Anticipation via Spiking Networks: Application to Navigation Control,Self-Sustained Irregular Activity in 2-D Small-World Networks of Excitatory and Inhibitory Neurons,Theoretical Model for Mesoscopic-Level Scale-Free Self-Organization of Functional Brain Networks,Multiagent Reinforcement Learning: Spiking and Nonspiking Agents in the Iterated Prisoner's Dilemma
Wavelet networks,"Q. Zhang, A. Benveniste, ",1992,1167,WN-based approach to melanoma diagnosis from dermoscopy images,Short-term forecasting of available parking space using wavelet neural network model,Hybrid forecasting model-based data mining and genetic algorithm-adaptive particle swarm optimisation: a case study of wind speed time series,A Novel Neuro-Wavelet Based Self-Tuned Wavelet Controller for IPM Motor Drives,Modeling the relationship between concurrent epicardial action potentials and bipolar electrograms,Single-sweep analysis of event-related potentials by wavelet networks-methodological basis and clinical application,Sup-norm approximation bounds for networks through probabilistic methods,Wavelet network-based detection and classification of transients,A wavelet networks-based method for the digital telecommunication system monitoring,Using wavelet neural networks for the optimal design of electromagnetic devices,Wavelet tools for improving the accuracy of neural network solution of electromagnetic inverse problems,Wavelet decomposition and radial basis function networks for system monitoring,The Chebyshev-polynomials-based unified model neural networks for function approximation,Learning methodology for failure detection and accommodation,Classifying biosignals with wavelet networks [a method for noninvasive diagnosis],Neural networks for classification: a survey,Using adaptive networks to model and control drug delivery,Accuracy analysis for wavelet approximations,Multidimensional wavelet frames,Learning algorithms for feedforward networks based on finite samples,Circular backpropagation networks for classification,Using wavelet network in nonparametric estimation,ScaleNet-multiscale neural-network architecture for time series prediction,Bayesian wavelet networks for nonparametric regression,Multiwavelet neural network and its approximation properties,Focused local learning with wavelet neural networks,Wavelet neural networks for function learning,Fast adaptive digital equalization by recurrent neural networks,Density function approximation using reduced sufficient statistics for joint estimation of linear and nonlinear parameters,Orthogonal wavelet neural networks applying to identification of Wiener model
Bidirectional associative memories,"B. Kosko, ",1988,1114,A bidirectional associative memory based on optimal linear associative memory,Timing and chunking in processing temporal order,Toward intelligent flight control,Designing bidirectional associative memories with optimal stability,Optimum learning for bidirectional associative memory in the sense of capacity,Asymmetric bidirectional associative memories,Anticipation-based temporal pattern generation,Stability capacity and statistical dynamics of second-order bidirectional associative memory,Model-base structures to support adaptive planning in command/control systems,Higher-ordered and intraconnected bidirectional associative memories,Real-time applications of neural nets,A switched capacitor bidirectional associative memory,Associative recall using a contraction operator,A heteroassociative memory using current-mode MOS analog VLSI circuits,A unified model for abduction-based reasoning,A deterministic capacity-finding method for multi-valued exponential BAM,Cognitive reasoning using fuzzy neural nets,Capacity analysis of the asymptotically stable multi-valued exponential bidirectional associative memory,Orthogonal schemes for bidirectional associative memories,Data compression by the recursive algorithm of exponential bidirectional associative memory,A general model for bidirectional associative memories,Multi-associative neural networks and their applications to learning and retrieving complex spatio-temporal sequences,A modular T-mode design approach for analog neural network hardware implementations,Complex temporal sequence learning based on short-term memory,Neural networks for fault location in substations,Characteristics of Hebbian-type associative memories having faulty interconnections,Weighted learning of bidirectional associative memories by global minimization,An analog feedback associative memory,A modified bidirectional decoding strategy based on the BAM structure,Performance analysis of the bidirectional associative memory and an improved model from the matched-filtering viewpoint
Backpropagation through time: what it does and how to do it,"P. J. Werbos, ",1990,1100,Using deep learning to detect price change indications in financial markets,Neural networks in control systems,Design of an adaptive power system stabilizer using recurrent neural networks,Long short-term memory based on a reward/punishment strategy for recurrent neural networks,Adjoint Systems for Models of Cell Signaling Pathways and their Application to Parameter Fitting,A method of pattern recognition based upon synthetic technology of fuzzy logic and neural network,Modeling and optimal control of batch processes using recurrent neuro-fuzzy networks,Fuzzy-Based Goal Representation Adaptive Dynamic Programming,Recurrent Neural Networks to Correct Satellite Image Classification Maps,Adaptive-critic-based optimal neurocontrol for synchronous generators in a power system using MLP/RBF neural networks,A Novel System-Centric Intelligent Adaptive Control Architecture for Damping Interarea Mode Oscillations in Power System,Recurrent Neural Networks Trained With Backpropagation Through Time Algorithm to Estimate Nonlinear Load Harmonic Currents,Respiratory Motion Estimation With Hybrid Implementation of Extended Kalman Filter,Precise Positioning of Nonsmooth Dynamic Systems Using Fuzzy Wavelet Echo State Networks and Dynamic Surface Sliding Mode Control,Sparse Coding-Inspired Optimal Trading System for HFT Industry,Time-delay neural network for the prediction of carbonation tower's temperature,Semi-Supervised Deep Learning Using Pseudo Labels for Hyperspectral Image Classification,Unsupervised Hierarchical Modeling of Driving Behavior and Prediction of Contextual Changing Points,Knowledge Graph Embedding: A Survey of Approaches and Applications,Grounded spoken language acquisition: experiments in word learning,EM-based optimization of microwave circuits using artificial neural networks: the state-of-the-art,A recurrent log-linearized Gaussian mixture network,Trajectory generation and modulation using dynamic neural networks,Query-based learning for aerospace applications,Markovian architectural bias of recurrent neural networks,Indirect adaptive control for synchronous Generator: comparison of MLP/RBF neural networks approach with Lyapunov stability analysis,Smooth function approximation using neural networks,Spiking perceptrons,An approximate internal model-based neural control for unknown nonlinear discrete processes,Training Recurrent Neurocontrollers for Robustness With Derivative-Free Kalman Filter
"30 years of adaptive neural networks: perceptron, Madaline, and backpropagation","B. Widrow, M. A. Lehr, ",1990,1096
