A fast and elitist multiobjective genetic algorithm: NSGA-II,"K. Deb, A. Pratap, S. Agarwal, T. Meyarivan, ",2002,10932,996017,https://ieeexplore.ieee.org/document/996017/,"Multi-objective evolutionary algorithms (MOEAs) that use non-dominated sorting and sharing have been criticized mainly for: (1) their O(MN/sup 3/) computational complexity (where M is the number of objectives and N is the population size); (2) their non-elitism approach; and (3) the need to specify a sharing parameter. In this paper, we suggest a non-dominated sorting-based MOEA, called NSGA-II (Non-dominated Sorting Genetic Algorithm II), which alleviates all of the above three difficulties. Specifically, a fast non-dominated sorting approach with O(MN/sup 2/) computational complexity is presented. Also, a selection operator is presented that creates a mating pool by combining the parent and offspring populations and selecting the best N solutions (with respect to fitness and spread). Simulation results on difficult test problems show that NSGA-II is able, for most problems, to find a much better spread of solutions and better convergence near the true Pareto-optimal front compared to the Pareto-archived evolution strategy and the strength-Pareto evolutionary algorithm - two other elitist MOEAs that pay special attention to creating a diverse Pareto-optimal front. Moreover, we modify the definition of dominance in order to solve constrained multi-objective problems efficiently. Simulation results of the constrained NSGA-II on a number of test problems, including a five-objective, seven-constraint nonlinear problem, are compared with another constrained multi-objective optimizer, and the much better performance of NSGA-II is observed."
A theory for multiresolution signal decomposition: the wavelet representation,"S. G. Mallat, ",1989,10221,192463,https://ieeexplore.ieee.org/document/192463/,"Multiresolution representations are effective for analyzing the information content of images. The properties of the operator which approximates a signal at a given resolution were studied. It is shown that the difference of information between the approximation of a signal at the resolutions 2/sup j+1/ and 2/sup j/ (where j is an integer) can be extracted by decomposing this signal on a wavelet orthonormal basis of L/sup 2/(R/sup n/), the vector space of measurable, square-integrable n-dimensional functions. In L/sup 2/(R), a wavelet orthonormal basis is a family of functions which is built by dilating and translating a unique function psi (x). This decomposition defines an orthogonal multiresolution representation called a wavelet representation. It is computed with a pyramidal algorithm based on convolutions with quadrature mirror filters. Wavelet representation lies between the spatial and Fourier domains. For images, the wavelet representation differentiates several spatial orientations. The application of this representation to data compression in image coding, texture discrimination and fractal analysis is discussed.<>",Diffusion LMP algorithm with adaptive variable power,Code generator for implementing dual tree complex wavelet transform on reconfigurable architectures for mobile applications,High-frequency-based features for low and high retina haemorrhage classification,Motion artefact removals for wearable ECG using stationary wavelet transform,Fault detection classification and location for transmission lines and distribution systems: a review on the methods,Singular value decomposition and wavelet-based iris biometric watermarking,Robust transcale decentralised estimation fusion for multisensor systems based on wavelet packet decomposition,Addressing the illumination challenge in two-dimensional face recognition: a survey,Fusion of structural and textural features for melanoma recognition,Condition monitoring of 11 kV overhead power distribution line insulators using combined wavelet and LBP-HF features,Reduced memory low complexity embedded image compression algorithm using hierarchical listless discrete tchebichef transform,Medical image denoising by generalised Gaussian mixture modelling with edge information,Bayesian denoising of ultrasound images using heavy-tailed Levy distribution,Image segmentation framework based on multiple feature spaces,Content-based image retrieval using fuzzy class membership and rules based on classifier confidence,Sparse representation based on vector extension of reduced quaternion matrix for multiscale image denoising,Scheme for unsupervised colour–texture image segmentation using neutrosophic set and non-subsampled contourlet transform,Texture classification by multifractal spectrum and barycentric coordinates of bit planes of wavelet coefficients,Fast Coiflet magnetic field integral equation for scattering from open rough surfaces,Development of backscatter sounding single-site location system,Short-term forecasting of ionospheric total electron content over a low-latitude global navigation satellite system station,Real-time fault analysis of transmission lines using wavelet multi-resolution analysis based frequency-domain approach,Proposal of a novel fitness function for evaluation of wavelet shrinkage parameters on partial discharge denoising,Robust zero-point attraction least mean square algorithm on near sparse system identification,Comparative study of automatic speech recognition techniques,Robust transcale state estimation for multiresolution discrete-time systems based on wavelet transform,Improved sub-band adaptive thresholding function for denoising of satellite image based on evolutionary algorithms,Search of a robust defect signature in gear systems across adaptive Morlet wavelet of vibration signals,Transforming the SMV model into MMV model based on the characteristics of wavelet coefficients,Computing the proximity operator of the ℓ<sub>p</sub> norm with 0 &lt; p &lt; 1
Image quality assessment: from error visibility to structural similarity,"Zhou Wang, A. C. Bovik, H. R. Sheikh, E. P. Simoncelli, ",2004,8442,1284395,https://ieeexplore.ieee.org/document/1284395/,"Objective methods for assessing perceptual image quality traditionally attempted to quantify the visibility of errors (differences) between a distorted image and a reference image using a variety of known properties of the human visual system. Under the assumption that human visual perception is highly adapted for extracting structural information from a scene, we introduce an alternative complementary framework for quality assessment based on the degradation of structural information. As a specific example of this concept, we develop a structural similarity index and demonstrate its promise through a set of intuitive examples, as well as comparison to both subjective ratings and state-of-the-art objective methods on a database of images compressed with JPEG and JPEG2000. A MATLAB implementation of the proposed algorithm is available online at http://www.cns.nyu.edu//spl sim/lcv/ssim/."
"Stochastic Relaxation, Gibbs Distributions, and the Bayesian Restoration of Images","Stuart Geman, Donald Geman, ",1984,7900,4767596,https://ieeexplore.ieee.org/document/4767596/,"We make an analogy between images and statistical mechanics systems. Pixel gray levels and the presence and orientation of edges are viewed as states of atoms or molecules in a lattice-like physical system. The assignment of an energy function in the physical system determines its Gibbs distribution. Because of the Gibbs distribution, Markov random field (MRF) equivalence, this assignment also determines an MRF image model. The energy function is a more convenient and natural mechanism for embodying picture attributes than are the local characteristics of the MRF. For a range of degradation mechanisms, including blurring, nonlinear deformations, and multiplicative or additive noise, the posterior distribution is an MRF with a structure akin to the image model. By the analogy, the posterior distribution defines another (imaginary) physical system. Gradual temperature reduction in the physical system isolates low energy states (``annealing''), or what is the same thing, the most probable states under the Gibbs distribution. The analogous operation under the posterior distribution yields the maximum a posteriori (MAP) estimate of the image given the degraded observations. The result is a highly parallel ``relaxation'' algorithm for MAP estimation. We establish convergence properties of the algorithm and we experiment with some simple pictures, for which good restorations are obtained at low signal-to-noise ratios.",Automatic object segmentation of unstructured scenes using colour and depth maps,Bhattacharyya distance-based irregular pyramid method for image segmentation,Vertebral body segmentation using a probabilistic and universal shape model,A comparison of deep multilayer networks and Markov random field matching models for face recognition in the wild,Integrating wavelet transformation with Markov random field analysis for the depth estimation of light-field images,Image segmentation by a new weighted student's t-mixture model,Image segmentation by dirichlet process mixture model with generalised mean,Texture and edge preserving multiframe super-resolution,Synthetic aperture radar image segmentation using fuzzy label field-based triplet Markov fields model,Robust moving object detection using compressed sensing,Insights into prior learning for despeckling SAR images,A neural network architecture for preattentive vision,Entropy reduction and decorrelation in visual coding by oriented neural receptive fields,Multiple current dipole estimation using simulated annealing,A Bayesian approach to introducing anatomo-functional priors in the EEG/MEG inverse problem,Global optimization in the localization of neuromagnetic sources,Combined MEG and EEG source imaging by minimization of mutual information,Three-dimensional blind deconvolution of SPECT images,Bayesian analysis of blood glucose time series from diabetes home monitoring,A multiresolution framework to MEG/EEG source imaging,Bayesian approach to segmentation of statistical parametric maps,A sensor array processing approach to object region detection,Digital systems for artificial neural networks,On the RLSA antenna optimum design for DBS reception,Cooperative vision integration through data-parallel neural computations,Programmable BIST space compactors,A theoretical analysis of Monte Carlo algorithms for the simulation of Gibbs random field images,Recursive structure of noncausal Gauss-Markov random fields,A generalized wavelet transform for Fourier analysis: the multiresolution Fourier transform and its application to image and audio signal analysis,Vector quantization by deterministic annealing
A method for registration of 3-D shapes,"P. J. Besl, Neil D. McKay, ",1992,6192,121791,https://ieeexplore.ieee.org/document/121791/,"The authors describe a general-purpose, representation-independent method for the accurate and computationally efficient registration of 3-D shapes including free-form curves and surfaces. The method handles the full six degrees of freedom and is based on the iterative closest point (ICP) algorithm, which requires only a procedure to find the closest point on a geometric entity to a given point. The ICP algorithm always converges monotonically to the nearest local minimum of a mean-square distance metric, and the rate of convergence is rapid during the first few iterations. Therefore, given an adequate set of initial rotations and translations for a particular class of objects with a certain level of 'shape complexity', one can globally minimize the mean-square distance metric over all six degrees of freedom by testing each initial registration. One important application of this method is to register sensed data from unfixtured rigid objects with an ideal geometric model, prior to shape inspection. Experimental results show the capabilities of the registration algorithm on point sets, curves, and surfaces.<>",Efficient scaling registration algorithm for partially overlapping point sets,Place recognition for visual loop-closures using similarities of object graphs,Efficient scan matching method using direction distribution,Adaptive 3D object registration based on point cloud distribution for mobile robot,Point match refinement through rigidity constraint and vote,View planning method for complete 3D digitisation of the scene,Effective scaling registration approach by imposing emphasis on scale factor,Towards X-ray free endovascular interventions – using HoloLens for on-line holographic visualisation,3D ear recognition using global and local features,Vertical edge-based mapping using range-augmented omnidirectional vision sensor,Soft shape registration under lie group frame,Contour matching using the affine-invariant support point set,Adaptive face modelling for reconstructing 3D face shapes from single 2D images,Nose tip detection on three-dimensional faces using pose-invariant differential surface features,Improvement of affine iterative closest point algorithm for partial registration,Rigid blocks matching method based on contour curves and feature regions,Effective outlier matches pruning algorithm for rigid pairwise point cloud registration using distance disparity matrix,Robust registration of partially overlapping point sets via genetic algorithm with growth operator,Reference-omitted affine soft correspondence algorithm,System for quantitative three-dimensional echocardiography of the left ventricle based on a magnetic-field position and orientation sensing system,A computer-assisted range image registration system for nuclear waste cleanup,Meshsweeper: dynamic point-to-polygonal mesh distance and applications,High-quality texture reconstruction from multiple scans,Extracting objects from range and radiance images,Sensor modeling probabilistic hypothesis generation and robust localization for object recognition,A mechanism of automatic 3D object modeling,Recovering the position and orientation of free-form objects from image contours using 3D distance maps,A spherical representation for recognition of free-form surfaces,Registering multiview range data to create 3D computer objects,Towards a general multi-view registration technique
Eigenfaces vs. Fisherfaces: recognition using class specific linear projection,"P. N. Belhumeur, J. P. Hespanha, D. J. Kriegman, ",1997,5790,598228,https://ieeexplore.ieee.org/document/598228/,"We develop a face recognition algorithm which is insensitive to large variation in lighting direction and facial expression. Taking a pattern classification approach, we consider each pixel in an image as a coordinate in a high-dimensional space. We take advantage of the observation that the images of a particular face, under varying illumination but fixed pose, lie in a 3D linear subspace of the high dimensional image space-if the face is a Lambertian surface without shadowing. However, since faces are not truly Lambertian surfaces and do indeed produce self-shadowing, images will deviate from this linear subspace. Rather than explicitly modeling this deviation, we linearly project the image into a subspace in a manner which discounts those regions of the face with large deviation. Our projection method is based on Fisher's linear discriminant and produces well separated classes in a low-dimensional subspace, even under severe variation in lighting and facial expressions. The eigenface technique, another method based on linearly projecting the image space to a low dimensional subspace, has similar computational requirements. Yet, extensive experimental results demonstrate that the proposed ""Fisherface"" method has error rates that are lower than those of the eigenface technique for tests on the Harvard and Yale face databases.",Sparse exponential discriminant analysis,A generalization of weighted sparse decomposition to negative weights,Hierarchical class-specific kernel discriminant analysis for face verification,Illumination invariant feature based on neighboring radiance ratio,Smile stages classification based on kernel Laplacian-lips using selection of non linear function maximum value,Rapid one-shot acquisition of dynamic VR avatars,Demonstration: Rapid one-shot acquisition of dynamic VR avatars,Multi-image morphing: Summarizing visual information from similar ancient coin image regions,Face recognition through mismatch driven representations of the face,Discriminant Locality Preserving Projections: A New Method to Face Representation and Recognition,On Channel Reliability Measure Training for Multi-Camera Face Recognition,Adaptive Fusion of Gait and Face for Human Identification in Video,Mosaicfaces: a discrete representation for face recognition,An analysis of facial shape and texture for recognition: A large scale evaluation on FRGC ver2.0,A sparse representation approach to face matching across plastic surgery,A novel method for post-surgery face recognition using sum of facial parts recognition,Composite Discriminant Factor analysis,Automatic 4D Facial Expression Recognition Using DCT Features,De-correlating CNN Features for Generative Classification,Unsupervised Feature Extraction Inspired by Latent Low-Rank Representation,A Multi-modal 2D + 3D Face Recognition Method with a Novel Local Feature Descriptor,Discriminative FaceTopics for face recognition via latent Dirichlet allocation,Person re-identification using multiple first-person-views on wearable devices,Describing Unseen Classes by Exemplars: Zero-Shot Learning Using Grouped Simile Ensemble,Robust feature extracted by the generalized optimal discriminant vectors for face recognition,Human facial recognition based on multiple feature domains,Face Recognition Based on Image Enhancement and Gabor Features,Face Recognition using Laplacian+OPRA-faces,Face recognition based on improved PCA reconstruction,Face recognition using improved local texture patterns
Multiple emitter location and signal parameter estimation,"R. Schmidt, ",1986,5277,1143830,https://ieeexplore.ieee.org/document/1143830/,"Processing the signals received on an array of sensors for the location of the emitter is of great enough interest to have been treated under many special case assumptions. The general problem considers sensors with arbitrary locations and arbitrary directional characteristics (gain/phase/polarization) in a noise/interference environment of arbitrary covariance matrix. This report is concerned first with the multiple emitter aspect of this problem and second with the generality of solution. A description is given of the multiple signal classification (MUSIC) algorithm, which provides asymptotically unbiased estimates of 1) number of incident wavefronts present; 2) directions of arrival (DOA) (or emitter locations); 3) strengths and cross correlations among the incident waveforms; 4) noise/interference strength. Examples and comparisons with methods based on maximum likelihood (ML) and maximum entropy (ME), as well as conventional beamforming are included. An example of its use as a multiple frequency estimator operating on time series is included.",Adaptation mode controller using multiple signal classification for GSC-based beamforming,Accurate calibration of mutual coupling for conformal antenna arrays,Fluorescence lifetime extraction algorithm based on multiple signal classification,High-resolution time of arrival estimation for OFDM-based transceivers,Subspace-based DOA estimation with sliding signal-vector construction for ULA,Fluorescence lifetime estimation method for incomplete decay,Partial spectral search-based DOA estimation method for co-prime linear arrays,Non-negative matrix factorisation-based subband decomposition for acoustic source localisation,High-resolution DOA estimation for cooperation networks using space-time hopping,Super-resolution orbital angular momentum based radar targets detection,Single source bins detection-based localisation scheme for multiple speech sources,Improved DOA estimation algorithm for co-prime linear arrays using root-MUSIC algorithm,Spatial rotation technique with application to unmanned underwater vehicle (UUV) sonar arrays,Joint spectrum sensing for detection of primary users using cognitive relays with evolutionary computing,Non-stationary additive noise modelling in direction-of-arrival estimation,Positioning via direct localisation in C-RAN systems,Acoustic signal based detection and localisation of faults in motorcycles,Real-valued sparse representation for single snapshot direction-of-arrival estimation in shipborne high-frequency surface wave radar,Comparison of the acoustic performance and positioning accuracy of three kinds of planar partial discharge ultrasonic array sensors,Off-grid fast relevance vector machine algorithm for direction of arrival estimation,Direction-of-arrival estimation of incoherently distributed sources using Bayesian compressive sensing,Joint angle and delay estimation for underwater acoustic multicarrier CDMA systems using a vector sensor,Multiple targets direction-of-arrival estimation in frequency scanning array antennas,Development of backscatter sounding single-site location system,Iterative subspace alternating projection method for GNSS multipath DOA estimation,Direction of arrival estimation using array of antennas for low-altitude targets in multi-path environment,Joint power distribution and direction of arrival estimation for wideband signals using sparse Bayesian learning,Three-dimensional super resolution ISAR imaging based on 2D unitary ESPRIT scattering centre extraction technique,Low-angle target tracking using frequency-agile refined maximum likelihood algorithm,Radar system with enhanced angular resolution based on a novel frequency scanning reflector antenna
Scale-space and edge detection using anisotropic diffusion,"P. Perona, J. Malik, ",1990,5270,56205,https://ieeexplore.ieee.org/document/56205/,"A new definition of scale-space is suggested, and a class of algorithms used to realize a diffusion process is introduced. The diffusion coefficient is chosen to vary spatially in such a way as to encourage intraregion smoothing rather than interregion smoothing. It is shown that the 'no new maxima should be generated at coarse scales' property of conventional scale space is preserved. As the region boundaries in the approach remain sharp, a high-quality edge detector which successfully exploits global information is obtained. Experimental results are shown on a number of images. Parallel hardware implementations are made feasible because the algorithm involves elementary, local operations replicated over the image.<>",Noise reduction in magnetic resonance images using adaptive non-local means filtering,Improved anisotropic diffusion filtering for sar image despeckling,Improvement of nonlinear diffusion equation using relaxed geometric mean filter for low PSNR images,Recursive anisotropic diffusion denoising,Efficient algorithm for piecewise-smooth model with approximately explicit solutions,Value of graph topology in vascular biometrics,Non-subsampled contourlet transform based image Denoising in ultrasound thyroid images using adaptive binary morphological operations,Noise modelling for denoising and three-dimensional face recognition algorithms performance evaluation,Improved anisotropic diffusion equation based on new non-local information scheme for image denoising,Fast smoothing technique with edge preservation for single image dehazing,Direction sensitive wavelet packet for despeckling of ultrasound images,Non-ideal iris segmentation using anisotropic diffusion,Development and evaluation of perceptually adapted colour gradients,Non-linear fourth-order telegraph-diffusion equation for noise removal,Two anisotropic fourth-order partial differential equations for image inpainting,Image fusion using multiscale edge-preserving decomposition based on weighted least squares filter,Removing Gaussian noise for colour images by quaternion representation and optimisation of weights in non-local means filter,Efficient image sharpening and denoising using adaptive guided image filtering,Edge preservation image enlargement and enhancement method based on the adaptive Perona–Malik non-linear diffusion model,Speckle filtering of ultrasound images using a modified non-linear diffusion model in non-subsampled shearlet domain,Active contours for image segmentation using complex domain-based approach,Localised rank-ordered differences vector filter for suppression of high-density impulse noise in colour images,Diffusion-steered super-resolution method based on the Papoulis–Gerchberg algorithm,Semi-guided bilateral filter,Modified ultrasound despeckling assessment index for the Field II simulated cyst image,Sparse PDE for SAR image speckle suppression,Synthetic aperture radar image segmentation using non-linear diffusion-based hierarchical triplet Markov fields model,Dynamic RGB-to-CMYK conversion using visual contrast optimisation,Fractional-order tensor regularisation for image inpainting,Unsupervised cluster-based method for segmenting biological tumour volume of laryngeal tumours in <sup>18</sup>F-FDG-PET images
